"Dir SCHWAB Updates Ownership of FEDEX CORP (FDX)","FDX-US,FDX","EDG","10:22am","29-Sep-10"
"Dir LOVEMAN Updates Ownership of FEDEX CORP (FDX)","FDX-US,FDX","EDG","10:15am","29-Sep-10"
"Dir LORANGER Updates Ownership of FEDEX CORP (FDX)","FDX-US,FDX","EDG"," 9:48am","29-Sep-10"
"Dir JACKSON Updates Ownership of FEDEX CORP (FDX)","FDX-US,FDX","EDG"," 9:41am","29-Sep-10"
"Dir HYDE III Updates Ownership of FEDEX CORP (FDX)","FDX-US,FDX","EDG"," 8:56am","29-Sep-10"
"Dir EDWARDSON Updates Ownership of FEDEX CORP (FDX)","FDX-US,FDX","EDG"," 8:22am","29-Sep-10"
"Dir BARKSDALE Updates Ownership of FEDEX CORP (FDX)","FDX-US,FDX","EDG"," 8:11am","29-Sep-10"
"Teamsters: Growing Support for Change in Board Leadership at FedEx","FDX-US","PRN"," 2:47pm","27-Sep-10"
"Teamsters Urge Congress to Stand Up to FedEx and Pass FAA Reauthorization","FDX-US","PRN","11:36am","24-Sep-10"
"Goldman Sachs is positive on FedEx ahead of analyst day","FDX-US,UPS-US","SA"," 4:26am","23-Sep-10"
"FedEx Express Canada Plans to Replace Entire 727 Air Fleet With Upgraded, More Environmentally-Friendly Aircraft by Early 2011","FDX-US,0037P3-E,FDX","CNW"," 2:59am","23-Sep-10"
"FedEx Express Expands First Overnight Service in U.S.","FDX-US,FDX","BW"," 6:30am","22-Sep-10"
"FedEx Corp.(FDX-US) Schedules Q4 2011 Earnings Release for 22-June-2011 8:00 AM ET","FDX-US","FCST","10:37am","21-Sep-10"
"FedEx Corp.(FDX) Schedules Q3 2011 Earnings Release for 17-March-2011 8:00 AM ET","FDX-US","FCST","10:37am","21-Sep-10"
"FedEx Kicks Off Eighth Annual FedEx Air & Ground® NFL Awards Program, Recognizing League's Top-Performing Quarterbacks and Running Backs","FDX-US,FDX","BW"," 7:05am","21-Sep-10"
"New FedEx Express Canada President Lisa Lisson A Customer Experience Expert and Innovator","FDX-US","CNW"," 2:59am","20-Sep-10"
"FEDEX CORP: 10-Q FactSet Blackline Report for period ending 8/31/2010","FDX-US","FBLK"," 1:39pm","17-Sep-10"
"FEDEX CORP files (10-Q) Basic quarterly filing, for period end 31-Aug-10 (FDX-US)","FDX-US,FDX","EDG"," 1:38pm","17-Sep-10"
"Analyst's Notes >> FEDEX CORP (Argus Research) 4 pages","FDX-US,IP-IT,IP-U...","FRC","12:35pm","17-Sep-10"
"FedEx downgraded to hold from buy at Argus Research","FDX-US","SA","11:14am","17-Sep-10"
"CALLSTREET REPORT: FedEx Corp.(FDX), Q1 2011 Earnings Call, 16-September-2010 8:30 AM ET","FDX-US","FCST","10:47am","16-Sep-10"
"FedEx mentioned positively at Piper","FDX-US","SA"," 8:18am","16-Sep-10"
"FEDERAL EXPRESS CORP files (8-K) Current report: Items 2.02 - Results of Operations, 9.01 - Financial Statements and Exhibits, for period end 16-Sep-10 (FDX-US)","FDX-US,FDX","EDG"," 5:00am","16-Sep-10"
"FedEx to combine its Freight and National LTL operations effective 30-Jan-11","FDX-US","SA"," 4:42am","16-Sep-10"
"Follow-up: FedEx reports Q1 operating income $628M vs StreetAccount $629M","FDX-US","SA"," 4:34am","16-Sep-10"
"FedEx reports Q1 EPS $1.20 vs Reuters $1.21","FDX-US","SA"," 4:29am","16-Sep-10"
"FedEx Corp. First Quarter Earnings Surge","FDX-US,0BP5R9-E,FDX","BW"," 4:27am","16-Sep-10"
"Rob Carter, FedEx Executive VP & CIO To Keynote CSR's Fourth Annual Locations & Beyond Summit","FDX-US,CSR.LSE","BW","12:38pm","15-Sep-10"
"FedEx Q1 (Aug) earnings preview","FDX-US","SA"," 6:56am","15-Sep-10"
"Zacks Earnings Preview: Oracle, Federal Express, Discover Financial, Kroger's and Best Buy","ORCL-US,FDX-US","BW"," 2:00pm","13-Sep-10"
"Seven Summits Research Releases Comments on Goldman Sachs, Best Buy, Kroger, FedEx and Pall Corp.","PLL-US,KR-US,GS-U...","PRN"," 6:31am","13-Sep-10"
"ATP and FedEx Announce New Global Sponsorship","FDX-US,FDX","BW"," 5:00am","8-Sep-10"
"Analyst's Notes >> FEDEX CORP (Argus Research) 5 pages","FDX-US,MORN-US","FRC","11:45am","7-Sep-10"
"Professional Research on FedEx and United Parcel Service - Business Recovery Dictates Expansion Globally for Air Delivery & Freight Services ","FDX-US,UPS-US","MW"," 5:48am","30-Aug-10"
"Ownership Updates: FEDEX CORP  COM (FDX) for 26-Aug-2010","FDX-US,31428X10","FIO"," 3:29am","26-Aug-10"
"FedEx Corp.(FDX) Schedules Q1 2011 Earnings Call for 16-September-2010 8:30 AM ET","FDX-US","FCST"," 5:43am","25-Aug-10"
"FedEx seeking to block probe by NY AG Cuomo into the declared value of shipped items and FDX liability on those shipments -- WSJ","FDX-US","SA"," 2:46pm","24-Aug-10"
"FedEx Corp. Board Declares Quarterly Dividend","FDX-US,FDX","BW"," 8:25am","23-Aug-10"
"Scan Added:  FEDEX CORP files (ARS) Annual report to security holders (paper filing), for period end 31-May-10 (FDX-US)","FDX-US,FDX","EDG"," 2:19pm","17-Aug-10"
"Critical Insider Trade Alerts for Atmel, Amazon, Murphy Oil, FedEx, Tempur Pedic, & Target; Reported by Insiderslab.com","TPX-US,MUR-US,FDX...","PRNA"," 7:09am","17-Aug-10"
"Ownership Updates: FEDEX CORP  COM (FDX) for 17-Aug-2010","FDX-US,31428X10","FIO"," 2:28am","17-Aug-10"
"FEDEX CORP files (DEF 14A) Definitive proxy statements, for period end 27-Sep-10 (FDX-US)","FDX-US,FDX","EDG"," 1:46pm","16-Aug-10"
"FedEx Ground Names Entrepreneurs of the Year","FDX-US,FDX","BW","12:51pm","16-Aug-10"
"Critical Alerts for BP, Starbucks, FedEx, Kinross Gold, and Tempur Pedic Released by Seven Summits Research","TPX-US,K-CA,FDX-U...","PRN"," 6:31am","16-Aug-10"
"Ownership Updates: FEDEX CORP  COM (FDX) for 15-Aug-2010","FDX-US,31428X10","FIO"," 2:07am","15-Aug-10"
"FDX CORPORATION (FDX=US)  12-months forecast (Pechala's Reports) 1 page","FDX-US","FRC"," 6:15pm","13-Aug-10"
"FedEx Delivers Two Sight-Saving Programs in Southeast Asia Through ORBIS Flying Eye Hospital","FDX-US","PRN"," 6:18am","11-Aug-10"
"Twelve FedEx Drivers Earn Honors at National Truck Driving Championships","FDX-US,FDX","BW"," 7:00am","10-Aug-10"
"Ownership Updates: FEDEX CORP  COM (FDX) for  8-Aug-2010","FDX-US,31428X10","FIO"," 9:38am","8-Aug-10"
"Ownership Updates: FEDEX CORP  COM (FDX) for  7-Aug-2010","FDX-US,31428X10","FIO"," 2:58am","7-Aug-10"
"FEDEX CORP files (CT ORDER) Confidential treatment order by SEC (FDX-US)","FDX-US,FDX","EDG","11:07am","5-Aug-10"
"Ownership Updates: FEDEX CORP  COM (FDX) for  4-Aug-2010","FDX-US,31428X10","FIO"," 2:58am","4-Aug-10"
"FedEx Trade Networks Adds Three Freight Forwarding Offices in Europe","FDX-US,0037PN-E,FDX","BW"," 6:00am","3-Aug-10"
"Teamsters Say FedEx Filibuster of FAA Reauthorization Bill Must End","FDX-US","PRN"," 2:21pm","30-Jul-10"
"CEO BRONCZEK Gifts 3,050 of FEDEX CORP (FDX)","FDX-US,FDX","EDG"," 8:49am","29-Jul-10"
"Dir ESTRIN Acquires 8,000 of FEDEX CORP (FDX)","FDX-US,FDX","EDG"," 7:10am","29-Jul-10"
"Canadians really clean-up at North American Youth Business Competition","FDX-US,FDX,HPQ","CNW"," 7:00am","27-Jul-10"
"Follow-up: FedEx guides Q1 EPS to $1.05-1.25 vs prior $0.85-1.05 and Reuters $1.00","FDX-US","SA"," 6:03am","26-Jul-10"
"FedEx guides Q1 EPS to $1.05-1.25 vs prior $0.85-1.05 and Reuters $1.00","FDX-US","SA"," 6:01am","26-Jul-10"
"FedEx Corp. Increases Earnings Outlook","FDX-US,FDX","BW"," 6:00am","26-Jul-10"
"FedEx Corp.(FDX-US) Schedules Investors and Lenders Meeting for 29-September-2010 10:00 AM ET","FDX-US","FCST","12:51pm","23-Jul-10"
"Large Trades Made by Insiders in Delta Air Lines, Atheros, FedEx, UAL Corp, Newmont Mining, & Apollo; Reported by Insiderslab.com","FDX-US,DAL-US","PRN"," 7:00am","20-Jul-10"
"Junior Achievement Announces Finalists in 2010 North American JA Company of the Year Competition","FDX-US","PRN","10:15pm","18-Jul-10"
"Critical Alerts For BP, Deere, FedEx, Whole Foods, and Live Nation Released by Seven Summits Research","LYV-US,FDX-US,DE-...","PRN"," 6:31am","16-Jul-10"
"Research and Markets: FedEx Corporation - SWOT Framework Analysis","FDX-US","BW"," 5:15am","16-Jul-10"
"FEDEX CORP files (10-K) Basic annual filing, for period end 31-May-10 (FDX-US)","FDX-US,FDX","EDG","12:33pm","15-Jul-10"
"FEDEX CORP: 10-K FactSet Blackline Report for period ending 5/31/2010","FDX-US","FBLK","12:33pm","15-Jul-10"
"U.S. Chamber BCLC, InterAction, FedEx Launch Initiative to Map Recovery Projects in Haiti","FDX-US,06WSF1-E","PRN","10:15am","15-Jul-10"
"Susquehanna Financial Group Hires Matt Troy as Senior Analyst to Cover the Transportation Services Sector","JBHT-US,FDX-US,EX...","PRN"," 8:00am","14-Jul-10"
"FedEx to Send 114 Drivers to National Truck Driving Championships","FDX-US,FDX","BW"," 6:00am","14-Jul-10"
"FedEx upgraded to buy from hold at BB&T Capital Markets","FDX-US","SA"," 4:19am","12-Jul-10"
"FedEx Trade Networks Announces New Alliance with Fritz Companies Israel","FDX-US,0037PN-E,FDX","BW"," 6:00am","6-Jul-10"
"Endangered Sea Turtle Nests to Receive Special Transportation","FDX-US,FDX","BW"," 3:09pm","1-Jul-10"
"Consumer Confidence Freighted South Once Again ","FDX-US,EXPD-US","MW"," 5:36am","1-Jul-10"
"FedEx Ground to Build Fifth Major Chicagoland Distribution Facility in Grayslake","FDX-US,FDX","BW"," 7:00am","25-Jun-10"
"9th Circuit Court of Appeals Agrees With Civil Rights Attorney, Illston's Imposed $25,000 Sanction Was Illegal","FDX-US","PRN","10:27am","23-Jun-10"
"Dir SCHWAB Buys 427 of FEDEX CORP (FDX)","FDX-US,FDX","EDG"," 8:07am","22-Jun-10"
"FedEx CEO Smith Testifies on Plan to End Oil Dependence","FDX-US","PRN"," 7:30am","22-Jun-10"
"FedEx target increased to $99 from $97 at Goldman Sachs","FDX-US","SA"," 8:35am","18-Jun-10"
"Senate Commerce Committee Chairman Rockefeller tells WSJ FedEx unionization proposal unlikely to pass","FDX-US,UPS-US","SA"," 2:12pm","17-Jun-10"
"Zacks Analyst Blog Highlights: FedEx, Boeing, General Dynamics, Lockheed Martin and Northrop Grumman","NOC-US,LMT-US,GD-...","BW"," 2:00pm","17-Jun-10"
"CALLSTREET REPORT: FedEx Corp.(FDX-US), Q4 2010 Earnings Call, 16-June-2010 8:30 AM ET","FDX-US","FCST"," 1:45pm","16-Jun-10"
"FEDERAL EXPRESS CORP files (8-K) Current report: Items 2.02 - Results of Operations, 5.02 - Changes in Exec Management, 9.01 - Financial Statements and Exhibits, for period end 10-Jun-10 (FDX-US)","FDX-US,FDX","EDG"," 5:00am","16-Jun-10"
"Follow-up: FedEx reports Q4 operating income $696M","FDX-US","SA"," 4:53am","16-Jun-10"
"FedEx reports Q4 EPS $1.33 vs Reuters $1.32","FDX-US","SA"," 4:46am","16-Jun-10"
"FedEx Corp. Reports Higher Fourth Quarter and Full Year Earnings","FDX-US,FDX","BW"," 4:45am","16-Jun-10"
"FedEx Corp. Reports Higher Fourth Quarter and Full Year Earnings","FDX-US","FFR"," 9:00pm","15-Jun-10"
"Large Trades Made by Insiders in Best Buy, Fedex, Kroger, Home Depot, & US Bancorp; Reported by Insiderslab.com","HD-US,FDX-US","PRNA"," 7:06am","15-Jun-10"
"Fitch Solutions: FedEx CDS Widen 23%; Kroger 29% Wider","FDX-US","BW"," 3:58am","15-Jun-10"
"FedEx fiscal Q4 (May) earnings preview","FDX-US","SA","10:00am","14-Jun-10"
"Seven Summits Research Releases Comments on Morgan Stanley, Best Buy, FedEx, Kroger and Smucker's","KR-US,FDX-US,089P...","PRN"," 6:31am","14-Jun-10"
"Allegation CBC's Richard Stursberg aware of 'Mediascam'","FDX-US","CNW"," 4:32am","10-Jun-10"
"CEO BRONCZEK Acquires 10,285 of FEDEX CORP (FDX)","FDX-US,FDX","EDG"," 9:53am","9-Jun-10"
"CEO REBHOLZ Acquires 6,600 of FEDEX CORP (FDX)","FDX-US,FDX","EDG"," 9:49am","9-Jun-10"
"CEO LOGUE Acquires 6,600 of FEDEX CORP (FDX)","FDX-US,FDX","EDG"," 9:43am","9-Jun-10"
"CEO SMITH Updates Ownership of FEDEX CORP (FDX)","FDX-US,FDX","EDG"," 9:38am","9-Jun-10"
"VP MERINO Acquires 2,050 of FEDEX CORP (FDX)","FDX-US,FDX","EDG"," 9:34am","9-Jun-10"
"EVP RICHARDS Acquires 8,000 of FEDEX CORP (FDX)","FDX-US,FDX","EDG"," 9:29am","9-Jun-10"
"CFO GRAF JR Acquires 8,000 of FEDEX CORP (FDX)","FDX-US,FDX","EDG"," 9:23am","9-Jun-10"
"EVP GLENN Acquires 8,000 of FEDEX CORP (FDX)","FDX-US,FDX","EDG"," 9:17am","9-Jun-10"
"CIO CARTER Acquires 8,000 of FEDEX CORP (FDX)","FDX-US,FDX","EDG"," 9:09am","9-Jun-10"
"FedEx increases quarterly dividend by 9.1% to $0.12 from $0.11","FDX-US","SA"," 1:05pm","7-Jun-10"
"FedEx Corp. Board Declares Quarterly Dividend","FDX-US,FDX","BW"," 1:05pm","7-Jun-10"
"Campaign Launches New Video Mocking Claim That FedEx is an Airline","FDX-US","PRN","11:57am","7-Jun-10"
"Pure Industrial Real Estate Trust Closes $7.05 Million Previously-Announced Acquisition","FDX-US,AAR.UT-CA,...","PRN"," 1:10pm","4-Jun-10"
"FedEx Corp.(FDX) Schedules Q2 2011 Earnings Release for 16-December-2010 8:00 AM ET","FDX-US","FCST","10:23am","4-Jun-10"
"FedEx Corp.(FDX) Schedules Q1 2011 Earnings Release for 16-September-2010","FDX-US","FCST","10:23am","4-Jun-10"
"FedEx Corp.(FDX-US) Schedules Q4 2010 Earnings Call for 16-June-2010 8:30 AM ET","FDX-US","FCST","10:23am","4-Jun-10"
"Illinois FedEx Drivers Are Employees, Not Independent Contractors, Orders Federal Court in First Summary Judgment Ruling in Multi-District Litigation Over Drivers' Employment Status","FDX-US","PRN"," 9:16am","3-Jun-10"
"FedEx Appoints Gerald P. Leary as Regional President For Europe, Middle East, Indian Subcontinent and Africa","FDX-US,0BP5R9-E,FDX","BW"," 1:00am","1-Jun-10"
"Critical Alerts For Oracle Corp, UnitedHealth, FedEx, Daimler, and Cameco Released By Seven Summits Research","UNH-US,FDX-US,DAI...","PRN"," 6:31am","28-May-10"
"Analyst's Notes >> FEDEX CORP (Argus Research) 5 pages","FDX-US","FRC","12:41pm","20-May-10"
"Ownership Updates: FEDEX CORP  COM (FDX) for 19-May-2010","FDX-US,31428X10","FIO"," 2:58am","19-May-10"
"FedEx Trade Networks Opens Three New Offices in Europe and the Middle East","FDX-US,0037PN-E,FDX","BW"," 6:00am","18-May-10"
"Ownership Updates: FEDEX CORP  COM (FDX) for 18-May-2010","FDX-US,31428X10","FIO"," 4:08am","18-May-10"
"FedEx names Kim Dixon as COO effective 1-Jun","FDX-US","SA"," 7:01am","11-May-10"
"FedEx Office Names Kim Dixon Chief Operating Officer","FDX-US,FDX","BW"," 7:00am","11-May-10"
"FEDERAL EXPRESS CORP files (8-K) Current report: Item 1.01 - Entry into Definitive Agreement, for period end 30-Apr-10 (FDX-US)","FDX-US,FDX","EDG"," 1:57pm","6-May-10"
"Small Businesses Believe They Will Lead the U.S. out of Recession According to Third Annual FedEx Office Survey","FDX-US,FDX","BW"," 6:30am","5-May-10"
"FEDEX CORP files (CT ORDER) Confidential treatment order by SEC (FDX-US)","FDX-US,FDX","EDG"," 9:09am","29-Apr-10"
"FedEx CEO Smith Testifies on Energy Security, Electrification","FDX-US","PRN","11:47am","28-Apr-10"
"Critical Alerts for Oracle, FedEx, Bank of New York Mellon, Virgin Media, and LM Ericsson Released by Seven Summits Research","VMED-US,FDX-US,BK...","PRN"," 6:31am","28-Apr-10"
"Teamsters Launch Campaign: 'FedEx Drivers Aren't Pilots'","FDX-US","PRN"," 4:00am","28-Apr-10"
"Ownership Updates: FEDEX CORP  COM (FDX) for 22-Apr-2010","FDX-US,31428X10","FIO"," 3:27am","22-Apr-10"
"FedEx Releases 2009 Citizenship Report, Unveils EarthSmart","FDX-US,FDX","BW"," 6:00am","20-Apr-10"
"FedEx Ground Receives Award for Development of Once Contaminated Property","FDX-US,FDX","BW"," 9:00am","15-Apr-10"
"FedEx Office, Canon U.S.A. and HP Collaborate to Redefine Retail Printing","HPQ-US,FDX-US,775...","BW"," 6:00am","13-Apr-10"
"FedEx Plans Green Industries Trade Mission to Europe","FDX-US,FDX","BW"," 5:00am","8-Apr-10"
"CEO REBHOLZ Sells 20,250 of FEDEX CORP (FDX)","FDX-US,FDX","EDG"," 8:44am","7-Apr-10"
"FedEx Simplifies International Shipping with FedEx Electronic Trade Documents","FDX-US,FDX","BW"," 5:00am","5-Apr-10"
"CEO LOGUE Acquires 2,105 of FEDEX CORP (FDX)","FDX-US,FDX","EDG"," 7:47am","2-Apr-10"
"Dir WALSH Sells 4,000 of FEDEX CORP (FDX)","FDX-US,FDX","EDG"," 7:21am","2-Apr-10"
"Dir SCHWAB Buys 408 of FEDEX CORP (FDX)","FDX-US,FDX","EDG","11:45am","1-Apr-10"
"CEO SMITH Sells 183,350 of FEDEX CORP (FDX)","FDX-US,FDX","EDG"," 7:03am","31-Mar-10"
"FedEx Expands International Economy Services","FDX-US,FDX","BW"," 6:00am","30-Mar-10"
"FedEx Introduces First All-Electric Trucks To Be Used in the U.S. Parcel Delivery Business","FDX-US,FDX","BW"," 6:00am","29-Mar-10"
"Ownership Updates: FEDEX CORP  COM (FDX) for 27-Mar-2010","FDX-US,31428X10","FIO"," 2:58am","27-Mar-10"
"CEO BRONCZEK Acquires 1,372 of FEDEX CORP (FDX)","FDX-US,FDX","EDG","12:39pm","25-Mar-10"
"NASCAR Star Denny Hamlin Helps Rev Up March for Babies(R)","FDX-US,07YZT5-E,FDX","PRN"," 9:50am","25-Mar-10"
"CEO LOGUE Sells 4,035 of FEDEX CORP (FDX)","FDX-US,FDX","EDG"," 9:46am","25-Mar-10"
"CFO GRAF JR Sells 56,250 of FEDEX CORP (FDX)","FDX-US,FDX","EDG"," 8:35am","25-Mar-10"
"FedEx CEO sends letter asking employees, contractors to oppose labor provision in House bill - Commercial Appeal","BA-US,DPW-DE,FDX-...","SA"," 1:23am","24-Mar-10"
"CIO CARTER Sells 27,945 of FEDEX CORP (FDX)","FDX-US,FDX","EDG"," 8:29am","23-Mar-10"
"CEO BRONCZEK Sells 58,141 of FEDEX CORP (FDX)","FDX-US,FDX","EDG","12:27pm","22-Mar-10"
"VP MERINO Sells 5,640 of FEDEX CORP (FDX)","FDX-US,FDX","EDG"," 9:30am","22-Mar-10"
"Analyst's Notes >> FEDEX CORPORATION (Argus Research) 4 pages","FDX-US","FRC","12:50pm","19-Mar-10"
"FEDEX CORP: 10-Q FactSet Blackline Report for period ending 2/28/2010","FDX-US","FBLK"," 9:36am","19-Mar-10"
"FEDEX CORP files (10-Q) Basic quarterly filing, for period end 28-Feb-10 (FDX-US)","FDX-US,FDX","EDG"," 9:35am","19-Mar-10"
"FedEx Corp.(FDX) Schedules Annual General Meeting for 27-September-2010 11:00 AM ET","FDX-US","FCST"," 6:29am","19-Mar-10"
"CALLSTREET REPORT: FedEx Corp.(FDX-US), Q3 2010 Earnings Call, 18-March-2010 8:30 AM ET","FDX-US","FCST","12:51pm","18-Mar-10"
"FEDERAL EXPRESS CORP files (8-K) Current report: Items 2.02 - Results of Operations, 9.01 - Financial Statements and Exhibits, for period end 18-Mar-10 (FDX-US)","FDX-US,FDX","EDG"," 5:08am","18-Mar-10"
"Follow-up: FedEx reports Q3 operating income $416M","FDX-US","SA"," 4:55am","18-Mar-10"
"FedEx reports Q3 EPS $0.76 vs Reuters $0.73","FDX-US","SA"," 4:45am","18-Mar-10"
"FedEx Corp. Third Quarter Net Income Grows as Economy Strengthens","FDX-US,FDX","BW"," 4:45am","18-Mar-10"
"FedEx Corp. Third Quarter Net Income Grows as Economy Strengthens","FDX-US","FFR"," 9:00pm","17-Mar-10"
"FedEx Q3 (Feb) earnings preview","FDX-US","SA"," 8:36am","17-Mar-10"
"Seven Summits Research Releases Comments on FedEx, Nike, Discover, Tiffany and Guess?","NKE-US,FDX-US,DFS...","PRN"," 6:31am","15-Mar-10"
"FedEx Corp.(FDX-US) Schedules Q3 2010 Earnings Call for 18-March-2010 8:30 AM ET","FDX-US","FCST","10:07am","11-Mar-10"
"FedEx may stop investment in Express unit because of union law - Bloomberg","FDX-US","SA","10:55am","10-Mar-10"
"FedEx reiterated overweight at Piper","FDX-US","SA"," 4:56am","10-Mar-10"
"FedEx upgraded to outperform from market perform at Morgan Keegan","FDX-US","SA","10:37pm","3-Mar-10"
"CEO LOGUE -Initial Statement of Ownership of FEDEX CORP (FDX)","FDX-US,FDX","EDG"," 8:17am","3-Mar-10"
"FedEx estimates raised at Morgan Stanley","FDX-US","SA"," 4:02am","3-Mar-10"
"Cablevision Introduces Optimum Business Benefits to Help Customers Save Big","FDX-US,CVC-US,CVC","PRN"," 6:30am","1-Mar-10"
"Is Your Hometown Prepared for a Disaster? FedEx Corp. Helps Red Cross Ensure Hometown Is Ready When the Time Comes","FDX-US,FDX","BW"," 5:00am","25-Feb-10"
"Critical Alerts For Occidental Petroleum, FedEx, Commercial Metals, Western Digital, and Itau Unibanco Released By Seven Summits Research","WDC-US,OXY-US,ITU...","PRN"," 6:31am","23-Feb-10"
"A historical first: FedEx workers join the Teamsters Union","FDX-US","CNW"," 3:30am","21-Feb-10"
"Ownership Updates: FEDEX CORP  COM (FDX) for 20-Feb-2010","FDX-US,31428X10","FIO"," 5:08am","20-Feb-10"
"FedEx Workers Join the Teamsters Union!","FDX-US,09VLKJ-E","PRN"," 9:16am","16-Feb-10"
"FedEx workers join the Teamsters Union!","FDX-US","CNW","10:21am","15-Feb-10"
"FedEx Corp. Board Declares Quarterly Dividend","FDX-US,FDX","BW"," 9:39am","15-Feb-10"
"Ownership Updates: FEDEX CORP  COM (FDX) for 13-Feb-2010","FDX-US,31428X10","FIO"," 4:58am","13-Feb-10"
"FEDEX CORP files (SC 13G/A) Acquisition of beneficial ownership of 5% or more (Amended) (FDX-US)","FDX-US,FDX","EDG"," 4:27pm","12-Feb-10"
"FEDEX CORP files (SC 13G/A) Acquisition of beneficial ownership of 5% or more (Amended) (FDX-US)","FDX-US,FDX","EDG"," 4:01pm","11-Feb-10"
"FEDEX CORP files (SC 13G/A) Acquisition of beneficial ownership of 5% or more (Amended) (FDX-US)","FDX-US,FDX","EDG"," 1:25pm","11-Feb-10"
"FedEx Couriers Play Cupid This Valentine's Day","FDX-US,05MNJ0-E,0...","BW","10:34am","11-Feb-10"
"FedEx Trade Networks Continues Global Expansion by Opening Six New Offices","FDX-US,FDX","BW"," 6:00am","11-Feb-10"
"FedEx says it has not been contacted by EU in air freight forwarding probe -- Dow Jones","DPW-DE,DSV-DK,FDX...","SA"," 9:49am","10-Feb-10"
"Jet Airways (JETIN.IN) in initial discussions with FedEx about cargo JV - Live Mint","FDX-US,JETIN.IN,L...","SA"," 7:26pm","8-Feb-10"
"China-Bound "FedEx Panda Express" Takes Flight from Washington, D.C. with Precious Cargo on Board","FDX-US,0BP5R9-E,FDX","BW"," 9:34am","4-Feb-10"
"Saints QB Drew Brees & Titans RB Chris Johnson Named 2009 FedEx Air & Ground NFL Players of the Year","FDX-US,FDX","BW","12:30pm","3-Feb-10"
"FedEx Teams up with the PGA TOUR, Audubon International and The First Tee to Launch a Sustainable Golf Program","FDX-US,065341-E,0...","BW"," 9:00am","2-Feb-10"
"FEDEX CORP files (CT ORDER) Confidential treatment order by SEC (FDX-US)","FDX-US,FDX","EDG","10:47am","29-Jan-10"
"FedEx to Transport Giant Pandas from United States to China Onboard Its New 777F Aircraft","FDX-US,0BP5R9-E,FDX","BW"," 7:00am","28-Jan-10"
"FedEx Named Among FORTUNE Magazine's 2010 "Best Companies to Work For"","FDX-US,FDX","BW"," 9:34am","21-Jan-10"
"Critical Alerts for Chevron, BHP Billiton, FedEx, Cephalon, and Legg Mason Released By Seven Summits Research","LM-US,FDX-US,CVX-...","PRN"," 6:31am","21-Jan-10"
"Teamsters Gain Support From Coakley for FedEx Express Carrier Legislation","FDX-US","PRN"," 6:41am","15-Jan-10"
"FedEx Freight and FedEx National LTL plan to implement 5.9% general rate increases, effective 1-Feb","FDX-US,UPS-US","SA"," 6:01am","15-Jan-10"
"FedEx LTL Companies Announce General Rate Increases","FDX-US,FDX","BW"," 6:00am","15-Jan-10"
"FedEx Express Enhances Service with the Launch of Boeing 777 Freighters to Meet Growing Demand in Eastern China","FDX-US,FDX","BW"," 5:00am","14-Jan-10"
"CEO BRONCZEK Gifts 750 of FEDEX CORP (FDX)","FDX-US,FDX","EDG"," 8:10am","7-Jan-10"
"CEO BRONCZEK Acquires 3,408 of FEDEX CORP (FDX)","FDX-US,FDX","EDG","10:10am","28-Dec-09"
"CEO BRONCZEK Gifts 235 of FEDEX CORP (FDX)","FDX-US,FDX","EDG"," 2:00pm","23-Dec-09"
"CIO CARTER Gifts 2,910 of FEDEX CORP (FDX)","FDX-US,FDX","EDG"," 1:37pm","23-Dec-09"
"CEO BRONCZEK Sells 72,531 of FEDEX CORP (FDX)","FDX-US,FDX","EDG","12:26pm","21-Dec-09"
"Dir SCHWAB Buys 410 of FEDEX CORP (FDX)","FDX-US,FDX","EDG"," 7:33am","21-Dec-09"
"Analyst's Notes >> FEDEX CORPORATION (Argus Research) 7 pages","FDX-US","FRC"," 9:10pm","20-Dec-09"
"FEDEX CORP files (10-Q) Basic quarterly filing, for period end 30-Nov-09 (FDX-US)","FDX-US,FDX","EDG"," 9:33am","18-Dec-09"
"FEDEX CORP: 10-Q FactSet Blackline Report for period ending 11/30/2009","FDX-US","FBLK"," 9:33am","18-Dec-09"
"CALLSTREET REPORT: FedEx Corp.(FDX), Q2 2010 Earnings Call, 17-December-2009 8:30 AM ET","FDX-US","FCST","11:11am","17-Dec-09"
"FEDERAL EXPRESS CORP files (8-K) Current report: Items 2.02 - Results of Operations, 9.01 - Financial Statements and Exhibits, for period end 17-Dec-09 (FDX-US)","FDX-US,FDX","EDG"," 5:02am","17-Dec-09"
"FedEx reports Q2 EPS $1.10 vs Reuters $1.10","FDX-US","SA"," 4:47am","17-Dec-09"
"Ownership Updates: FEDEX CORP  COM (FDX) for 15-Dec-2009","FDX-US,31428X10","FIO"," 1:28am","15-Dec-09"
"FedEx Corp.(FDX) Schedules Q2 2010 Earnings Call for 17-December-2009 8:30 AM ET","FDX-US","FCST"," 9:01am","14-Dec-09"
"Ownership Updates: FEDEX CORP  COM (FDX) for 11-Dec-2009","FDX-US,31428X10","FIO"," 3:58am","11-Dec-09"
"FEDERAL EXPRESS CORP files (8-K) Current report: Items 2.02 - Results of Operations, 9.01 - Financial Statements and Exhibits, for period end 7-Dec-09 (FDX-US)","FDX-US,FDX","EDG"," 2:02pm","7-Dec-09"
"Follow-up: FedEx says Q2 EPS are expected to be $1.10; above prior guidance of $0.65-$0.95","FDX-US","SA"," 1:17pm","7-Dec-09"
"FedEx says Q2 EPS are expected to be $1.10; above prior guidance of $0.65-$0.95","FDX-US","SA"," 1:15pm","7-Dec-09"
"FedEx Q2 estimates raised above consensus at Barclays, shares remain overweight rated","FDX-US","SA"," 3:41am","7-Dec-09"
"FedEx Ground to increase 2010 rates by 4.9%","FDX-US,UPS-US","SA"," 1:45pm","3-Dec-09"
"FedEx estimates raised above consensus at RBC Capital","FDX-US","SA"," 4:27am","3-Dec-09"
"Analyst's Notes >> FEDEX CORPORATION (Argus Research) 5 pages","FDX-US,UPS-US","FRC","10:24am","2-Dec-09"
"Ownership Updates: FEDEX CORP  COM (FDX) for  2-Dec-2009","FDX-US,31428X10","FIO"," 6:28am","2-Dec-09"
"Ownership Updates: FEDEX CORP  COM (FDX) for 19-Nov-2009","FDX-US,31428X10","FIO","12:48am","19-Nov-09"
"Ownership Updates: FEDEX CORP  COM (FDX) for 17-Nov-2009","FDX-US,31428X10","FIO"," 3:38am","17-Nov-09"
"FedEx CEO sees holiday volume +8% y/y - Dow Jones","FDX-US","SA"," 3:34pm","16-Nov-09"
"FedEx has upside for the long haul says Barron's","FDX-US","SA"," 2:59pm","14-Nov-09"
"Ownership Updates: FEDEX CORP  COM (FDX) for 14-Nov-2009","FDX-US,31428X10","FIO","12:48am","14-Nov-09"
"CEO REBHOLZ Gifts 190 of FEDEX CORP (FDX)","FDX-US,FDX","EDG","12:45pm","12-Nov-09"
"FedEx projects 8% increase for busiest day of 2009 - WSJ","FDX-US,UPS-US","SA"," 8:58pm","10-Nov-09"
"IRS confirms that no assessment of federal employment tax will be made regarding Fedex Ground for yrs 2002-2006","FDX-US","SA","10:13am","10-Nov-09"
"FEDEX CORP files (8-K) Current report: Item 8.01 - Other Events, for period end 9-Nov-09 (FDX-US)","FDX-US,FDX","EDG","10:00am","10-Nov-09"
"FEDEX CORP files (8-K) Current report: Item 5.02 - Changes in Exec Management, for period end 30-Oct-09 (FDX-US)","FDX-US,FDX","EDG"," 9:41am","3-Nov-09"
"FEDEX CORP files (8-K) Current report: Item 8.01 - Other Events, for period end 30-Oct-09 (FDX-US)","FDX-US,FDX","EDG"," 2:11pm","30-Oct-09"
"FedEx added to short-term buy list at Deutsche Bank","FDX-US","SA","11:51am","27-Oct-09"
