"Crackle Launches Original Concert Series "Playing It Forward" with Surprise Street Performance by Grammy® Award Winning Artist John Legend in Los Angeles","FDX-US","PRN"," 5:00am","27-Nov-13"
"FedEx Express Canada Supports Free Trade Deal with EU","FDX-US","MW"," 5:45am","21-Nov-13"
"FedEx, Direct Relief, and Heart to Heart International Team up to Deliver Supplies and Aid to Philippines","FDX-US,FDX","BW"," 5:00am","20-Nov-13"
"FedEx Delivers Early Christmas Present for Troops","FDX-US,FDX","BW"," 6:00am","19-Nov-13"
"FedEx Express showcases its Aerospace Solutions at Dubai Airshow [Emirates News Agency (WAM) (United Arab Emirates)] (Middle East & North African Newspapers)","FDX-US","IA"," 9:01pm","16-Nov-13"
"FedEx Corp. Board Declares Quarterly Dividend","FDX-US,FDX","BW"," 6:00am","15-Nov-13"
"FedEx CEO Fred Smith says they would be willing to deliver on Sunday if demand is sufficient -- CNBC","FDX-US,AMZN-US,UP...","SA"," 5:51am","15-Nov-13"
"Ownership Updates: FEDEX CORP  COM (FDX) for 15-Nov-2013","FDX-US,31428X10","FIO"," 1:30am","15-Nov-13"
"Critical Alerts For SPDR Gold, Qualcomm, Ford, US Bancorp, and FedEx Released By InvestorsObserver","F-US,FDX-US,GLD-U...","PRN"," 6:31am","14-Nov-13"
"2013 Holiday Season: 60 Percent of Canadians Will Shop Online","FDX-US,0037P3-E","MW"," 1:00am","14-Nov-13"
"Third Point LLC agreed to acquire a minority stake in FedEx Corp","FDX-US,071VYD-E","FFW"," 7:35am","13-Nov-13"
"Follow-up: FedEx moves higher after Third Point's Dan Loeb discloses ownership of shares -- CNBC","FDX-US","SA"," 7:54am","12-Nov-13"
"FedEx moves higher after Third Point's Dan Loeb discloses ownership of shares -- CNBC","FDX-US","SA"," 7:48am","12-Nov-13"
"FedEx downgraded to market perform from outperform at Cowen","FDX-US","SA"," 3:37am","12-Nov-13"
"FEDEX CORP files (CT ORDER) Confidential treatment order by SEC (FDX-US)","FDX-US,FDX","EDG"," 8:28am","8-Nov-13"
"Ex-Im Bank and FedEx Join Forces to Empower U.S. Businesses to Export","FDX-US","PRN"," 4:05am","7-Nov-13"
"FedEx Announces Leadership Appointments In Europe, Middle East, Indian Subcontinent and Africa","063JW6-E,FDX-US","BW","10:00pm","3-Nov-13"
"Time Change Survey: Half of Canadians Will Catch Up on Sleep","FDX-US","CCN"," 9:34am","31-Oct-13"
"FedEx and Cardinal Health Form Strategic Alliance to Offer Premier Healthcare 3PL Solutions","CAH-US,FDX-US,CAH...","BW"," 6:00am","29-Oct-13"
"FedEx Express opens new facility in Abu Dhabi [Emirates News Agency (WAM) (United Arab Emirates)] (Middle East & North African Newspapers)","FDX-US","IA"," 9:01pm","28-Oct-13"
"Online Shopping Boosts FedEx Holiday Volume","FDX-US,FDX","BW"," 6:00am","23-Oct-13"
"FedEx upgraded to overweight from neutral at JPMorgan","FDX-US","SA"," 5:47am","22-Oct-13"
"FedEx Forum Spotlights "Delivering Healthcare Solutions Around the Globe"","FDX-US,FDX","BW"," 5:00am","22-Oct-13"
"Dir JACKSON Sells 12,920 of FEDEX CORP (FDX)","FDX-US,FDX","EDG"," 1:53pm","21-Oct-13"
"FedEx Introduces FedEx One Rate         ","063JW6-E,FDX-US","BW"," 6:00am","21-Oct-13"
"FedEx Displays First 767-300 Freighter Scheduled for Service","063JW6-E,FDX-US","BW","11:00am","18-Oct-13"
"FedEx Express Recognizes "Employee Heroes" for Exceptional Customer and Community Service","063JW6-E,FDX-US","BW"," 7:00am","17-Oct-13"
"FedEx Custom Critical Launches Temp-Assure® Shipping Studies","FDX-US,FDX","BW"," 7:39am","16-Oct-13"
"FedEx downgraded to neutral from buy at Buckingham","FDX-US","SA"," 5:26am","16-Oct-13"
"FedEx announces 32M share repurchase program","FDX-US","SA"," 5:32am","15-Oct-13"
"FedEx Announces 32 Million Share Repurchase Program","FDX-US,FDX","BW"," 5:30am","15-Oct-13"
"No More New Apple Computer or Federal Express if Obama Closes the SBA, According to the American Small Business League","FDX-US,AAPL-US","BW"," 8:37am","8-Oct-13"
"Global IR Forum announces Speakers and Agenda","1224-HK,C31-SG,FD...","PRNA"," 8:26am","7-Oct-13"
"FedEx Freight Continues Accelerating LTL Shipping To and From Canada","FDX-US,081CD3-E,FDX","BW"," 6:00am","30-Sep-13"
"Dir WALSH Updates Ownership of FEDEX CORP (FDX)","FDX-US,FDX","EDG","12:54pm","24-Sep-13"
"Dir STEINER Updates Ownership of FEDEX CORP (FDX)","FDX-US,FDX","EDG","12:50pm","24-Sep-13"
"Dir SCHWAB Updates Ownership of FEDEX CORP (FDX)","FDX-US,FDX","EDG","12:47pm","24-Sep-13"
"Dir RAMO Updates Ownership of FEDEX CORP (FDX)","FDX-US,FDX","EDG","12:44pm","24-Sep-13"
"Dir MARTIN Updates Ownership of FEDEX CORP (FDX)","FDX-US,FDX","EDG","12:40pm","24-Sep-13"
"Dir LOVEMAN Updates Ownership of FEDEX CORP (FDX)","FDX-US,FDX","EDG","12:36pm","24-Sep-13"
"Dir LORANGER Updates Ownership of FEDEX CORP (FDX)","FDX-US,FDX","EDG","12:36pm","24-Sep-13"
"Dir JACKSON Updates Ownership of FEDEX CORP (FDX)","FDX-US,FDX","EDG","12:35pm","24-Sep-13"
"Dir EDWARDSON Updates Ownership of FEDEX CORP (FDX)","FDX-US,FDX","EDG","12:19pm","24-Sep-13"
"Dir BARKSDALE Updates Ownership of FEDEX CORP (FDX)","FDX-US,FDX","EDG","12:14pm","24-Sep-13"
"FEDEX CORP files (8-K) Current report: Items 5.02 - Changes in Exec Management, 5.07 - Submission of Matters to a Vote, 9.01 - Financial Statements and Exhibits, for period end 23-Sep-13 (FDX-US)","FDX-US,FDX","EDG","10:38am","24-Sep-13"
"Dir BARKSDALE Acquires 7,000 of FEDEX CORP (FDX)","FDX-US,FDX","EDG"," 1:55pm","23-Sep-13"
"FedEx Corp. Reports Annual Shareowner Meeting Results","FDX-US,FDX","BW","11:00am","23-Sep-13"
"FedEx downgraded to hold from buy at Stifel Nicolaus","FDX-US","SA"," 5:39am","23-Sep-13"
"CIO CARTER Sells 8,842 of FEDEX CORP (FDX)","FDX-US,FDX","EDG"," 3:43pm","20-Sep-13"
"FEDEX CORP files (10-Q) Basic quarterly filing, for period end 31-Aug-13 (FDX-US)","FDX-US,FDX","EDG"," 2:26pm","19-Sep-13"
"Fedex Corp: 10-Q FactSet Blackline Report for period ending 08/31/2013","FDX-US","FBLK"," 2:26pm","19-Sep-13"
"Analyst's Notes >> FEDEX CORP (Argus Research) 5 pages","FDX-US,MORN-US,DP...","FRC","11:32am","19-Sep-13"
"FedEx downgraded to neutral from buy at Goldman Sachs","FDX-US","SA"," 3:15am","19-Sep-13"
"Street Takeaways - FDX Q1 Earnings","FDX-US","SA"," 1:46pm","18-Sep-13"
"CALLSTREET REPORT: FedEx Corp.(FDX-US), Q1 2014 Earnings Call, 18-September-2013 8:30 AM ET","FDX-US","FCST","12:12pm","18-Sep-13"
"StreetAccount Conference Call Highlights - FDX Q1 Earnings","FDX-US","SA"," 6:49am","18-Sep-13"
"FEDEX CORP files (8-K) Current report: Items 2.02 - Results of Operations, 9.01 - Financial Statements and Exhibits, for period end 18-Sep-13 (FDX-US)","FDX-US,FDX","EDG"," 4:46am","18-Sep-13"
"StreetAccount Metrics Recap - FDX Q1 Earnings","FDX-US","SA"," 4:34am","18-Sep-13"
"FedEx reports Q1 EPS $1.53 vs FactSet $1.50","FDX-US","SA"," 4:33am","18-Sep-13"
"FedEx Corp. Reports Higher Year-Over-Year First Quarter Results","FDX-US,FDX","BW"," 4:30am","18-Sep-13"
"WSJ is cautiously positive on FedEx","FDX-US","SA","11:37pm","17-Sep-13"
"StreetAccount Consensus Metrics Preview - FDX Q1 Earnings","FDX-US","SA"," 9:23am","16-Sep-13"
"MEDIA ADVISORY: FedEx Chief Fred Smith to Be Honored at USCIB Gala","FDX-US","MW"," 9:08am","16-Sep-13"
"FedEx Launches Ninth Annual FedEx Cares Week","FDX-US,FDX","BW"," 6:00am","16-Sep-13"
"Teamster Proposal for FedEx Independent Board Chair Backed By Leading Proxy Advisers","FDX-US","PRN"," 9:30am","12-Sep-13"
"FedEx Corporation / Amalgamated Bank Longview Funds - Activist Campaign to Vote For a Stockholder Proposal Announced","FDX-US","FSWA"," 3:00pm","10-Sep-13"
"The ORBIS Flying Eye Hospital Returns to India For a Two-Week Ophthalmic Training Program","FDX-US","PRN"," 2:00pm","10-Sep-13"
"FEDEX CORP files (CT ORDER) Confidential treatment order by SEC (FDX-US)","FDX-US,FDX","EDG"," 1:40pm","10-Sep-13"
"FEDEX CORP files (PX14A6G) Registrant sending written material to shareholders (FDX-US)","FDX-US,FDX","EDG"," 7:07am","10-Sep-13"
"FEDEX CORP files (PX14A6G) Registrant sending written material to shareholders (FDX-US)","FDX-US,FDX","EDG"," 6:57am","10-Sep-13"
"Boeing Delivers First 767 Freighter to FedEx Express","063JW6-E,FDX-US,B...","PRN","10:00am","4-Sep-13"
"FedEx Ground Names Humanitarian Award Winners","FDX-US,FDX","BW"," 6:00am","27-Aug-13"
"Twelve FedEx Drivers Earn Honors at National Truck Driving Championships","FDX-US","BW"," 6:00am","26-Aug-13"
"Ownership Updates: FEDEX CORP  COM (FDX) for 17-Aug-2013","FDX-US,31428X10","FIO"," 2:10am","17-Aug-13"
"FedEx Corp. Board Declares Quarterly Dividend","FDX-US,FDX","BW"," 6:00am","16-Aug-13"
"WSJ is cautious on UPS (UPS), FedEx (FDX)","FDX-US,UPS-US","SA"," 5:27pm","15-Aug-13"
"Ownership Updates: FEDEX CORP  COM (FDX) for 15-Aug-2013","FDX-US,31428X10","FIO"," 2:30am","15-Aug-13"
"Ownership Updates: FEDEX CORP  COM (FDX) for 14-Aug-2013","FDX-US,31428X10","FIO"," 3:00am","14-Aug-13"
"EVP GLENN Gifts 8,905 of FEDEX CORP (FDX)","FDX-US,FDX","EDG","12:07pm","13-Aug-13"
"Scan Added:  FEDEX CORP files (ARS) Annual report to security holders (paper filing), for period end 31-May-13 (FDX-US)","FDX-US,FDX","EDG"," 7:25am","13-Aug-13"
"FedEx Corp.(FDX-US) Schedules Roadshow for 12-August-2013","FDX-US","FCST"," 1:40pm","12-Aug-13"
"FedEx Corp. (FDX-US) - Annual Report for the Period Ending 31-May-2013 (English)","FDX-US","FFR"," 9:59am","12-Aug-13"
"FEDEX CORP files (DEF 14A) Definitive proxy statements, for period end 23-Sep-13 (FDX-US)","FDX-US,FDX","EDG"," 9:06am","12-Aug-13"
"Ownership Updates: FEDEX CORP  COM (FDX) for 11-Aug-2013","FDX-US,31428X10","FIO","10:20am","11-Aug-13"
"Ownership Updates: FEDEX CORP  COM (FDX) for 10-Aug-2013","FDX-US,31428X10","FIO","12:40am","10-Aug-13"
"FEDEX CORP files (SC 13G/A) Acquisition of beneficial ownership of 5% or more (Amended) (FDX-US)","FDX-US,FDX","EDG"," 1:08pm","9-Aug-13"
"VP MERINO Sells 11,700 of FEDEX CORP (FDX)","FDX-US,FDX","EDG"," 9:00am","9-Aug-13"
"CEO BRONCZEK Sells 59,628 of FEDEX CORP (FDX)","FDX-US,FDX","EDG"," 1:01pm","2-Aug-13"
"FedEx downgraded to hold from buy at Standpoint Research (timing uncertain)","FDX-US","SA"," 8:10am","1-Aug-13"
"The ORBIS Flying Eye Hospital Returns to Panama For a Comprehensive Eye Care Skills Exchange Program","FDX-US","PRN","11:00am","30-Jul-13"
"Dir EDWARDSON Sells 5,339 of FEDEX CORP (FDX)","FDX-US,FDX","EDG"," 1:04pm","24-Jul-13"
"Freight and Shipping Services Present Strong Financial Results, and Certifications for Better Service - Research Report on UPS, FedEx, Hub Group, Forward Air Corporation, and Golar LNG","FDX-US,FWRD-US,GL...","PRN"," 5:00am","24-Jul-13"
"CEO MAIER Sells 1,629 of FEDEX CORP (FDX)","FDX-US,FDX","EDG","12:31pm","22-Jul-13"
"FedEx to Send 132 Drivers to National Truck Driving Championships","FDX-US,FDX","BW"," 6:00am","22-Jul-13"
"Ownership Updates: FEDEX CORP  COM (FDX) for 19-Jul-2013","FDX-US,31428X10","FIO"," 2:40am","19-Jul-13"
"Dir SMITH Sells 4,977 of FEDEX CORP (FDX)","FDX-US,FDX","EDG","12:31pm","17-Jul-13"
"FEDEX CORP files (IRANNOTICE) Disclosure called for by the Iran Threat Reduction and Syria Human Rights Act (FDX-US)","FDX-US,FDX","EDG"," 3:01am","16-Jul-13"
"FEDEX CORP files (10-K) Basic annual filing, for period end 31-May-13 (FDX-US)","FDX-US,FDX","EDG"," 2:31pm","15-Jul-13"
"FEDEX CORP: 10-K FactSet Blackline Report for period ending 5/31/2013","FDX-US","FBLK"," 2:31pm","15-Jul-13"
"Dir JACKSON Sells 4,400 of FEDEX CORP (FDX)","FDX-US,FDX","EDG"," 9:30am","15-Jul-13"
"FedEx initiated buy at Wunderlich Securities","FDX-US","SA"," 4:48am","12-Jul-13"
"CEO LOGUE Sells 18,225 of FEDEX CORP (FDX)","FDX-US,FDX","EDG"," 1:30pm","10-Jul-13"
"CIO CARTER Sells 3,000 of FEDEX CORP (FDX)","FDX-US,FDX","EDG","12:25pm","10-Jul-13"
"FedEx settles lawsuit over business customers being overcharged - Bloomberg","FDX-US","SA"," 7:51am","9-Jul-13"
"Zacks Earnings Trends Highlights: Oracle, FedEx and Walgreen","FDX-US","PRN"," 6:30am","8-Jul-13"
"FedEx Lauds Start of U.S. - EU Transatlantic Trade and Investment Partnership Negotiations","FDX-US,FDX","BW"," 5:30am","8-Jul-13"
"Technicians Earn Honors at FedEx Freight Competition","FDX-US,081CD3-E,FDX","BW"," 6:00am","28-Jun-13"
"Dir WALSH Sells 7,000 of FEDEX CORP (FDX)","FDX-US,FDX","EDG"," 1:54pm","26-Jun-13"
"FedEx Adds 1,900 New Lightweight, Fuel Efficient Vehicles to Fleet","FDX-US,FDX","BW"," 5:00am","24-Jun-13"
"End of an Era as FedEx Express Retires Last B727","FDX-US,FDX","BW"," 5:00am","21-Jun-13"
"Analyst's Notes >> FEDEX CORP (Argus Research) 5 pages","FDX-US,MORN-US,DP...","FRC","12:01pm","20-Jun-13"
"FedEx Corp agreed to acquire Supaswift Pty Ltd","FDX-US,09GHXB-E","FFW"," 7:35am","20-Jun-13"
"FedEx to acquire business operations of Supaswift (Pty) Ltd; financial terms not disclosed","FDX-US","SA"," 5:14am","20-Jun-13"
"FedEx Unveils Strategic Acquisition Deal in Southern Africa","FDX-US,FDX","BW"," 5:11am","20-Jun-13"
"FedEx downgraded to equal-weight from overweight at Morgan Stanley","FDX-US","SA"," 4:06am","20-Jun-13"
"FedEx downgraded to neutral from overweight at JPMorgan","FDX-US","SA"," 3:57am","20-Jun-13"
"CALLSTREET REPORT: FedEx Corp.(FDX-US), Q4 2013 Earnings Call, 19-June-2013 8:30 AM ET","FDX-US","FCST","12:10pm","19-Jun-13"
"Street Takeaways - FDX Q4 Earnings","FDX-US","SA","10:44am","19-Jun-13"
"StreetAccount Conference Call Highlights - FDX Q4 Earnings","FDX-US","SA"," 7:01am","19-Jun-13"
"FEDEX CORP files (8-K) Current report: Items 2.02 - Results of Operations, 9.01 - Financial Statements and Exhibits, for period end 19-Jun-13 (FDX-US)","FDX-US,FDX","EDG"," 5:02am","19-Jun-13"
"StreetAccount Metrics Recap - FDX Q4 Earnings","FDX-US","SA"," 4:42am","19-Jun-13"
"FedEx reports Q4 EPS $2.13","FDX-US","SA"," 4:33am","19-Jun-13"
"FedEx Corp. Reports Fourth Quarter Earnings","FDX-US,FDX","BW"," 4:30am","19-Jun-13"
"FEDEX CORP files (CT ORDER) Confidential treatment order by SEC (FDX-US)","FDX-US,FDX","EDG"," 8:11am","18-Jun-13"
"FedEx Trade Networks Opens New Distribution Facility in Romulus","FDX-US,0037PN-E,FDX","BW"," 6:00am","18-Jun-13"
"StreetAccount Consensus Metrics Preview - FDX Q4 Earnings","FDX-US","SA"," 9:47am","17-Jun-13"
"FedEx Corp.(FDX-US) Schedules Q3 2014 Earnings Release for 19-March-2014 7:30 AM ET","FDX-US","FCST"," 7:28pm","14-Jun-13"
"FedEx Corp.(FDX-US) Schedules Q4 2014 Earnings Release for 18-June-2014 7:30 AM ET","FDX-US","FCST"," 4:48pm","14-Jun-13"
"FedEx Corp.(FDX-US) Schedules Annual General Meeting for 23-September-2013 9:00 AM ET","FDX-US","FCST"," 6:20pm","13-Jun-13"
"FedEx Corp.(FDX-US) Schedules Q4 2014 Earnings Call for 18-June-2014 8:30 AM ET","FDX-US","FCST"," 6:20pm","13-Jun-13"
"FedEx Corp.(FDX-US) Schedules Q3 2014 Earnings Call for 19-March-2014 8:30 AM ET","FDX-US","FCST"," 6:20pm","13-Jun-13"
"FedEx target increased to $105 from $100 at Bernstein","FDX-US","SA"," 3:39am","12-Jun-13"
"FedEx Freight to increase shipping rates","FDX-US,DPW-DE,UPS...","SA"," 5:31am","10-Jun-13"
"FedEx Freight to Increase Shipping Rates","FDX-US,081CD3-E,FDX","BW"," 5:30am","10-Jun-13"
"FedEx intensifie ses efforts pour relier le monde de manière responsable et judicieuse","FDX-US","PRNE","12:00am","6-Jun-13"
"(RNS)  Journey Group plc  New contract win","JNY-GB,FDX-US,05W...","FECA","11:00pm","5-Jun-13"
"CEO MAIER -Initial Statement of Ownership of FEDEX CORP (FDX)","FDX-US,FDX","EDG"," 2:12pm","4-Jun-13"
"CEO MAIER Acquires 4,725 of FEDEX CORP (FDX)","FDX-US,FDX","EDG"," 2:02pm","4-Jun-13"
"CEO SMITH Updates Ownership of FEDEX CORP (FDX)","FDX-US,FDX","EDG"," 1:50pm","4-Jun-13"
"EVP RICHARDS Acquires 5,720 of FEDEX CORP (FDX)","FDX-US,FDX","EDG"," 1:46pm","4-Jun-13"
"VP MERINO Acquires 1,475 of FEDEX CORP (FDX)","FDX-US,FDX","EDG"," 1:43pm","4-Jun-13"
"CEO LOGUE Acquires 4,725 of FEDEX CORP (FDX)","FDX-US,FDX","EDG"," 1:39pm","4-Jun-13"
"CFO GRAF JR Acquires 5,720 of FEDEX CORP (FDX)","FDX-US,FDX","EDG"," 1:35pm","4-Jun-13"
"EVP GLENN Acquires 5,720 of FEDEX CORP (FDX)","FDX-US,FDX","EDG"," 1:31pm","4-Jun-13"
"CIO CARTER Acquires 5,720 of FEDEX CORP (FDX)","FDX-US,FDX","EDG"," 1:27pm","4-Jun-13"
"CEO BRONCZEK Acquires 7,370 of FEDEX CORP (FDX)","FDX-US,FDX","EDG"," 1:23pm","4-Jun-13"
"FEDEX CORP files (8-K) Current report: Items 2.02 - Results of Operations, 2.05 - Costs of Exits or Disposals, 2.06 - Material Impairments, 9.01 - Financial Statements and Exhibits, for period end 31-May-13 (FDX-US)","FDX-US,FDX","EDG"," 2:35pm","3-Jun-13"
"FedEx increases quarterly dividend by 7.1% to $0.15 from $0.14; permanently retires or will accelerate retirement of 86 aircraft and 308 related engines","FDX-US","SA"," 1:17pm","3-Jun-13"
"FedEx Corp. Accelerates Aircraft Retirements","FDX-US,FDX","BW"," 1:15pm","3-Jun-13"
"FedEx Boosts Efforts to Connect the World in Responsible and Resourceful Ways","FDX-US,FDX","BW"," 6:00am","23-May-13"
"FedEx estimates and target reduced at JPMorgan","FDX-US","SA"," 4:29am","17-May-13"
"Ownership Updates: FEDEX CORP  COM (FDX) for 17-May-2013","FDX-US,31428X10","FIO"," 1:50am","17-May-13"
"Ownership Updates: FEDEX CORP  COM (FDX) for 16-May-2013","FDX-US,31428X10","FIO"," 4:10am","16-May-13"
"National Salvation Army Week To Be Celebrated With Gift Of $100,000 Disaster Response Unit From FedEx At The 911th Airlift Wing","FDX-US","PRN"," 4:15am","13-May-13"
"CIO CARTER Gifts 315 of FEDEX CORP (FDX)","FDX-US,FDX","EDG"," 3:02pm","9-May-13"
"Ownership Updates: FEDEX CORP  COM (FDX) for  9-May-2013","FDX-US,31428X10","FIO"," 2:30am","9-May-13"
"CIO CARTER Sells 27,502 of FEDEX CORP (FDX)","FDX-US,FDX","EDG","11:52am","8-May-13"
"FedEx Delivers for Millions of Moms this Mother's Day","FDX-US,FDX","BW"," 6:00am","8-May-13"
"FedEx Corp.(FDX-US) Schedules Robert W. Baird Growth Stock Conference for 8-May-2013 12:30 PM ET","FDX-US","FCST","11:46am","7-May-13"
"Dir JACKSON Sells 4,089 of FEDEX CORP (FDX)","FDX-US,FDX","EDG"," 9:40am","6-May-13"
"Despite Recent Disasters, Survey Shows Most Small Business Owners Still Not Getting Prepared","FDX-US,FDX","BW"," 6:00am","2-May-13"
"Dir EDWARDSON Sells 6,542 of FEDEX CORP (FDX)","FDX-US,FDX","EDG","12:56pm","26-Apr-13"
"FEDERAL EXPRESS CORP files (8-K) Current report: Item 1.01 - Entry into Definitive Agreement, for period end 23-Apr-13 (FDX-US)","FDX-US,FDX","EDG","12:48pm","26-Apr-13"
"FedEx signs new express air transportation agreement with United States Postal Service","FDX-US","SA"," 2:01pm","23-Apr-13"
"FedEx Signs New Express Air Transportation Agreement with United States Postal Service","FDX-US,FDX","BW"," 2:00pm","23-Apr-13"
"Package Recipients Can Now Customize Deliveries to Their Home with FedEx Delivery ManagerSM","FDX-US,FDX","BW"," 6:30am","23-Apr-13"
"Ownership Updates: FEDEX CORP  COM (FDX) for 20-Apr-2013","FDX-US,31428X10","FIO"," 1:40am","20-Apr-13"
"FedEx Marks 40th Anniversary with Community Service, Eye to the Future","FDX-US,FDX","BW"," 6:00am","17-Apr-13"
"FEDERAL EXPRESS CORP files (8-K) Current report: Items 8.01 - Other Events, 9.01 - Financial Statements and Exhibits, for period end 11-Apr-13 (FDX-US)","FDX-US,FDX","EDG"," 7:54am","11-Apr-13"
"FedEx Trade Networks Announces Expanded Infrastructure in Latin America","FDX-US,0037PN-E,FDX","BW"," 7:00am","11-Apr-13"
"FEDERAL EXPRESS CORP files (424B5) Prospectus used for both 424B2 and 424B3 information (FDX-US)","FDX-US,FDX","EDG"," 1:07pm","9-Apr-13"
"FedEx Custom Critical Launches ShipmentWatchSM","0037PH-E,FDX-US","BW"," 5:17am","9-Apr-13"
"FEDEX CORP files (FWP) Free writing prospectus after a registration statement has been filed (FDX-US)","FDX-US,FDX","EDG"," 1:52pm","8-Apr-13"
"VP MERINO Sells 3,500 of FEDEX CORP (FDX)","FDX-US,FDX","EDG"," 7:40am","8-Apr-13"
"FedEx Corp. and National Fish and Wildlife Foundation Announce 2013 Urban Conservation Projects","FDX-US,FDX","BW"," 6:00am","8-Apr-13"
"FEDERAL EXPRESS CORP files (424B3) Prospectus detailing significant change to previous prospectus (FDX-US)","FDX-US,FDX","EDG"," 5:45am","8-Apr-13"
"FedEx Corp.(FDX-US) Schedules Q2 2014 Earnings Call for 18-December-2013 8:30 AM ET","FDX-US","FCST"," 1:28pm","5-Apr-13"
"FedEx Corp.(FDX-US) Schedules Q2 2014 Earnings Release for 18-December-2013 7:30 AM ET","FDX-US","FCST"," 1:28pm","5-Apr-13"
"FedEx Corp.(FDX-US) Schedules Q1 2014 Earnings Call for 18-September-2013 8:30 AM ET","FDX-US","FCST"," 1:28pm","5-Apr-13"
"FedEx Corp.(FDX-US) Schedules Q1 2014 Earnings Release for 18-September-2013 7:30 AM ET","FDX-US","FCST"," 1:28pm","5-Apr-13"
"CEO SMITH Sells 202,000 of FEDEX CORP (FDX)","FDX-US,FDX","EDG"," 1:26pm","5-Apr-13"
"SYNNEX Corporation Announces the Appointment of Marshall W. Witt as Chief Financial Officer","SNX-US,FDX-US,SNX","BW"," 1:30pm","1-Apr-13"
"Stephens initiates FDX, UPS","FDX-US,UPS-US","SA"," 4:09am","28-Mar-13"
"FedEx Makes Historic Panda Delivery to Toronto Zoo","09GV5B-E,FDX-US,0...","BW","11:54am","25-Mar-13"
"Team FedEx LAX Wins 2013 AMTSociety Maintenance Skills Competition For Aviation Tech Excellence, Sponsored By Snap-on","FDX-US","PRN"," 5:00am","25-Mar-13"
"FEDEX CORP files (10-Q) Basic quarterly filing, for period end 28-Feb-13 (FDX-US)","FDX-US,FDX","EDG"," 1:50pm","21-Mar-13"
"FEDEX CORP: 10-Q FactSet Blackline Report for period ending 2/28/2013","FDX-US","FBLK"," 1:50pm","21-Mar-13"
"Analyst's Notes >> FEDEX CORP (Argus Research) 5 pages","FDX-US,DPW-DE,160...","FRC"," 6:25am","21-Mar-13"
"WSJ discusses FedEx's results","FDX-US","SA","11:33pm","20-Mar-13"
"CALLSTREET REPORT: FedEx Corp.(FDX-US), Q3 2013 Earnings Call, 20-March-2013 8:30 AM ET","FDX-US","FCST"," 1:10pm","20-Mar-13"
"FEDERAL EXPRESS CORP files (8-K) Current report: Items 2.02 - Results of Operations, 9.01 - Financial Statements and Exhibits, for period end 20-Mar-13 (FDX-US)","FDX-US,FDX","EDG"," 4:51am","20-Mar-13"
"StreetAccount Metrics Recap - FDX Q3 Earnings","FDX-US","SA"," 4:43am","20-Mar-13"
"FedEx reports Q3 EPS $1.23 ex-items vs FactSet $1.38; increases share repurchase authorization","FDX-US","SA"," 4:32am","20-Mar-13"
"FedEx Corp. Reports Third Quarter Earnings","FDX-US,FDX","BW"," 4:30am","20-Mar-13"
"American Realty Capital Properties Announces Acquisition of $8.8 Million FedEx Property and Strong Acquisition Pipeline of More Than $167.2 Million","ARCP-US,FDX-US","PRN","12:45pm","15-Mar-13"
"StreetAccount Earnings Preview - FDX Q3 Earnings","FDX-US","SA","10:01am","15-Mar-13"
"FedEx estimates reduced further below consensus at JPMorgan","FDX-US","SA"," 4:40am","13-Mar-13"
"FedEx Corp.(FDX-US) Schedules Q4 2013 Earnings Call for 19-June-2013 8:30 AM ET","FDX-US","FCST"," 6:34pm","8-Mar-13"
"CIO CARTER Acquires 1,549 of FEDEX CORP (FDX)","FDX-US,FDX","EDG"," 1:18pm","8-Mar-13"
"Critical Alerts For FedEx, Disney, Celgene, Pioneer Natural Resources, and Cemex Released By InvestorsObserver","CELG-US,FDX-US,PX...","PRN"," 6:31am","6-Mar-13"
"FedEx Rolls Past Vehicle Fleet Fuel Efficiency Goal Years Ahead of Schedule","FDX-US,FDX","BW"," 6:00am","6-Mar-13"
"Oppenheimer initiates FDX, UPS","FDX-US,UPS-US","SA"," 2:56am","6-Mar-13"
"FedEx Earns #10 Spot on FORTUNE's World's Most Admired Companies List","FDX-US,0B071T-E","BW"," 7:00am","28-Feb-13"
"Springtime Special Delivery: FedEx Express to Transport Giant Pandas to Toronto Zoo","FDX-US,FDX","BW"," 6:00am","28-Feb-13"
"FedEx Corp.(FDX-US) Schedules Q3 2013 Earnings Call for 20-March-2013 8:30 AM ET","FDX-US","FCST"," 7:34am","20-Feb-13"
"FEDERAL EXPRESS CORP files (8-K) Current report: Item 2.05 - Costs of Exits or Disposals, for period end 15-Feb-13 (FDX-US)","FDX-US,FDX","EDG"," 2:25pm","19-Feb-13"
"United Parcel Service and FedEx Under Review: Industry on a Growth Trajectory","FDX-US,UPS-US","PRN"," 5:00am","19-Feb-13"
"FedEx Helps Small Businesses Streamline Shipping with fedex.com Integration Manager","FDX-US,008HL3-E,G...","BW"," 6:00am","18-Feb-13"
"FedEx Corp. Board Declares Quarterly Dividend","FDX-US,FDX","BW"," 6:00am","15-Feb-13"
"Ownership Updates: FEDEX CORP  COM (FDX) for 15-Feb-2013","FDX-US,31428X10","FIO"," 2:50am","15-Feb-13"
"FEDEX CORP files (SC 13G) Acquisition of beneficial ownership of 5% or more (FDX-US)","FDX-US,FDX","EDG","11:56am","14-Feb-13"
"FEDEX CORP files (SC 13G/A) Acquisition of beneficial ownership of 5% or more (Amended) (FDX-US)","FDX-US,FDX","EDG","11:39am","14-Feb-13"
"FEDEX CORP files (SC 13G/A) Acquisition of beneficial ownership of 5% or more (Amended) (FDX-US)","FDX-US,FDX","EDG","12:47pm","13-Feb-13"
"CORRECTED TRANSCRIPT: FedEx Corp.(FDX-US), Stifel Nicolaus Transportation and Logistics Conference, 12-February-2013 12:25 PM ET","FDX-US","FCST"," 5:44pm","12-Feb-13"
"FedEx Delivers for Last Minute Shoppers this Valentine's Day","FDX-US,FDX","BW"," 6:00am","12-Feb-13"
"FedEx Corp.(FDX-US) Schedules Stifel Nicolaus Transportation and Logistics Conference for 12-February-2013 12:25 PM ET","FDX-US","FCST"," 9:14pm","6-Feb-13"
"Research and Markets: FedEx Corporation: 2013 Transport and Logistics Company Profile, SWOT and Financial Report","0BVD47-E,FDX-US,0...","BW"," 8:24am","5-Feb-13"
"Dir JACKSON Sells 17,810 of FEDEX CORP (FDX)","FDX-US,FDX","EDG"," 6:58am","5-Feb-13"
"FedEx Opens First-Ever Lemonade Stand in Super Bowl XLVII Media Center, Enlists NFL Stars to Help Junior Achievement Students Run Small Business","FDX-US,FDX","BW"," 6:00am","31-Jan-13"
"FedEx Delivers Vince Lombardi Trophy to New Orleans for Super Bowl XLVII","FDX-US,FDX","BW"," 1:00pm","30-Jan-13"
"Critical Alerts For Amgen, FedEx, Hertz, Navistar, and Ship Finance International Released By InvestorsObserver","AMGN-US,FDX-US,HT...","PRN"," 6:31am","29-Jan-13"
"FinderCodes™ LLC Introduces an Automatic Return Shipping Option for Lost and Found Valuables","FDX-US","BW"," 5:30am","29-Jan-13"
"A Look Inside FedEx's Second Quarter Earnings - Research Report on FedEx Corporation","FDX-US,UPS-US","PRN"," 5:00am","24-Jan-13"
"Moody's Affirms Baa3 Rating On The Capital Trust Agency's Aero Miami FX's (FL) Air Cargo Refunding Bonds; Rating Outlook Is Stable (Moodys) 7 pages","FDX-US","FRC"," 1:07pm","23-Jan-13"
"Moody's Affirms Baa3 Rating On The Capital Trust Agency's Aero Miami FX's (FL) Air Cargo Refunding Bonds; Rating Outlook Is Stable (Moodys) 6 pages","FDX-US","FRC"," 1:07pm","23-Jan-13"
