"Coca-Cola Announces Long-Term Partnership with DEKA R&D to Help Bring Clean Water to Communities in Need","063VYL-E,063THM-E...","BW"," 7:37am","25-Sep-12"
"CORRECTING and REPLACING The Coca-Cola Company Completes Transaction with Aujan Industries","0BFQJ7-E,KO","BW"," 6:57am","24-Sep-12"
"Coca-Cola completes acquisition of roughly half of Aujan Industries's beverage business","KO-US","SA"," 6:31am","24-Sep-12"
"Coca-Cola Hellenic wird das fünfte Mal in Folge als eines der weltweit führenden Unternehmen bei der Nachhaltigkeit in den Dow Jones Indexen aufgeführt","CCH-GR,KO-US","BW"," 7:36am","19-Sep-12"
"Coca-Cola Hellenic Listed as a World-Leader in Sustainability by Dow Jones Indexes for Fifth Consecutive Time","KO-US,OCCH-US,HLBR","PRN"," 5:55am","19-Sep-12"
"Coca-Cola rolls up its sleeves in support of the Great Canadian Shoreline Cleanup","KO-US,07WGCV-E,06...","CNW"," 5:30am","18-Sep-12"
"The Coca-Cola Company and Retail Partners Award $300,000 To the Hispanic Scholarship Fund During Hispanic Heritage Month","KO-US,0B2HTC-E,KO","BW"," 5:00am","18-Sep-12"
"Research and Markets: Successes and Failures Case Study: Coca-Cola "Share a Coke" Campaign","KO-US,07G69B-E","BW"," 3:25am","17-Sep-12"
"COCA COLA CO files (8-K) Current report: Items 5.02 - Changes in Exec Management, 8.01 - Other Events, 9.01 - Financial Statements and Exhibits, for period end 11-Sep-12 (KO-US)","KO-US,KO","EDG"," 8:01am","14-Sep-12"
"The Coca-Cola Company and Greater Houston Retailers Association Team up to Award $50,000 in Scholarships to Texas Students","0B2HTC-E,KO","BW"," 9:25am","13-Sep-12"
"Coca-Cola Canada rolls up its sleeves in support of the Great Canadian Shoreline Cleanup","KO-US,06WWC5-E","CNW"," 2:22pm","12-Sep-12"
"Coca-Cola Provides $196,000 Grant to United States Forest Service to Restore Critical Watershed","06N6X9-E,KO-US","BW","10:00am","12-Sep-12"
"Where We Are Headed - New Outlook on Coca-Cola Company (The) and Pepsico, Inc. ","KO-US,PEP-US","MW"," 6:00am","12-Sep-12"
"The Coca-Cola Company Announces Leadership Appointments to Support New Operating Structure","KO-US,0B5R0B-E","BW"," 5:30am","12-Sep-12"
"Media Advisory - Coca-Cola Ottawa shows support for the Great Canadian Shoreline Cleanup","KO-US,06ZL85-E,06...","CNW"," 9:30am","11-Sep-12"
"Coca-Cola effectue une première livraison vers le Myanmar en plus de 60 ans","KO-US,0C6N6L-E,09...","BW"," 4:47am","11-Sep-12"
"Coca-Cola Makes First Delivery to Myanmar in More Than 60 Years","KO-US,0C6N6L-E,09...","BW"," 6:30am","10-Sep-12"
"All Four Schools Receiving Coca-Cola Japan Reconstruction Fund Grants in Shinchi, Fukushima, Complete Solar Power Facilities; Fund Soliciting Applicants for Stage Two of Grants","KO-US","PRN"," 4:37am","10-Sep-12"
"Taste the Difference: New DASANI DROPS™ Enliven the Everyday with a Splash of Flavor","KO-US,KO","BW"," 8:14am","7-Sep-12"
"Fitch: SunTrust Banks, Inc.'s Ratings Unaffected by Announced Actions","STI-US,KO-US,05M7...","BW"," 7:29am","7-Sep-12"
"CORRECTED TRANSCRIPT: The Coca-Cola Co.(KO-US), Barclays Capital Back-to-School Consumer Conference, 6-September-2012 10:30 AM ET","KO-US","FCST","12:08pm","6-Sep-12"
"Coca-Cola partners with WWF and Comité ZIP du lac Saint-Pierre to restore local wetland and improve the stewardship of Quebec's waterways","KO-US,06WWC5-E","CNW"," 7:00am","6-Sep-12"
"CCE Presents at Barclays Back-To-School Conference, Affirms Full-Year 2012 Guidance, Announces Extension of CEO Employment Term","CCE-US,KO-US,05QP...","BW"," 4:15am","6-Sep-12"
"Aufruf an die fünfzig Millionen Coca-Cola-Fans auf Facebook: Macht die Welt zu einem glücklicheren Ort","KO-US,FB-US","BW"," 9:08pm","4-Sep-12"
"Fifty Million Coca-Cola Fans on Facebook Invited to Make the World a Happier Place","KO-US","BW"," 7:44am","4-Sep-12"
"En octroyant de nouvelles subventions à hauteur de 10,5 millions USD, la Fondation Coca-Cola relance les efforts de durabilité sur six continents","09LB2V-E,KO-US,0B...","BW"," 5:03pm","1-Sep-12"
"Mit 10,5 Millionen US-Dollar neuer Beihilfen unterstützt The Coca-Cola Foundation Nachhaltigkeitsbestrebungen auf sechs Kontinenten","09LB2V-E,KO-US,0B...","BW","12:12pm","1-Sep-12"
"10,5 Millones USD en Nuevas Subvenciones de la Fundación Coca-Cola Generarán Esfuerzos de Sostenibilidad en Seis Continentes","KO","BW","11:05am","1-Sep-12"
"Holder BOZER AHMET C Updates Ownership of COCA COLA CO (KO) (Amended)","KO-US,KO","EDG","11:38am","31-Aug-12"
"$10.5 Million in New Grants from The Coca-Cola Foundation Will Spark Sustainability Efforts on Six Continents","09LB2V-E,KO-US","BW","11:01am","30-Aug-12"
"Diet Coke Gets Chic Wardrobe Makeover Just in Time for the Fall Fashion Season","TGT-US,KO","BW","11:00am","30-Aug-12"
"Coke Zero Rewards Football Fans Who Live Gameday Every Day","KO-US,06467Z-E","BW","10:00am","30-Aug-12"
"Protecting Montreal's Water Resources One Rain Barrel at a Time - Coca-Cola helps Montrealers harvest rainwater with donation of 100 rain barrels","07J44M-E,KO-US","CNW"," 9:02am","30-Aug-12"
"Coca-Cola Enterprises, Inc. to Webcast Presentation to Barclays Back-To-School Conference","CCE-US,KO-US,BCS-GB","BW"," 8:15am","28-Aug-12"
"Coca-Cola Offers Teen Soccer Fans the Chance to Score Big in Three-Day Training Camp","KO-US,0C6K64-E,AD...","BW","12:45pm","27-Aug-12"
"Coke Zero Welcomes Brian Urlacher and Patrick Sharp to Chicago Sports Family","KO-US,KO","BW"," 6:00am","27-Aug-12"
"The Coca-Cola Co.(KO-US) Schedules Q3 2012 Earnings Call for 16-October-2012 9:30 AM ET","KO-US","FCST"," 7:08am","24-Aug-12"
"The Coca-Cola Co.(KO-US) Schedules Q3 2012 Earnings Release for 16-October-2012 Before Market Open ET","KO-US","FCST"," 7:08am","24-Aug-12"
"The Coca-Cola Company Announces Timing of Earnings Release and Investor Conference Call","KO","BW"," 7:00am","24-Aug-12"
"COCA COLA CO files (8-K) Current report: Items 7.01 - Regulation FD, 9.01 - Financial Statements and Exhibits, for period end 23-Aug-12 (KO-US)","KO-US,KO","EDG","10:59am","23-Aug-12"
"Research and Markets: Coca-Cola Co, The in Soft Drinks (World) - The World's Leading Soft Drinks Company Aims to double its Size over the 2010 to 2020 Decade","KO-US,07G69B-E","BW"," 5:11am","20-Aug-12"
"The Coca-Cola Company to Participate in Barclays Capital Back-to-School Consumer Conference","05ZYBJ-E,BCS-GB,K...","BW"," 8:00am","15-Aug-12"
"Ownership Updates: COCA COLA CO  COM (KO) for 15-Aug-2012","KO-US,19121610","FIO","12:41am","15-Aug-12"
"Healthy Fun in the Summer Sun: Coca-Cola Heats up Support of Active, Healthy Lifestyles and Military Heroes","09LB2V-E,KO-US,09...","BW"," 7:00am","13-Aug-12"
"Media Advisory - Coca-Cola Canada's 'Move to the Beat' bus rolls into Toronto","09TB54-E,KO-US","CNW"," 4:30am","10-Aug-12"
"There's Nothing Soft about It! Sprite Films™ Debuts Short Films Created by Aspiring Filmmakers","KO-US,KO","BW","10:00am","9-Aug-12"
"FUZE® Mixes Things up with New Line of Teas and Juice Drinks","KO-US,06467Z-E","BW"," 7:00am","9-Aug-12"
"The Zacks Analyst Blog Highlights: Wal-Mart, Abbott Labs, Johnson & Johnson, Coca-Cola and Cepheid","CPHD-US,WMT-US,JN...","PRN"," 6:30am","8-Aug-12"
"Ace Metrix Reports the Leading Advertisers at the Olympic Halfway Mark","07R2Q5-E,GE-US,KO...","BW"," 5:00am","7-Aug-12"
"Coke Zero® and Jerome "The Bus" Bettis Team Up To Bring Home the Excitement this 2012 Season","KO-US,06428W-E","BW"," 7:00am","6-Aug-12"
"Coca-Cola Canada's 'Move to the Beat' bus rolls into Ottawa","KO-US","CNW"," 8:47am","3-Aug-12"
"5 Familiar Stocks to Sell (or Short)!","GOOG-US,QCOM-US,O...","PRN"," 6:30am","3-Aug-12"
"Holder JORDAN GLENN Sells 50,548 of COCA COLA CO (KO)","KO-US,KO","EDG","12:36pm","2-Aug-12"
"Holder DOUGLAS J ALEXANDER JR Sells 12,500 of COCA COLA CO (KO)","KO-US,KO","EDG","12:29pm","2-Aug-12"
"Atlanta's Own Jeff Foxworthy to Perform at 4th Annual Hearts and Hands Gala on October 6","0B9SF3-E,KO-US","BW"," 8:43am","2-Aug-12"
"EPA Recognizes Coca-Cola Refreshments among Nation's Top Green Energy Users","KO","BW"," 6:00am","2-Aug-12"
"Coca-Cola said to be exploring bid of Fraser & Neave's beverage business -- Bloomberg (sources)","2503-JP,KO-US","SA"," 2:39pm","1-Aug-12"
"burn Announces Unique Creative Fusion of Electronic Music and Street Art","KO-US,KO","BW","12:00am","1-Aug-12"
"COCA COLA CO files (8-K) Current report: Items 8.01 - Other Events, 9.01 - Financial Statements and Exhibits, for period end 30-Jul-12 (KO-US)","KO-US,KO","EDG"," 1:16pm","31-Jul-12"
"VP WALLER Sells 6,524 of COCA COLA CO (KO)","KO-US,KO","EDG","11:52am","31-Jul-12"
"EVP CUMMINGS JR Sells 85,000 of COCA COLA CO (KO)","KO-US,KO","EDG","11:48am","31-Jul-12"
"SVP ANDERSON Sells 10,000 of COCA COLA CO (KO)","KO-US,KO","EDG","11:44am","31-Jul-12"
"Webinar: The Coca-Cola Company and Mozes Discuss How to Become Best-in-Class in Mobile ","KO-US","MW"," 7:00am","31-Jul-12"
"An End is a Cool, New Start: will.i.am and The Coca-Cola Company Recharge Recycling with Launch of Lifestyle Brand EKOCYCLETM","KO-US,09LB2V-E,07...","BW"," 6:17am","31-Jul-12"
"Church's Chicken® and Fanta® Announce a Fantastic Giveaway Bound to Cool You off with Some Hot Prizes","0BHDBL-E,KO-US","BW"," 4:34am","31-Jul-12"
"Coca-Cola unofficially anoints Steve Cahillane, Ahmet Bozer frontrunners in CEO competition - WSJ","KO-US,PEP-US","SA"," 7:19pm","30-Jul-12"
"/R E P E A T -- Coca-Cola Canada's 'Move To The Beat' Bus Rolls Into Toronto/","KO-US","CNW"," 6:00am","30-Jul-12"
"The Coca-Cola Company announces new operating structure and senior leadership appointments","KO-US","SA"," 5:32am","30-Jul-12"
"The Coca-Cola Company Announces New Operating Structure and Senior Leadership Appointments","0B5R0B-E,KO-US","BW"," 5:30am","30-Jul-12"
"The Board of Directors of The Coca-Cola Company Announces Quarterly Dividend","KO","BW"," 5:00am","30-Jul-12"
"COCA COLA CO files (8-K) Current report: Items 5.03 - Amendments to Corporate Charters, 9.01 - Financial Statements and Exhibits, for period end 27-Jul-12 (KO-US)","KO-US,KO","EDG","10:58am","27-Jul-12"
"The Coca-Cola Co.(KO-US) Schedules Barclays Capital Back-to-School Consumer Conference for 6-September-2012 10:30 AM ET","KO-US","FCST"," 2:30pm","26-Jul-12"
"COCA COLA CO files (10-Q) Basic quarterly filing, for period end 29-Jun-12 (KO-US)","KO-US,KO","EDG"," 8:26am","26-Jul-12"
"COCA COLA CO: 10-Q FactSet Blackline Report for period ending 6/29/2012","KO-US","FBLK"," 8:26am","26-Jul-12"
"Auntie Anne's Pretzels to Pilot Innovative Campaign Coupling Mobile Advertising with Real-Time Redemption Analytics","0B2PC7-E,063PSX-E...","BW"," 6:00am","26-Jul-12"
"Coca-Cola Celebrates More Than 80 Years of Olympic Partnership With Largest-Ever Activation","KO-US,KO","BW"," 4:00am","25-Jul-12"
"Coca-Cola Enterprises, Inc. Reports Second-Quarter 2012 Results","CCE-US,KO-US","BW"," 4:30am","23-Jul-12"
"Webinar: The Coca-Cola Company and Mozes Discuss How to Become Best-in-Class in Mobile ","KO-US","MW","10:12am","19-Jul-12"
"W Hotels Worldwide Kicks off 2012 W Hotels & burn studios DJ Lab","05WM1Y-E,HOT-US,K...","BW"," 7:17am","19-Jul-12"
"Analyst's Notes >> THE COCA-COLA CO (Argus Research) 4 pages","KO-US","FRC"," 6:36am","19-Jul-12"
"Sodexo and The Coca-Cola Company Celebrate Success of Annual Summer Feeding Program","KO-US","PRN"," 5:00am","19-Jul-12"
"Coca-Cola Canada's 'Move To The Beat' Bus Rolls Into Toronto","KO-US,09PC86-E","CNW"," 6:00am","18-Jul-12"
"Six Flags Extends and Expands Partnership with The Coca-Cola Company for Another Ten Years","SIX-US,KO-US","PRN"," 4:00am","18-Jul-12"
"CALLSTREET REPORT: The Coca-Cola Co.(KO-US), Q2 2012 Earnings Call, 17-July-2012 9:30 AM ET","KO-US","FCST"," 1:56pm","17-Jul-12"
"Heinz® Ketchup Inspires More Environmentally Responsible Living This Summer with PlantBottle™ Packaging Promotion","HNZ-US,KO-US,06PR...","BW"," 9:43am","17-Jul-12"
"Most Active Stocks: Petroleo Brasileiro SA, Arch Coal, Ford, Coca-Cola, Advanced Micro Devices, and Sirius","SIRI-US,PBR-BR,AC...","PRN"," 5:45am","17-Jul-12"
"COCA COLA CO files (8-K) Current report: Items 2.02 - Results of Operations, 9.01 - Financial Statements and Exhibits, for period end 17-Jul-12 (KO-US)","KO-US,KO","EDG"," 5:09am","17-Jul-12"
"Follow-up: Coca-Cola reports Q2 results - metrics versus StreetAccount consensus","KO-US","SA"," 4:46am","17-Jul-12"
"Coca-Cola reports Q2 EPS $1.22 ex-items vs FactSet $1.19","KO-US","SA"," 4:41am","17-Jul-12"
"The Coca-Cola Company Reports Second Quarter and Year-to-Date 2012 Results","KO-US,KO","BW"," 4:40am","17-Jul-12"
"StreetAccount consensus metrics for Coca-Cola","KO-US","SA"," 7:12am","16-Jul-12"
"Zacks Earnings Trends Highlights: Intel, IBM, Google and Coca Cola","GOOG-US,IBM-US,IN...","PRN"," 6:30am","16-Jul-12"
"Research and Markets: Coca-Cola: Corporate Analysis","KO-US,07G69B-E","BW"," 7:12am","13-Jul-12"
"Legendary Olympians Team Up With Boys & Girls Club Of America To Help Kids Stay Active And Live Healthy","KO-US","PRN"," 6:00am","13-Jul-12"
"Coca-Cola's Katie Bayne Elected to AFI Board of Trustees","06N6RN-E,KO-US,SN...","BW"," 8:00am","11-Jul-12"
"COCA COLA CO files (8-K) Current report: Items 5.07 - Submission of Matters to a Vote, 9.01 - Financial Statements and Exhibits, for period end 10-Jul-12 (KO-US)","KO-US,KO","EDG"," 1:23pm","10-Jul-12"
"Coca-Cola shareholders approve 2 for 1 stock split","KO-US","SA"," 7:20am","10-Jul-12"
"Shareowners of The Coca-Cola Company Approve Two-for-One Stock Split","KO-US,KO","BW"," 7:19am","10-Jul-12"
"Coca-Cola Company's Executive Vice President Visits Japan for School Ceremony to Commemorate Completion of Solar Facilities Installed with Grant from Coca-Cola Japan Reconstruction Fund","KO-US","PRN"," 1:26am","10-Jul-12"
"Coca-Cola Pilots Innovative Water Recovery System and Wins IWA Award","KO-US,KO","BW"," 7:00am","9-Jul-12"
"Research and Markets: Coca-Cola: Company Profile","KO-US,07G69B-E","BW"," 6:50am","6-Jul-12"
"Zacks Industry Outlook Highlights: Coca-Cola, PepsiCo, Altria Group and Reynolds American","RAI-US,RAI-US,MO-...","PRN"," 6:30am","6-Jul-12"
"Coca-Cola Wants Festival Goers to 'Move, Groove and Enjoy' During This Year's ESSENCE Music Festival","KO-US,09LB2V-E","BW"," 1:49pm","5-Jul-12"
"Coca-Cola Launches Refreshing New Programming Celebrating London 2012 Olympic Games","KO-US,06472Z-E,06...","BW"," 8:11am","5-Jul-12"
"Nely Galan, Founder Of The Adelante Movement, Delivers Speech At The NCLR Conference And Kicks Off The Adelante Movement: Tour For Latina Economic Empowerment","KO-US","PRN"," 2:00am","5-Jul-12"
"Dir NUNN Updates Ownership of COCA COLA CO (KO)","KO-US,KO","EDG","12:54pm","3-Jul-12"
"Holder DOUGLAS J ALEXANDER JR Sells 12,500 of COCA COLA CO (KO)","KO-US,KO","EDG","12:37pm","3-Jul-12"
"Dir WILLIAMS Updates Ownership of COCA COLA CO (KO)","KO-US,KO","EDG","12:34pm","3-Jul-12"
"Dir WALLENBERG Updates Ownership of COCA COLA CO (KO)","KO-US,KO","EDG","12:30pm","3-Jul-12"
"Dir UEBERROTH Updates Ownership of COCA COLA CO (KO)","KO-US,KO","EDG","12:26pm","3-Jul-12"
"Dir ROBINSON III Updates Ownership of COCA COLA CO (KO)","KO-US,KO","EDG","12:22pm","3-Jul-12"
"Dir MCHENRY Updates Ownership of COCA COLA CO (KO)","KO-US,KO","EDG","12:19pm","3-Jul-12"
"Dir LAGOMASINO Updates Ownership of COCA COLA CO (KO)","KO-US,KO","EDG","12:17pm","3-Jul-12"
"Dir KOTICK Updates Ownership of COCA COLA CO (KO)","KO-US,KO","EDG","12:11pm","3-Jul-12"
"Dir KEOUGH Updates Ownership of COCA COLA CO (KO)","KO-US,KO","EDG","12:05pm","3-Jul-12"
"Dir HERMAN Updates Ownership of COCA COLA CO (KO)","KO-US,KO","EDG","12:03pm","3-Jul-12"
"Dir GREENBERG Updates Ownership of COCA COLA CO (KO)","KO-US,KO","EDG","11:59am","3-Jul-12"
"Dir DILLER Updates Ownership of COCA COLA CO (KO)","KO-US,KO","EDG","11:56am","3-Jul-12"
"Dir DALEY Updates Ownership of COCA COLA CO (KO)","KO-US,KO","EDG","11:51am","3-Jul-12"
"Dir BUFFETT Updates Ownership of COCA COLA CO (KO)","KO-US,KO","EDG","11:48am","3-Jul-12"
"Dir ALLEN Updates Ownership of COCA COLA CO (KO)","KO-US,KO","EDG","11:46am","3-Jul-12"
"Dir ALLEN Updates Ownership of COCA COLA CO (KO)","KO-US,KO","EDG","11:44am","3-Jul-12"
"For Coke Zero and Ken Jeong There is More Than "Or"","KO-US,06CSG9-E","BW","11:20am","2-Jul-12"
"Schiff Nutrition Appoints Richard F. Baruch Jr. Senior Vice President - Chief Commercial Officer","WNI-US,KO-US","BW"," 5:00am","2-Jul-12"
"COCA COLA CO files (SC 13D/A) Acquisition of beneficial ownership of 5% or more (Amended) (KO-US)","KO-US,KO","EDG"," 2:13pm","29-Jun-12"
"COCA COLA CO files (11-K) Annual report for ESOPs, for period end 31-Dec-11 (KO-US)","KO-US,KO","EDG","12:37pm","28-Jun-12"
"COCA COLA CO files (11-K) Annual report for ESOPs, for period end 31-Dec-11 (KO-US)","KO-US,KO","EDG","12:22pm","28-Jun-12"
"COCA COLA CO files (11-K) Annual report for ESOPs, for period end 31-Dec-11 (KO-US)","KO-US,KO","EDG","12:12pm","28-Jun-12"
"COCA COLA CO files (11-K) Annual report for ESOPs, for period end 31-Dec-11 (KO-US)","KO-US,KO","EDG","12:10pm","28-Jun-12"
"COCA COLA CO files (11-K) Annual report for ESOPs, for period end 31-Dec-11 (KO-US)","KO-US,KO","EDG","11:12am","28-Jun-12"
"COCA COLA CO files (11-K) Annual report for ESOPs, for period end 31-Dec-11 (KO-US)","KO-US,KO","EDG","11:11am","28-Jun-12"
"Coca-Colaan to invest additional $3B in India through 2020","KO-US","SA"," 3:02am","26-Jun-12"
"Coca-Cola Targeting Additional US$3 Billion Investment to Support Long-Term, Sustainable Growth in India","KO-US,098JXK-E","BW"," 3:00am","26-Jun-12"
"SodaStream defies Coke demand and creates a virtual cage on Facebook","SODA-IL,KO-US","PRN","11:38am","25-Jun-12"
"Coca-Cola Offers Customers a Chance to Win a Trip to a U.S. Olympic Training Center - Available at Dollar General","KO-US,PG-US,DG-US","BW"," 9:56am","25-Jun-12"
"Coca-Cola Enterprises, Inc. to Webcast Second-Quarter 2012 Earnings Conference Call","CCE-US,KO-US,05QP...","BW"," 1:05pm","21-Jun-12"
"Hershey Names Leslie M. Turner Senior Vice President, General Counsel and Secretary","06467Z-E,HSY-US,K...","BW"," 6:00am","21-Jun-12"
"The Coca-Cola Company Commits $3.5 Million to U.S. Water Partnership","0BH3CH-E,KO-US","BW"," 5:54am","21-Jun-12"
"Coca-Cola® Happiness Machine Strikes Again This Summer","KO","BW"," 5:05am","20-Jun-12"
"WSJ interviews Coca-Cola CEO Muhtar Kent","KO-US","SA","12:14am","19-Jun-12"
"Train Like an Olympic Athlete with Powerade","KO-US,08HG17-E,KO","BW"," 7:09am","18-Jun-12"
"Minute Maid® Launches Great Tasting, New Fruit Punch and Strawberry Passion Flavors","06VY44-E,KO","BW"," 7:00am","18-Jun-12"
"Coca-Cola Supports Unique Tribute to Special Olympic Athletes and Their Dads","KO-US","PRN"," 3:31pm","15-Jun-12"
"The Coca-Cola Foundation Announces Plans for Community, Economic Investments in Myanmar","09LB2V-E,KO-US","BW"," 7:45am","14-Jun-12"
"Coca-Cola and BET Give Amateur Talent a Chance to Get Their Shine on This Summer","VIA-US,0649QJ-E,K...","BW"," 6:20pm","13-Jun-12"
"Bisnar | Chase Files Motion for Class Certification against Coca-Cola for Meal-Period Violations and Unreimbursed Business Expenses, Motion Hearing Set for July 2, 2012","KO-US","BW"," 3:17pm","12-Jun-12"
"The Coca-Cola Foundation Awards $26 Million to 85 Global Organizations During First Quarter 2012","09LB2V-E,KO-US","BW"," 7:13am","11-Jun-12"
"The Coca-Cola Co. (KO-US) - Annual Report for the Period Ending 31-Dec-2011 (Japanese)","KO-US","FFR"," 9:00pm","7-Jun-12"
"Coca-Cola Celebrates Summer with Support for Active, Healthy Lifestyles","KO-US,0BPKZ3-E,09...","BW"," 8:31am","6-Jun-12"
"Gold Peak® Tea to America: "Take the Year Off"","KO-US,06467Z-E","BW"," 7:24am","5-Jun-12"
"Coca-Cola, Ford, Heinz, Nike, and Procter & Gamble Form Collaborative to Accelerate Development of Products Made Entirely from Plants","PG-US,NKE-US,HNZ-...","BW"," 6:05am","5-Jun-12"
"A Forward Look, The Year Ahead - Featured Research on The Coca-Cola Company and Sodastream International Ltd ","KO-US,SODA-US","MW"," 6:00am","30-May-12"
"Summer Travel Season Full of Benefits for HMSHost Customers","05M23B-E,KO-US","BW","12:16pm","29-May-12"
"Coca-Cola Selects 22 Inspiring Americans to Carry the Olympic Flame in the London 2012 Olympic Torch Relay","KO-US,KO","BW","11:05am","29-May-12"
"Coca-Cola Partners With ScanLife to Drive Consumer Engagement; Uses QR Codes on All Coca-Cola Classic and Coca-Cola Zero Products in Spain","05T6M5-E,KO-US,0B...","PRN"," 6:30am","29-May-12"
"CFO FAYARD Updates Ownership of COCA COLA CO (KO)","KO-US,KO","EDG","12:23pm","25-May-12"
"COCA COLA CO files (DEFA14A) Definitive additional proxy soliciting materials (KO-US)","KO-US,KO","EDG"," 7:28am","25-May-12"
"COCA COLA CO files (DEF 14A) Definitive proxy statements, for period end 10-Jul-12 (KO-US)","KO-US,KO","EDG"," 7:14am","25-May-12"
"ADDING MULTIMEDIA Money Can Buy Happiness After All ... Sort Of","KO","BW"," 9:26am","24-May-12"
"Research Reports for BlackRock, United States Steel, Coca-Cola, Masco, Regions Financial, and Silver Wheaton","X-US,SLW-CA,RF-US...","PRN"," 5:50am","24-May-12"
"Barron's Weekday Trader is positive on Coca-Cola","KO-US","SA"," 4:07pm","23-May-12"
"Say "Yes" to Parks with Coca-Cola this Summer","KO-US,06467Z-E","BW"," 9:00am","23-May-12"
"The Coca-Cola Foundation Donates $500,000 to Abyssinian Development Corporation to Improve Educational Opportunities for Harlem's Youth","09LB2V-E,07R12Z-E...","BW"," 8:03am","23-May-12"
"Holder REINICHE DOMINIQUE Sells 177,073 of COCA COLA CO (KO)","KO-US,KO","EDG","12:32pm","22-May-12"
"The Coca-Cola Co.(KO-US) Schedules Q2 2012 Earnings Call for 17-July-2012 9:30 AM ET","KO-US","FCST"," 7:10am","17-May-12"
"The Coca-Cola Co.(KO-US) Schedules Q2 2012 Earnings Release for 17-July-2012 Before Market Open ET","KO-US","FCST"," 7:10am","17-May-12"
"The Coca-Cola Company Announces Timing of Earnings Release and Investor Conference Call","KO","BW"," 7:00am","17-May-12"
"Coca-Cola Launches Anywhere in the World the Coca-Cola Anthem for the London 2012 Olympic Games","KO-US,KO","BW","10:06am","16-May-12"
"COCA COLA CO files (PRE 14A) Preliminary proxy for uncontested materials or mergers, for period end 10-Jul-12 (KO-US)","KO-US,KO","EDG","12:24pm","15-May-12"
"SVP EBERLY Sells 6,642 of COCA COLA CO (KO)","KO-US,KO","EDG","12:05pm","15-May-12"
"Keen Strategy Adds Don Borreson","KO-US","PRN"," 9:30am","14-May-12"
"SVP WOLLAERT Sells 22,950 of COCA COLA CO (KO)","KO-US,KO","EDG","11:44am","11-May-12"
"CORRECTED TRANSCRIPT: The Coca-Cola Co.(KO-US), Goldman Sachs Consumer Products Symposium, 10-May-2012 1:00 PM ET","KO-US","FCST"," 4:12pm","10-May-12"
"Analyst's Notes >> COCA-COLA ENTERPRISES INC (Argus Research) 5 pages","KO-US,MORN-US","FRC","11:43am","10-May-12"
"Coke Zero Makes Danica Patrick the Newest Face in the Coca-Cola Racing Family","KO-US,05VGQ7-E,KO","BW"," 7:45am","10-May-12"
"Dir DALEY Buys 200 of COCA COLA CO (KO)","KO-US,KO","EDG","12:00pm","9-May-12"
"The Zacks Analyst Blog Highlights: Dish Network, Tyson Foods, Avis Budget Group, PepsiCo and The Coca Cola","TSN-US,PEP-US,KO-...","PRN"," 6:30am","8-May-12"
"Dollar General Recognizes Georgia Mom as "Every Day Hero"","PG-US,K-US,DG-US,...","BW"," 4:41am","8-May-12"
"Coca-Cola Brings the Fountain of the Future to Canadians","09TB54-E,KO-US","CNW"," 8:26am","4-May-12"
"Berger & Montague, P.C.: Bigios File Petition for Rehearing in Lawsuit Against Coca-Cola","KO-US","PRN"," 8:48am","3-May-12"
"SVP WILSON JR Disposes 5,251 of COCA COLA CO (KO)","KO-US,KO","EDG","11:52am","2-May-12"
"Holder DOUGLAS J ALEXANDER JR Sells 91,782 of COCA COLA CO (KO)","KO-US,KO","EDG","11:50am","2-May-12"
"CEO CAHILLANE STEVEN A Disposes 44,663 of COCA COLA CO (KO)","KO-US,KO","EDG","11:46am","2-May-12"
"SVP ANDERSON Sells 20,000 of COCA COLA CO (KO)","KO-US,KO","EDG","11:44am","2-May-12"
"Dir GREENBERG Buys 6,507 of COCA COLA CO (KO)","KO-US,KO","EDG","11:53am","1-May-12"
"Dir DILLER Buys 264,000 of COCA COLA CO (KO)","KO-US,KO","EDG","11:52am","1-May-12"
"EVP CUMMINGS JR Sells 85,000 of COCA COLA CO (KO)","KO-US,KO","EDG","11:50am","1-May-12"
"The Coca-Cola Company Issues Statement Regarding Media Reports Related to Monster Beverage Corporation","MNST-US,KO-US,KO","BW","12:50pm","30-Apr-12"
"COCA COLA CO files (8-K) Current report: Item 5.07 - Submission of Matters to a Vote, for period end 25-Apr-12 (KO-US)","KO-US,KO","EDG"," 8:33am","27-Apr-12"
"COCA COLA CO files (10-Q) Basic quarterly filing, for period end 30-Mar-12 (KO-US)","KO-US,KO","EDG"," 9:35am","26-Apr-12"
"COCA COLA CO: 10-Q FactSet Blackline Report for period ending 3/30/2012","KO-US","FBLK"," 9:35am","26-Apr-12"
"Coca-Cola Enterprises, Inc. Reports First-Quarter 2012 Results","CCE-US,KO-US,05QP...","BW"," 4:30am","26-Apr-12"
"Photo of Muhtar Kent, Chairman and CEO of The Coca-Cola Company, Presiding over the Company's Annual Meeting of Shareowners Available on Business Wire's Web Site and AP PhotoExpress","KO","BW","11:10am","25-Apr-12"
"The Coca-Cola Co.(KO) Schedules Extraordinary Shareholders Meeting for 10-July-2012","KO-US","FCST"," 6:42am","25-Apr-12"
"Coca-Cola's board voted to recommend a 2-for-1 stock split","KO-US","SA"," 6:09am","25-Apr-12"
"The Coca-Cola Company Board of Directors Recommends Two-for-One Stock Split","KO","BW"," 6:08am","25-Apr-12"
"Orlando Ashford joins Mercer to lead new business expansion in Corporate Board, CEO and C-suite effectiveness, change management and executive talent management","00763K-E,MMC-US,K...","BW"," 8:00am","24-Apr-12"
"The Coca-Cola Co.(KO-US) Schedules Wall Street Smarts Conference for 11-June-2012","KO-US","FCST"," 6:36am","24-Apr-12"
"Coca-Cola's American Canyon Facility to Introduce Five Natural Gas Hydrogen Fuel Cells on Earth Day at Ribbon Cutting Event","KO-US,KO","BW"," 2:44pm","19-Apr-12"
"Coca Cola and Dow Chemical Among Companies to Bring Consumer Focus to 2012 World Congress on Industrial Biotechnology","DOW-US,KO-US,008S...","BW"," 9:56am","19-Apr-12"
"The Zacks Analyst Blog Highlights: Google, Zynga, PepsiCo, Family Dollar Stores and The Coca-Cola","ZNGA-US,PEP-US,KO...","PRN"," 6:30am","19-Apr-12"
