"Dir MCHENRY Updates Ownership of COCA COLA CO (KO)","KO-US,KO","EDG","11:53am","17-Dec-10"
"Dir LAGOMASINO Updates Ownership of COCA COLA CO (KO)","KO-US,KO","EDG","11:53am","17-Dec-10"
"Dir KEOUGH Updates Ownership of COCA COLA CO (KO)","KO-US,KO","EDG","11:52am","17-Dec-10"
"Dir HERMAN Updates Ownership of COCA COLA CO (KO)","KO-US,KO","EDG","11:51am","17-Dec-10"
"Holder DOUGLAS J ALEXANDER JR Sells 24,000 of COCA COLA CO (KO)","KO-US,KO","EDG","11:50am","17-Dec-10"
"Dir DILLER Updates Ownership of COCA COLA CO (KO)","KO-US,KO","EDG","11:48am","17-Dec-10"
"EVP CUMMINGS JR Sells 5,500 of COCA COLA CO (KO)","KO-US,KO","EDG","11:47am","17-Dec-10"
"Dir BUFFETT Updates Ownership of COCA COLA CO (KO)","KO-US,KO","EDG","11:46am","17-Dec-10"
"Dir BLACK Updates Ownership of COCA COLA CO (KO)","KO-US,KO","EDG","11:45am","17-Dec-10"
"Dir ALLEN Updates Ownership of COCA COLA CO (KO)","KO-US,KO","EDG","11:44am","17-Dec-10"
"Dir ALLEN Updates Ownership of COCA COLA CO (KO)","KO-US,KO","EDG","11:42am","17-Dec-10"
"Coca-Cola Partners with Toys for Tots for a 'Last Call' at Union Station","KO-US","PRN","12:58pm","16-Dec-10"
"The Coca-Cola Foundation Surprises Five Atlanta Community Organizations with Unsolicited Grants of $10,000 Each","KO-US,09LB2V-E,KO","BW","11:07am","16-Dec-10"
"The Coca-Cola Co.(KO-US) Schedules Consumer Analyst Group of New York (CAGNY) Conference for 23-February-2011 12:30 PM ET","KO-US","FCST"," 5:59am","16-Dec-10"
"COCA COLA CO files (8-K) Current report: Items 8.01 - Other Events, 9.01 - Financial Statements and Exhibits, for period end 15-Dec-10 (KO-US)","KO-US,KO","EDG"," 1:47pm","15-Dec-10"
"COCA COLA CO files (8-K/A) Current report (Amended): Items 5.02 - Changes in Exec Management, 9.01 - Financial Statements and Exhibits, for period end 15-Dec-10 (KO-US)","KO-US,KO","EDG"," 1:22pm","15-Dec-10"
"The Coca-Cola Company Announces Expiration of Maximum Tender Offer","KO-US,KO","BW"," 6:07am","15-Dec-10"
"CORRECTED TRANSCRIPT: The Coca-Cola Co.(KO-US), Business Update Call, 14-December-2010 10:00 AM ET","KO-US","FCST","11:13am","14-Dec-10"
"The Coca-Cola Co.(KO-US) Schedules Q4 2010 Earnings Release for 9-February-2011 Before Market Open ET","KO-US","FCST"," 8:07am","14-Dec-10"
"The Coca-Cola Co.(KO-US) Schedules Q4 2010 Earnings Call for 9-February-2011 9:30 AM ET","KO-US","FCST"," 8:07am","14-Dec-10"
"The Coca-Cola Company to Present at Consumer Analyst Group of New York Conference","KO-US,KO","BW"," 8:00am","14-Dec-10"
"Dir BUFFETT Updates Ownership of COCA COLA CO (KO)","KO-US,KO","EDG","12:58pm","13-Dec-10"
"Dir BUFFETT -Initial Statement of Ownership of COCA COLA CO (KO)","KO-US,KO","EDG","12:43pm","13-Dec-10"
"The Coca-Cola Company and Chromocell Corporation Announce Innovative Sweetener Technology Collaboration","KO-US,09L5FX-E,KO","BW"," 7:30am","10-Dec-10"
"COCA COLA CO files (8-K) Current report: Items 5.02 - Changes in Exec Management, 9.01 - Financial Statements and Exhibits, for period end 9-Dec-10 (KO-US)","KO-US,KO","EDG"," 8:27am","9-Dec-10"
"Coca-Cola Holiday Caravan Makes Spirits Bright for Metro Atlanta Residents","KO-US,063RQX-E,07...","BW"," 1:21am","9-Dec-10"
"The Coca-Cola Company and Cutrale Citrus Juices Donate $3 Million to Help Fight Citrus Disease","KO-US,07XH61-E,KO","BW"," 6:00am","8-Dec-10"
"Coca-Cola® Donates $120,000 to Toys for Tots to Help Open Happiness This Holiday Season","KO-US,07BQ21-E,07...","BW"," 6:00am","8-Dec-10"
"Coca-Cola Chooses McCann as Agency Partner for Localizing Creative Work in Central and Southern Europe (CSE)","KO-US","PRNE"," 4:15am","7-Dec-10"
"Odyssey Software Enables New Coca-Cola Freestyle Fountains to Phone Home","KO-US","PRN"," 5:00am","6-Dec-10"
"SVP ANDERSON Sells 20,875 of COCA COLA CO (KO)","KO-US,KO","EDG","11:21am","3-Dec-10"
"COCA COLA CO files (8-K) Current report: Item 9.01 - Financial Statements and Exhibits, for period end 1-Dec-10 (KO-US)","KO-US,KO","EDG"," 2:12pm","1-Dec-10"
"Z100'S Jingle Ball to Be Televised for the First Time Ever Exclusively on Fuse Thursday, December 16 at 9PM ET","KO-US","BW"," 6:00am","1-Dec-10"
"The Coca-Cola Company Announces Results to Date of Maximum Tender Offer","KO-US,KO","BW"," 5:30am","1-Dec-10"
"The Coca-Cola Company Announces Total Consideration for Its Maximum Tender Offer","KO-US,KO","BW"," 1:01pm","30-Nov-10"
"COCA COLA CO files (8-K) Current report: Items 8.01 - Other Events, 9.01 - Financial Statements and Exhibits, for period end 23-Nov-10 (KO-US)","KO-US,KO","EDG"," 2:01pm","23-Nov-10"
"Correction: Coca-Cola","KO-US","SA"," 5:38am","23-Nov-10"
"The Coca-Cola Company Announces Results to Date of Cash Tender Offers","KO-US,KO","BW"," 5:30am","23-Nov-10"
"The Coca-Cola Company Announces Total Consideration for its Any and All Offer","KO-US,KO","BW"," 1:05pm","22-Nov-10"
"The Coca-Cola Company Announces Voluntary Withdrawal of Themed Drinking Glass","KO-US,KO","BW"," 4:32pm","21-Nov-10"
"COCA COLA CO files (8-K) Current report: Items 8.01 - Other Events, 9.01 - Financial Statements and Exhibits, for period end 15-Nov-10 (KO-US)","KO-US,KO","EDG"," 1:51pm","18-Nov-10"
"The Coca-Cola Company Invites Phoenix to Experience the Fountain of the Future","KO-US,KO","BW"," 9:52am","18-Nov-10"
"The Coca-Cola Co.(KO-US) Schedules Business Update Call for 14-December-2010 10:00 AM ET","KO-US","FCST"," 6:05am","18-Nov-10"
"The Coca-Cola Company to Discuss Corporate Social Responsibility During Global Citizen Diplomacy Summit in Washington, D.C.","KO-US,KO","BW"," 6:00am","18-Nov-10"
"The Coca-Cola Company Announces Timing of Modeling Conference Call","KO-US,KO","BW"," 1:30pm","17-Nov-10"
"CORRECTING and REPLACING The Coca-Cola Company Announces Change to the Terms of Tender Offers","KO-US,KO","BW"," 7:01pm","16-Nov-10"
"COCA COLA CO files (8-K) Current report: Items 5.02 - Changes in Exec Management, 9.01 - Financial Statements and Exhibits, for period end 16-Nov-10 (KO-US)","KO-US,KO","EDG"," 1:46pm","16-Nov-10"
"Cathleen P. Black to Resign from The Coca-Cola Company Board of Directors","KO-US,KO","BW"," 2:02pm","15-Nov-10"
"The Coca-Cola Company Announces Total Consideration for Its Any and All Offer","KO-US,KO","BW","12:53pm","15-Nov-10"
"S&P Equity Research Picks KO Focus Stock of the Week","0B1DD8-E,KO-US,MH...","PRN","10:24am","15-Nov-10"
"Dir DILLER Buys 270,000 of COCA COLA CO (KO)","KO-US,KO","EDG"," 6:59am","12-Nov-10"
"Holder REINICHE DOMINIQUE Sells 3,500 of COCA COLA CO (KO)","KO-US,KO","EDG"," 1:38pm","9-Nov-10"
"Coca-Cola Announces Next Phase in 'Greening' the National Mall","KO-US","PRN","11:00am","9-Nov-10"
"COCA COLA CO files (424B2) Prospectus for a primary offering on a delayed basis (KO-US)","KO-US,KO","EDG"," 3:00pm","8-Nov-10"
"COCA COLA CO files (8-K) Current report: Items 8.01 - Other Events, 9.01 - Financial Statements and Exhibits, for period end 4-Nov-10 (KO-US)","KO-US,KO","EDG"," 1:32pm","8-Nov-10"
"Sprite Refreshing Films™ Casts a Spotlight on Creativity with Call for Aspiring Moviemakers","KO-US,KO","BW","12:10pm","8-Nov-10"
"Coca-Cola, the USO and the 82nd Airborne Division "All-American" Chorus Recognize Veterans This Week","KO-US,KO","BW","11:06am","8-Nov-10"
"Fuse to Air Drake's First Ever Televised Concert "Drake: Live From Radio City Music Hall" Presented by Sprite","KO-US","BW"," 7:32am","8-Nov-10"
"COCA COLA CO files (FWP) Free writing prospectus after a registration statement has been filed (KO-US)","KO-US,KO","EDG"," 5:27pm","5-Nov-10"
"COCA COLA CO files (FWP) Free writing prospectus after a registration statement has been filed (KO-US)","KO-US,KO","EDG"," 5:27pm","5-Nov-10"
"Holder DOUGLAS J ALEXANDER JR Sells 38,500 of COCA COLA CO (KO)","KO-US,KO","EDG","12:15pm","5-Nov-10"
"SVP ANDERSON Sells 15,134 of COCA COLA CO (KO)","KO-US,KO","EDG","12:13pm","5-Nov-10"
"imc2 Strengthens Leadership Team, Adds Two to C-Level Roster ","KO-US","MW","12:00pm","5-Nov-10"
"FTC approves final order related to Coca-Cola's acquisition of Coca-Cola Enterprises","DPS-US,KO-US","SA","11:30am","5-Nov-10"
"Ownership Updates: COCA COLA CO  COM (KO) for  5-Nov-2010","KO-US,19121610","FIO","11:48pm","4-Nov-10"
"COCA COLA CO files (8-K) Current report: Items 8.01 - Other Events, 9.01 - Financial Statements and Exhibits, for period end 4-Nov-10 (KO-US)","KO-US,KO","EDG","10:01am","4-Nov-10"
"The Coca-Cola Company Announces Cash Tender Offer","KO-US,KO","BW"," 6:22am","4-Nov-10"
"COCA COLA CO files (424B5) Prospectus used for both 424B2 and 424B3 information (KO-US)","KO-US,KO","EDG"," 5:34am","4-Nov-10"
"Coca-Cola files mixed securities shelf of indeterminate size","KO-US","SA"," 5:17am","4-Nov-10"
"COCA COLA CO files (S-3ASR) Automatic shelf registration of seasoned issuers (KO-US)","KO-US,KO","EDG"," 5:15am","4-Nov-10"
"Muhtar Kent, Coca-Cola CEO, Will Speak at the National Press Club on Dec. 2","KO-US,07QK0X-E","PRN"," 3:23pm","3-Nov-10"
"SVP WILSON JR Sells 38,749 of COCA COLA CO (KO)","KO-US,KO","EDG","12:21pm","3-Nov-10"
"VP WALLER Sells 18,873 of COCA COLA CO (KO)","KO-US,KO","EDG","12:20pm","3-Nov-10"
"CEO CAHILLANE STEVEN A Sells 44,609 of COCA COLA CO (KO)","KO-US,KO","EDG","12:20pm","3-Nov-10"
"Dir DILLER Buys 120,000 of COCA COLA CO (KO)","KO-US,KO","EDG","12:03pm","2-Nov-10"
"Holder REINICHE DOMINIQUE Sells 226,500 of COCA COLA CO (KO)","KO-US,KO","EDG"," 8:57am","29-Oct-10"
"COCA COLA CO: 10-Q FactSet Blackline Report for period ending 10/01/2010","KO-US","FBLK"," 8:04am","29-Oct-10"
"COCA COLA CO files (10-Q) Basic quarterly filing, for period end 1-Oct-10 (KO-US)","KO-US,KO","EDG"," 8:03am","29-Oct-10"
"SVP ANDERSON Sells 119,942 of COCA COLA CO (KO)","KO-US,KO","EDG","12:04pm","27-Oct-10"
"New Global Coca-Cola Holiday Campaign Set to "Shake up Christmas" with Music Anthem from Train","KO-US,KO","BW"," 1:00am","26-Oct-10"
"Analyst's Notes >> COCA-COLA CO (Argus Research) 6 pages","KO-US,GIS-US,CCEA...","FRC"," 7:00am","22-Oct-10"
"Top Hollywood Celebrities to Attend and Perform at Atlanta Ronald McDonald House Charities Second Hearts and Hands Gala November 6th","KO-US","BW"," 2:26pm","20-Oct-10"
"Holder DOUGLAS J ALEXANDER JR Sells 38,500 of COCA COLA CO (KO)","KO-US,KO","EDG","12:09pm","20-Oct-10"
"EVP CUMMINGS JR Sells 5,500 of COCA COLA CO (KO)","KO-US,KO","EDG","12:08pm","20-Oct-10"
"SVP ANDERSON Sells 15,133 of COCA COLA CO (KO)","KO-US,KO","EDG","12:07pm","20-Oct-10"
"Zacks Bull and Bear of the Day Highlights: RSH, MON, KO, PEP, LMT","RSH-US,PEP-US,MON...","BW"," 7:01am","20-Oct-10"
"Little PINK Book Features America's Top Women in Business","MET-US,KO-US","PRN"," 6:15am","20-Oct-10"
"CALLSTREET REPORT: The Coca-Cola Co.(KO-US), Q3 2010 Earnings Call, 19-October-2010 9:30 AM ET","KO-US","FCST"," 1:14pm","19-Oct-10"
"Professional Research on The Coca-Cola Company and Dr Pepper Snapple Group Inc. - Globalization, Fast Food and Bioplastics Bolster Soft Drink Companies ","KO-US,DPS-US","MW"," 5:35am","19-Oct-10"
"COCA COLA CO files (8-K) Current report: Items 2.02 - Results of Operations, 9.01 - Financial Statements and Exhibits, for period end 19-Oct-10 (KO-US)","KO-US,KO","EDG"," 5:31am","19-Oct-10"
"Follow-up: Coca-Cola reports Q3 total case volume +5% vs StreetAccount +3.8%","KO-US","SA"," 4:40am","19-Oct-10"
"Coca-Cola reports Q3 EPS $0.92 ex-items vs Reuters $0.89","KO-US","SA"," 4:35am","19-Oct-10"
"Consensus segment results for Coca-Cola","KO-US","SA","12:08pm","18-Oct-10"
"Top Hollywood Celebrities to Attend and Perform at Atlanta Ronald McDonald House Charities Second Hearts and Hands Gala November 6th","KO-US,KO","BW"," 8:42am","18-Oct-10"
"AirTran Airways Adds vitaminwater zero™ to Onboard Beverage Lineup","KO-US,AAI.XX1-US","PRN"," 7:00am","18-Oct-10"
"$100,000 Up for Grabs Through Sprite® Refresh Your School Playground Sweepstakes","KO-US,07LLBM-E,KO","BW","12:20pm","14-Oct-10"
"CEO CAHILLANE STEVEN A -Initial Statement of Ownership of COCA COLA CO (KO)","KO-US,KO","EDG"," 9:58am","12-Oct-10"
"Analyst's Notes >> COCA-COLA CO (Argus Research) 6 pages","KO-US","FRC","12:32pm","11-Oct-10"
"Guests and Locals Invited to Continue the Tradition of Skating into the Season at The St. Regis Atlanta's Astor Holiday Rink, Presented by Coca-Cola","KO-US,00272D-E,09...","BW"," 5:00am","11-Oct-10"
"Coca-Cola reinstated buy at Goldman Sachs","KO-US","SA"," 3:39am","8-Oct-10"
"Holder BOZER AHMET C Sells 64,292 of COCA COLA CO (KO)","KO-US,KO","EDG","12:02pm","7-Oct-10"
"Zacks Analyst Blog Highlights: UBS AG, Credit Suisse Group, Dr Pepper Snapple Group, The Coca-Cola Company and Coca-Cola Enterprises","UBSN-CH,KO-US,DPS...","BW"," 2:00pm","6-Oct-10"
"Dir LAGOMASINO Updates Ownership of COCA COLA CO (KO)","KO-US,KO","EDG"," 2:08pm","5-Oct-10"
"Dir WILLIAMS Updates Ownership of COCA COLA CO (KO)","KO-US,KO","EDG"," 2:04pm","5-Oct-10"
"Dir WALLENBERG Updates Ownership of COCA COLA CO (KO)","KO-US,KO","EDG"," 2:03pm","5-Oct-10"
"Dir UEBERROTH Updates Ownership of COCA COLA CO (KO)","KO-US,KO","EDG"," 1:58pm","5-Oct-10"
"Dir ROBINSON III Updates Ownership of COCA COLA CO (KO)","KO-US,KO","EDG"," 1:58pm","5-Oct-10"
"Dir NUNN Updates Ownership of COCA COLA CO (KO)","KO-US,KO","EDG"," 1:57pm","5-Oct-10"
"Dir MCHENRY Updates Ownership of COCA COLA CO (KO)","KO-US,KO","EDG"," 1:56pm","5-Oct-10"
"Dir KEOUGH Updates Ownership of COCA COLA CO (KO)","KO-US,KO","EDG"," 1:55pm","5-Oct-10"
"Dir HERMAN Updates Ownership of COCA COLA CO (KO)","KO-US,KO","EDG"," 1:55pm","5-Oct-10"
"Dir DILLER Updates Ownership of COCA COLA CO (KO)","KO-US,KO","EDG"," 1:54pm","5-Oct-10"
"Dir BLACK Updates Ownership of COCA COLA CO (KO)","KO-US,KO","EDG"," 1:51pm","5-Oct-10"
"Dir ALLEN Updates Ownership of COCA COLA CO (KO)","KO-US,KO","EDG"," 1:48pm","5-Oct-10"
"Dir ALLEN Updates Ownership of COCA COLA CO (KO)","KO-US,KO","EDG"," 1:47pm","5-Oct-10"
"COCA COLA CO files (8-K) Current report: Items 1.01 - Entry into Definitive Agreement, 2.01 - Acquisitions or Disposal of Assets, 2.03 - Off-Balance Sheet Arrangements, 9.01 - Financial Statements and Exhibits, for period end 2-Oct-10 (KO-US)","KO-US,KO","EDG"," 1:46pm","5-Oct-10"
"Coca-Cola finalizes transaction with Coca-Cola Enterprises, remains committed to $1.5B share repurchase","CCE-US,KO-US","SA"," 1:10pm","5-Oct-10"
"Dr Pepper Snapple Group Completes Licensing of Certain Brands to The Coca-Cola Company","KO-US,DPS-US,CCE-US","PRN"," 1:41pm","4-Oct-10"
"Critical Alerts for JPMorgan Chase, Coca-Cola, Peabody Energy, Infosys, and Steel Dynamics Released by Seven Summits Research","STLD-US,KO-US,BTU...","PRN"," 6:31am","4-Oct-10"
"The Coca-Cola Company Finalizes Transaction with Coca-Cola Enterprises","KO-US,CCE-US,KO","BW"," 6:59am","3-Oct-10"
"COCA COLA CO files (S-3ASR) Automatic shelf registration of seasoned issuers (KO-US)","KO-US,KO","EDG"," 2:11pm","1-Oct-10"
"COCA COLA CO files (S-8) Registration of securities for ESOPs (KO-US)","KO-US,KO","EDG"," 2:05pm","1-Oct-10"
"The CEOs Summit Convergence 2010 Conference Uncovers Prestigious Speaker Line Up for October 4th Event ","KO-US","MW"," 6:41am","1-Oct-10"
"The Coca-Cola Company Invites Austin to Experience the Fountain of the Future","KO-US,KO","BW"," 6:15am","1-Oct-10"
"Coca-Cola Announces New Partnership with the Washington Capitals, Mystics, Nationals, Redskins and Wizards to 'Get the Ball Rolling' Against Childhood Obesity","KO-US","PRN"," 9:30am","28-Sep-10"
"The Coca-Cola Company Commits New Investments of US$1B in the Philippines","KO-US,KO","BW"," 5:49am","28-Sep-10"
"COCA COLA CO files (8-K) Current report: Items 8.01 - Other Events, 9.01 - Financial Statements and Exhibits, for period end 27-Sep-10 (KO-US)","KO-US,KO","EDG"," 2:16pm","27-Sep-10"
"Coca-Cola comments on FTC approval of its CCE acquisition","CCE-US,KO-US","SA"," 7:32am","27-Sep-10"
"The Coca-Cola Company Obtains Regulatory Clearance for Acquisition of CCE's North American Business","KO-US,KO,CCE,1912...","BW"," 7:31am","27-Sep-10"
"Follow-up: FTC puts conditions on Coca-Cola's acquisition of Coca-Cola Enterprises (CCE)","CCE-US,DPS-US,KO-US","SA"," 7:11am","27-Sep-10"
"FTC puts conditions on Coca-Cola's acquisition of Coca-Cola Enterprises (CCE)","CCE-US,KO-US","SA"," 7:10am","27-Sep-10"
"World Television Celebrates Awards Win in Top Digital Communications Competition ","062HSV-E,KO-US","MW"," 9:37am","22-Sep-10"
"The Coca-Cola Company Pledges to Empower 5 Million Women Entrepreneurs by 2020","KO-US,KO","BW","10:30am","21-Sep-10"
"Fanta® Announces Brittany Hampton as Winner of the 2010 Search for the Fourth Fantana™","KO-US,KO","BW"," 1:57pm","20-Sep-10"
"Happy Birthday, Coke Zero!","KO-US,KO","BW"," 9:59am","20-Sep-10"
"Governor's Council Announces School Winners of Live Positively Fitness Centers","KO-US","PRN"," 8:30am","15-Sep-10"
"Opportunity Green Announces Fourth Annual Green Business Conference September 22 - 24 at Los Angeles Center Studios","KO-US,09KCP2-E","PRN"," 6:00am","13-Sep-10"
"Bear Head Lake State Park in Minnesota Voted "America's Favorite Park" Through Coca-Cola Campaign","KO-US,063YJL-E,KO","BW"," 9:00am","9-Sep-10"
"CORRECTED TRANSCRIPT: The Coca-Cola Co.(KO-US), Barclays Back-To-School Consumer Conference, 8-September-2010 9:45 AM ET","KO-US","FCST","11:07am","8-Sep-10"
"The Coca-Cola Company and The Nature Conservancy Release Water Footprint Report","KO-US,06PRNY-E,KO","BW"," 5:00am","8-Sep-10"
"COCA COLA CO files (8-K) Current report: Items 1.01 - Entry into Definitive Agreement, 8.01 - Other Events, for period end 7-Sep-10 (KO-US)","KO-US,KO","EDG"," 1:05pm","7-Sep-10"
"Coca-Cola suggests Chinese distribution-and-manufacturing model for Indian franchisee bottlers - Economic Times","KO-US","SA"," 6:34pm","6-Sep-10"
"Zacks Analyst Blog Highlights: Wesco Financial, Berkshire Hathaway, Coca-Cola, Procter & Gamble and Wells Fargo","WFC-US,PG-US,KO-US","BW"," 2:00pm","3-Sep-10"
"Coke Zero Kicks off College Football Season with "Playbook of Possibilities"","KO-US,KO","BW","10:44am","31-Aug-10"
"The Coca-Cola Co.(KO-US) Schedules Barclays Back-To-School Consumer Conference for 8-September-2010 9:45 AM ET","KO-US","FCST"," 7:23am","31-Aug-10"
"Zacks Analyst Blog Highlights: Berkshire Hathaway, Wesco Financial, Coca-Cola, Procter & Gamble and Wells Fargo","WFC-US,PG-US,KO-U...","BW"," 2:00pm","30-Aug-10"
"The Coca-Cola Company to Participate in the Barclays Capital Back-to-School Consumer Conference","KO-US,KO","BW"," 7:00am","30-Aug-10"
"COCA COLA CO files (8-K) Current report: Item 8.01 - Other Events, for period end 26-Aug-10 (KO-US)","KO-US,KO","EDG"," 2:22pm","27-Aug-10"
"Teamsters: Coca-Cola Investor Alert","KO-US,CCE-US","PRN"," 8:17am","26-Aug-10"
"Critical Alerts for Coca-Cola, Costco, Chubb, AGCO, and EnCana Released by Seven Summits Research","KO-US,ECA-CA,COST...","PRN"," 6:31am","25-Aug-10"
"COCA COLA CO files (8-K) Current report: Items 8.01 - Other Events, 9.01 - Financial Statements and Exhibits, for period end 24-Aug-10 (KO-US)","KO-US,KO","EDG"," 1:27pm","24-Aug-10"
"The Coca-Cola to refile HSR application to FTC for approval of acquisition of N American bottling business of Coca-Cola Enterprises (CCE)","CCE-US,KO-US","SA"," 1:05pm","24-Aug-10"
"The Coca-Cola Company to Refile Hart-Scott-Rodinopre-Merger Notification","KO-US,KO","BW"," 1:00pm","24-Aug-10"
"Research on Coca-Cola and Pepsico - Soft Drinks Makers Treading Cautiously ","KO-US,PEP-US","MW"," 6:02am","23-Aug-10"
"Research and Markets: This Functional Drink in Australia Report Offers a Comprehensive Guide to the Size and Shape of the Market at a National Level","KO-US","BW"," 3:35am","20-Aug-10"
"The Coca-Cola Company's Haiti Hope Project Momentum Continues with Investment from United States Government","KO-US,IADB-GB,KO","BW"," 5:30am","18-Aug-10"
"Bryan Anderson Named Southern Company Vice President, Governmental Affairs","SO-US,KO-US","PRN","12:30pm","16-Aug-10"
"Ownership Updates: COCA COLA CO  COM (KO) for 15-Aug-2010","KO-US,19121610","FIO"," 2:07am","15-Aug-10"
"The Coca-Cola Co.(KO-US) Schedules Q3 2010 Earnings Call for 19-October-2010 9:30 AM ET","KO-US","FCST"," 2:41pm","10-Aug-10"
"The Coca-Cola Co.(KO-US) Schedules Q3 2010 Earnings Release for 19-October-2010 Before Market Open ET","KO-US","FCST"," 1:43pm","10-Aug-10"
"Only 15 per cent of Canadian Teens are Aware of the Youth Health Crisis","KO-US","CNW"," 3:00am","10-Aug-10"
"$3.5 Million in New Grants From Clinton Bush Haiti Fund to Create Jobs and Promote Economic Opportunities for Haitians","KO-US,0BYNRJ-E","PRN"," 9:03am","9-Aug-10"
"The Coca-Cola Co agreed to acquire Nidan Soki OAO","KO-US,05W578-E,06...","FFW"," 8:35am","9-Aug-10"
"A Million Ways to Say Thanks","KO-US,07LLBM-E,KO","BW"," 7:06am","4-Aug-10"
"COCA COLA CO: 10-Q FactSet Blackline Report for period ending 7/02/2010","KO-US","FBLK"," 7:07am","2-Aug-10"
"COCA COLA CO files (10-Q) Basic quarterly filing, for period end 2-Jul-10 (KO-US)","KO-US,KO","EDG"," 7:06am","2-Aug-10"
"Coca-Cola upgraded to overweight from neutral at JPMorgan","KO-US","SA"," 4:14am","2-Aug-10"
"COCA COLA CO files (8-K) Current report: Items 8.01 - Other Events, 9.01 - Financial Statements and Exhibits, for period end 30-Jul-10 (KO-US)","KO-US,KO","EDG"," 8:13am","30-Jul-10"
"Coca-Cola to refile Hart-Scott-Rodino and Canadian Pre-Merger Notifications","CCE-US,KO-US","SA"," 8:07am","30-Jul-10"
"The Coca-Cola Company to Refile Hart-Scott-Rodino and Canadian Pre-Merger Notifications","KO-US,KO","BW"," 8:06am","30-Jul-10"
"Zacks Bull and Bear of the Day Highlights: Altera, FTI Consulting, Microsoft, Coca-Cola and United Technologies    ","UTX-US,MSFT-US,KO...","BW"," 2:00pm","22-Jul-10"
"Sodexo's 'Feeding Our Future®' Program Provides 13,000 Summer Lunches to Atlanta Children","KO-US,09JNNX-E","PRN"," 8:11am","22-Jul-10"
"WSJ is positive on Coca-Cola","KO-US","SA","11:48pm","21-Jul-10"
"CALLSTREET REPORT: The Coca-Cola Co.(KO-US), Q2 2010 Earnings Call, 21-July-2010 9:00 AM ET","KO-US","FCST","12:19pm","21-Jul-10"
"Coca-Cola removed from short-term buy list at Deutsche Bank","KO-US","SA"," 8:06am","21-Jul-10"
"COCA COLA CO files (8-K) Current report: Items 2.02 - Results of Operations, 9.01 - Financial Statements and Exhibits, for period end 21-Jul-10 (KO-US)","KO-US,KO","EDG"," 5:18am","21-Jul-10"
"Follow-up/Clarification: Coca-Cola reports Q2 total case volume +5%","KO-US","SA"," 4:44am","21-Jul-10"
"Coca-Cola reports Q2 adjusted EPS $1.06 vs Reuters $1.03","KO-US","SA"," 4:35am","21-Jul-10"
"Consensus segment results for Coca-Cola","KO-US","SA"," 9:16am","20-Jul-10"
"Large Insiders Trade Alerts on Coca-Cola, Honeywell, A&F, Weatherford, Johnson Controls, & Devon; Reported by Insiderslab.com","WFT-US,KO-US,HON-...","PRNA"," 7:09am","20-Jul-10"
"Seven Summits Research Releases Comments on IBM, Coca-Cola, Honeywell, Johnson Controls and Western Digital","WDC-US,KO-US,JCI-...","PRN"," 6:31am","19-Jul-10"
"Coca Cola Still Number One ","KO-US,PEP-US","MW"," 6:06am","15-Jul-10"
"Happiness Follows The 2010 FIFA World CupTM Trophy Tour by Coca-Cola","KO-US,KO","BW"," 5:00am","15-Jul-10"
"Zacks Analyst Blog Highlights: Nike, Coca-Cola, McDonald, Burger King and Rick's Cabaret","RICK-US,NKE-US,MC...","BW"," 2:00pm","12-Jul-10"
"Coca-Cola Shares the Celebration of the 2010 FIFA World Cup™ with Millions Around the World","KO-US,KO","BW"," 5:00am","11-Jul-10"
"Dir WILLIAMS Updates Ownership of COCA COLA CO (KO)","KO-US,KO","EDG"," 1:19pm","6-Jul-10"
"Dir WALLENBERG Updates Ownership of COCA COLA CO (KO)","KO-US,KO","EDG"," 1:07pm","6-Jul-10"
"Dir UEBERROTH Updates Ownership of COCA COLA CO (KO)","KO-US,KO","EDG"," 1:06pm","6-Jul-10"
"Dir ROBINSON III Updates Ownership of COCA COLA CO (KO)","KO-US,KO","EDG"," 1:02pm","6-Jul-10"
"Dir NUNN Updates Ownership of COCA COLA CO (KO)","KO-US,KO","EDG"," 1:00pm","6-Jul-10"
"Dir MCHENRY Updates Ownership of COCA COLA CO (KO)","KO-US,KO","EDG","12:54pm","6-Jul-10"
"Dir LAGOMASINO Updates Ownership of COCA COLA CO (KO)","KO-US,KO","EDG","12:53pm","6-Jul-10"
"Dir KEOUGH Updates Ownership of COCA COLA CO (KO)","KO-US,KO","EDG","12:52pm","6-Jul-10"
"Dir HERMAN Updates Ownership of COCA COLA CO (KO)","KO-US,KO","EDG","12:51pm","6-Jul-10"
"Dir DILLER Updates Ownership of COCA COLA CO (KO)","KO-US,KO","EDG","12:49pm","6-Jul-10"
"Dir BLACK Updates Ownership of COCA COLA CO (KO)","KO-US,KO","EDG","12:47pm","6-Jul-10"
"Dir ALLEN Updates Ownership of COCA COLA CO (KO)","KO-US,KO","EDG","12:46pm","6-Jul-10"
"Dir ALLEN Updates Ownership of COCA COLA CO (KO)","KO-US,KO","EDG","12:41pm","6-Jul-10"
"Coca-Cola Gives Back to New Orleans During the ESSENCE Music Festival","KO-US,KO","BW"," 1:30pm","1-Jul-10"
"Sprite(R) Gives Fans a Chance to Bowl With NBA All-Star LeBron James","KO-US,BC-US,BC,KO","PRN"," 7:28am","1-Jul-10"
"Coca-Cola Unleashes Summer Fun and Refreshment at 2010 ESSENCE Music Festival Presented by Coca-Cola","KO-US,KO","BW"," 1:56pm","30-Jun-10"
"Critical Alerts For Coca-Cola, Unitedhealth, Comcast, Allstate, and Sotheby's Released By Seven Summits Research","UNH-US,KO-US,CMCS...","PRN"," 6:31am","29-Jun-10"
"WSJ examines Coca-Cola's WOrld Cup advertising campaign","KO-US","SA","11:24pm","28-Jun-10"
"COCA-COLA COMPANY (KO=US) - REPORT FOR ACTIVE TRADERS (Pechala's Reports) 3 pages","KO-US","FRC"," 8:37pm","28-Jun-10"
"COCA COLA CO files (11-K) Annual report for ESOPs, for period end 31-Dec-09 (KO-US)","KO-US,KO","EDG","12:18pm","28-Jun-10"
"COCA COLA CO files (11-K) Annual report for ESOPs, for period end 31-Dec-09 (KO-US)","KO-US,KO","EDG","12:18pm","28-Jun-10"
"The Coca-Cola Co.(KO-US) Schedules Q2 2010 Earnings Call for 21-July-2010 9:00 AM ET","KO-US","FCST"," 5:21am","28-Jun-10"
"The Coca-Cola Co.(KO-US) Schedules Q2 2010 Earnings Release for 21-July-2010 Before Market Open ET","KO-US","FCST"," 5:19am","28-Jun-10"
"Large Trades Made by Insiders in Coca-Cola, Nike, Host Hotels & Resorts, Bed Bath & Beyond, Discover Financial Services, & Mattel; Reported by Insiderslab.com","NKE-US,KO-US,HST-...","PRNA"," 7:08am","25-Jun-10"
"Kvass: From Russia with Love","KO-US,KO","BW","11:00am","24-Jun-10"
