"Aujan Industries and The Coca-Cola Company Announce Signing of $980 Million Agreement","KO-US,0BFQJ7-E,KO","BW"," 2:12am","14-Dec-11"
"Paramount Pictures and Coke Zero Present the "MISSION: IMPOSSIBLE-GHOST PROTOCOL" Live Movie Premiere Event Featuring A Live Performance by Tiesto From Rio De Janeiro, Brazil","VIA-US,0650NP-E,K...","CNW","12:04am","12-Dec-11"
"Arca Continental Distinguished for Its Sustainability Efforts","AC-MX,05HXB8-E,05...","BW","11:43am","8-Dec-11"
"Coca-Cola Moves Its Secret Formula to the World of Coca-Cola","KO-US,KO","BW"," 7:31am","8-Dec-11"
"COCA COLA CO files (POS AM) Post-effective amendments for registrations (KO-US)","KO-US,KO","EDG"," 2:10pm","7-Dec-11"
"COCA COLA CO files (POS AM) Post-effective amendments for registrations (KO-US)","KO-US,KO","EDG"," 2:10pm","7-Dec-11"
"COCA COLA CO files (POS AM) Post-effective amendments for registrations (KO-US)","KO-US,KO","EDG"," 2:10pm","7-Dec-11"
"COCA COLA CO files (POS AM) Post-effective amendments for registrations (KO-US)","KO-US,KO","EDG"," 2:10pm","7-Dec-11"
"Coca-Cola drink that killed boy in Jilin Province 28-Nov was deliberately poisoned - China Business News, citing police","KO-US","SA"," 5:09pm","6-Dec-11"
"The Coca-Cola Foundation Awards $17.8 Million to 83 Organizations Worldwide During Fourth Quarter","09LB2V-E,KO-US","BW","10:00am","6-Dec-11"
"BURGER KING® Restaurants to Launch Coca-Cola Freestyle across the U.S.","05MNQM-E,KO-US,09...","BW"," 8:34am","6-Dec-11"
"The Coca-Cola Foundation Ends the Year with More Than $24.2 Million in Giving to Communities Across North America","09LB2V-E,KO-US,09...","BW"," 8:00am","6-Dec-11"
"CEO CAHILLANE STEVEN A Sells 52,292 of COCA COLA CO (KO)","KO-US,KO","EDG","11:16am","2-Dec-11"
"The Coca-Cola Company Joins (RED) to Help Eliminate AIDS","KO-US,KO","BW"," 5:00am","1-Dec-11"
"Critical Alerts For Coca-Cola, Transocean Ltd., Hospira, Dillard's, and Inhibitex Released By Seven Summits Research","RIG-US,KO-US,INHX...","PRN"," 6:31am","30-Nov-11"
"UPDATE: Webcast: The Coca-Cola Company, Live Nation Network, and Mozes Discuss Industry-Leading Best Practices ","KO-US","MW"," 8:14am","29-Nov-11"
"Webcast: The Coca-Cola Company, Live Nation Network, and Mozes Discuss Industry-Leading Best Practices ","KO-US","MW"," 7:00am","29-Nov-11"
"Critical Stock Price Alerts for Citigroup, Pfizer, Ford, Coca-Cola, Northern Oil & Gas, and VELATEL","PFE-US,NOG-US,KO-US","PRN"," 6:20am","29-Nov-11"
"Direction of Market Influences - Report Highlights The Coca-Cola Company and Unilever N.V. (ADR) ","KO-US,UN-US","MW"," 6:00am","28-Nov-11"
"Coca-Cola Taps Natasha Bedingfield to "Shake Up Christmas" for Global Holiday Campaign","KO-US,KO","BW"," 7:49am","25-Nov-11"
"Coca-Cola Taps Natasha Bedingfield to "Shake up Christmas" for Global Holiday Campaign","KO-US,KO","BW"," 5:14am","23-Nov-11"
"The Coca-Cola System Donates More Than $2 Million USD for Flood Victims in Thailand","09LB2V-E,08C1HX-E...","BW"," 6:00am","21-Nov-11"
"The Zacks Analyst Blog Highlights: Ross Stores, Kohl's, Wal-Mart Stores, Pepsico and Coca Cola","WMT-US,PEP-US,KSS...","PRN"," 6:30am","18-Nov-11"
"Coca-Cola to invest $2B in India from 2012-6 - Economic Times","KO-US","SA"," 8:30pm","14-Nov-11"
"Holder DOUGLAS J ALEXANDER JR Sells 137,031 of COCA COLA CO (KO)","KO-US,KO","EDG","12:03pm","14-Nov-11"
"The Accounts Payable Network Introduces the Accounts Payable Leadership Conference ","KO-US","MW"," 8:25am","14-Nov-11"
"Kauffman's Urban Entrepreneur Partnership (UEP) Takes Top Honors for Marketing and Communication Excellence ","KO-US","MW"," 3:00am","14-Nov-11"
"COCA COLA CO files (424B3) Prospectus detailing significant change to previous prospectus (KO-US)","KO-US,KO","EDG"," 2:05pm","10-Nov-11"
"Coca-Cola Enterprises, Inc. Declares Regular Quarterly Dividend","CCE-US,KO-US","BW"," 1:05pm","10-Nov-11"
"EVP TRIPODI Disposes 14,370 of COCA COLA CO (KO)","KO-US,KO","EDG","11:43am","9-Nov-11"
"Market Considerations in Europe Outlook - Featured Research on The Coca-Cola Company and Sodastream International Limited ","KO-US,SODA-US","MW"," 6:00am","9-Nov-11"
"COCA COLA CO files (EFFECT) Notice of effectiveness (KO-US)","KO-US,KO","EDG"," 3:01am","9-Nov-11"
"7-Eleven Joins Coca-Cola to Help Protect Polar Bears' Arctic Home","SE.XX1-US,KO-US,KO","BW","12:36pm","8-Nov-11"
"Critical Stock Alerts for ON Semiconductor, Electronic Arts, Coca-Cola, Best Buy, AMD & Eaton","KO-US,ETN-US,EA-U...","PRN"," 6:20am","8-Nov-11"
"Holder DOUGLAS J ALEXANDER JR Sells 106,483 of COCA COLA CO (KO)","KO-US,KO","EDG"," 1:18pm","7-Nov-11"
"Dir DILLER Buys 100,000 of COCA COLA CO (KO)","KO-US,KO","EDG"," 7:09am","3-Nov-11"
"The Zacks Analyst Blog Highlights: The Coca Cola, Coca-Cola Enterprises, Archer Daniels Midland, Bunge Limited and Corn Products International","KO-US,INGR.XX1-US...","PRN"," 6:30am","2-Nov-11"
"Equity Research on 6 Mega Stocks: Chevron, du Pont, U.S. Bancorp, Coca-Cola, Wells Fargo & Johnson & Johnson","WFC-US,KO-US,JNJ-...","PRN"," 6:00am","2-Nov-11"
"Cbeyond Appoints Wurzbacher to Board of Directors","CBEY-US,KO-US,0B0...","BW"," 8:53am","1-Nov-11"
"Hot Stock Research for Coca-Cola, AMD, RF Micro Devices, Google, Symantec & Intuitive Surgical","SYMC-US,RFMD-US,K...","PRN"," 6:20am","1-Nov-11"
"SVP ANDERSON Sells 20,000 of COCA COLA CO (KO)","KO-US,KO","EDG","11:05am","31-Oct-11"
"COCA COLA CO files (S-4) Registration of securities in business combinations (KO-US)","KO-US,KO","EDG"," 1:51pm","28-Oct-11"
"The Coca-Cola Foundation Pledges $500,000 to the Atlanta Women's Foundation to Empower Women and Girls in the Atlanta Community","0BRQPW-E,09LB2V-E...","BW","10:43am","27-Oct-11"
"COCA COLA CO files (10-Q) Basic quarterly filing, for period end 30-Sep-11 (KO-US)","KO-US,KO","EDG"," 9:01am","27-Oct-11"
"COCA COLA CO: 10-Q FactSet Blackline Report for period ending 9/30/2011","KO-US","FBLK"," 9:01am","27-Oct-11"
"The Coca-Cola Co agreed to acquire Great Plains Coca-Cola Bottling Co","KO-US,064JR7-E","FFW"," 6:55am","27-Oct-11"
"Coca-Cola Company to acquire Great Plains Coca-Cola Bottling Company for ~$360M","KO-US","SA"," 5:33am","27-Oct-11"
"Great Plains Coca-Cola Bottling Company and The Coca-Cola Company Sign Purchase Agreement","064JR7-E,KO-US,09...","BW"," 5:30am","27-Oct-11"
"Coca-Cola Enterprises, Inc. Reports Third-Quarter 2011 Results","CCE-US,KO-US","BW"," 4:30am","27-Oct-11"
"Analyst's Notes >> COCA COLA CO (Argus Research) 5 pages","KO-US,MORN-US","FRC"," 6:36am","26-Oct-11"
"The Coca-Cola System Donates $1 Million USD for Earthquake Relief in Eastern Turkey","09LB2V-E,KO-US","BW"," 8:30am","25-Oct-11"
"Iconic Coca-Cola Red Cans Turn Arctic White","064BC0-E,KO","BW"," 7:35am","25-Oct-11"
"Zacks Bull and Bear of the Day Highlights: DFC Global, NRG Energy, Bank of America, Goldman Sachs and Coke","NRG-US,KO-US,DLLR...","PRN"," 6:30am","19-Oct-11"
"CALLSTREET REPORT: The Coca-Cola Co.(KO), Q3 2011 Earnings Call, 18-October-2011 9:30 AM ET","KO-US","FCST"," 1:34pm","18-Oct-11"
"12 California Students Named 'Soda Sucks' Competition Winners","KO-US,080MGG-E,00...","BW","11:44am","18-Oct-11"
"Zacks Bull and Bear of the Day Highlights: UnitedHealth Group, Goldman Sachs, The Coca Cola Company, Coca Cola Enterprises and Pepsico","UNH-US,PEP-US,KO-...","PRN"," 6:30am","18-Oct-11"
"COCA COLA CO files (8-K) Current report: Items 2.02 - Results of Operations, 9.01 - Financial Statements and Exhibits, for period end 18-Oct-11 (KO-US)","KO-US,KO","EDG"," 5:34am","18-Oct-11"
"Follow-up: Coca-Cola reports Q3 results","KO-US","SA"," 4:44am","18-Oct-11"
"Coca-Cola reports Q3 EPS $1.03 ex-items vs Reuters $1.02","KO-US","SA"," 4:38am","18-Oct-11"
"The Coca-Cola Company Reports Third Quarter and Year-to-Date 2011 Results","KO-US,KO","BW"," 4:36am","18-Oct-11"
"The Coca-Cola Company Reports Third Quarter and Year-to-Date 2011 Results","KO-US","FFR"," 9:00pm","17-Oct-11"
"Consensus Q3 metrics for Coca-Cola","KO-US","SA","10:30am","17-Oct-11"
"Minute Maid® Announces the Launch of Minute Maid Pure Squeezed: An All-Star Line Up of Never From Concentrate Orange Juice Products","06VY44-E,KO-US,07...","BW"," 6:00am","17-Oct-11"
"Coca-Cola estimates lowered at UBS","KO-US","SA"," 4:53am","17-Oct-11"
"USAID Administrator Shah Delivers Remarks at Morehouse College, Recognizes Coca-Cola for Leadership in Private-Public Partnership","KO-US","PRN","12:31pm","14-Oct-11"
"The Zacks Analyst Blog Highlights: Microsoft, Berkshire Hathaway Class B, Procter & Gamble, Coca Cola and Wal-Mart Stores","WMT-US,PG-US,KO-U...","PRN"," 6:30am","12-Oct-11"
"Penton's Multi-Unit Foodservice Operators Conference (MUFSO) Holds its 52nd Show","PNRA-US,KO-US","PRN"," 6:52am","11-Oct-11"
"Environmental Initiative Supported by Coca-Cola Hellenic Romania Awarded €1 Million European Union Grant","CCH-GR,KO-US","BW"," 8:10am","6-Oct-11"
"Dir WILLIAMS Updates Ownership of COCA COLA CO (KO)","KO-US,KO","EDG"," 1:35pm","4-Oct-11"
"Dir WALLENBERG Updates Ownership of COCA COLA CO (KO)","KO-US,KO","EDG"," 1:34pm","4-Oct-11"
"Dir UEBERROTH Updates Ownership of COCA COLA CO (KO)","KO-US,KO","EDG"," 1:32pm","4-Oct-11"
"Dir ROBINSON III Updates Ownership of COCA COLA CO (KO)","KO-US,KO","EDG"," 1:29pm","4-Oct-11"
"Dir NUNN Updates Ownership of COCA COLA CO (KO)","KO-US,KO","EDG"," 1:28pm","4-Oct-11"
"Dir MCHENRY Updates Ownership of COCA COLA CO (KO)","KO-US,KO","EDG"," 1:26pm","4-Oct-11"
"Dir LAGOMASINO Updates Ownership of COCA COLA CO (KO)","KO-US,KO","EDG"," 1:25pm","4-Oct-11"
"Dir KEOUGH Updates Ownership of COCA COLA CO (KO)","KO-US,KO","EDG"," 1:23pm","4-Oct-11"
"Dir HERMAN Updates Ownership of COCA COLA CO (KO)","KO-US,KO","EDG"," 1:22pm","4-Oct-11"
"Dir GREENBERG Updates Ownership of COCA COLA CO (KO)","KO-US,KO","EDG"," 1:20pm","4-Oct-11"
"Dir DILLER Updates Ownership of COCA COLA CO (KO)","KO-US,KO","EDG"," 1:19pm","4-Oct-11"
"Dir BUFFETT Updates Ownership of COCA COLA CO (KO)","KO-US,KO","EDG"," 1:18pm","4-Oct-11"
"Dir ALLEN Updates Ownership of COCA COLA CO (KO)","KO-US,KO","EDG"," 1:16pm","4-Oct-11"
"Dir ALLEN Updates Ownership of COCA COLA CO (KO)","KO-US,KO","EDG"," 1:15pm","4-Oct-11"
"Interbrand Releases 12th Annual Best Global Brands Report","KO-US,2498-TW,GOO...","PRN","10:43am","4-Oct-11"
"Five Guys® Becomes Largest Chain to Roll Out Coca-Cola Freestyle® Nationwide","KO-US,09M6VN-E,KO","BW"," 8:40am","30-Sep-11"
"SEC release:  COCA COLA CO replies to SEC correspondence (CORRESP) - filed Sep 30, 2011 (KO-US)","KO-US,KO","EDG"," 6:14am","30-Sep-11"
"A Glittering Evening of Fashion to Celebrate the Coca-Cola 125th Anniversary JC/DC Collection","KO-US,05LDVC-E","PRN","11:00pm","29-Sep-11"
"The Social Agenda: The Pivot Conference Announces Its Full Speaker Lineup and Agenda, October 17th and 18th, New York City ","KO-US","MW"," 1:36pm","29-Sep-11"
"Coca-Cola Enterprises, Inc. to Webcast Third-Quarter 2011 Earnings Conference Call","CCE-US,KO-US","BW"," 1:05pm","29-Sep-11"
"Critical Alerts for Coca-Cola, United Technologies, Estee Lauder, Johnson Controls, and IAC/InterActiveCorp Released by Seven Summits Research","UTX-US,KO-US,JCI-...","PRN"," 6:31am","29-Sep-11"
"Critical Stock Alerts for QUALCOMM, E TRADE, Aruba, Coca-Cola, Symantec & Lululemon Athletica","SYMC-US,QCOM-US,K...","PRN"," 6:00am","29-Sep-11"
"Research Reports for Top Traded Penny Stocks: Metalico, Neostem & Evolution Petroleum, More Reports for Coca-Cola, Gilead Sciences & Duke Energy","NBS-US,MEA-US,KO-...","PRN"," 6:20am","28-Sep-11"
"Coke Zero Seeks Performer with All the Right Moves for Global Ad Campaign","KO-US,KO","BW"," 7:30am","27-Sep-11"
"Coca-Cola chief criticizes US tax rules - FT","KO-US","SA"," 4:45am","27-Sep-11"
"The Coca-Cola Co. (KO-US) - Interim Report for the Period Ending 01-Jul-2011 (Japanese)","KO-US","FFR"," 9:00pm","26-Sep-11"
"Coca-Cola System to Invest US$3 Billion for Long-Term Sustainable Growth in Russia","CCH-GR,KO-US,064L...","BW"," 5:00am","26-Sep-11"
"CORRECTED TRANSCRIPT: The Coca-Cola Co.(KO), Investor and Analyst Meeting, 21-September-2011 2:00 PM ET","KO-US","FCST"," 2:58pm","22-Sep-11"
"The Coca-Cola Company and United Nations Women Form Global Partnership to Accelerate Women's Economic Empowerment","KO-US,KO","BW"," 6:00am","22-Sep-11"
"Chairs Made from Recycled Plastic Coca-Cola Bottles to Go on Display; "111 Navy Chair" Is Icon at Tokyo Chair City Exhibition","KO-US","PRN"," 2:00am","22-Sep-11"
"The Coca-Cola Foundation Invests $9.6 Million to Fortify Global Sustainability Efforts","09LB2V-E,KO-US","BW"," 1:30pm","21-Sep-11"
"Holder REINICHE DOMINIQUE Sells 50,000 of COCA COLA CO (KO)","KO-US,KO","EDG","11:50am","21-Sep-11"
"Holder REINICHE DOMINIQUE Sells 50,000 of COCA COLA CO (KO)","KO-US,KO","EDG","11:49am","21-Sep-11"
"SEC release:  COCA COLA CO replies to SEC correspondence (CORRESP) - filed Sep 21, 2011 (KO-US)","KO-US,KO","EDG"," 6:14am","21-Sep-11"
"Hot Insider Trading of Oracle, Netflix, Apple, Cisco, Coca-Cola & PulteGroup","PHM-US,ORCL-US,KO...","PRN"," 6:10am","21-Sep-11"
"The Coca-Cola Foundation: Building Stronger Communities One Grant at a Time","09LB2V-E,KO-US,0B...","BW"," 8:00am","20-Sep-11"
"Insider Hot Stock Picks in Exxon Mobil, Coca-Cola, RF Micro Devices, Ciena, Altera & GT Advanced Technologies","XOM-US,RFMD-US,KO...","PRN"," 6:00am","20-Sep-11"
"SVP EBERLY Sells 20,122 of COCA COLA CO (KO)","KO-US,KO","EDG","11:12am","19-Sep-11"
"Coca-Cola Partners with the Washington Nationals to "Get the Ball Rolling" Against Childhood Obesity","0642LW-E,KO-US,07...","BW"," 7:41am","16-Sep-11"
"The Zacks Analyst Blog Highlights: BP plc, Halliburton, Transocean, Pepsico and Coca Cola","PEP-US,KO-US","PRN"," 6:30am","16-Sep-11"
"Holder BOZER AHMET C Updates Ownership of COCA COLA CO (KO) (Amended)","KO-US,KO","EDG"," 2:06pm","15-Sep-11"
"Research and Markets: Coca-Cola Company (The) : Competitive Benchmarking Report","KO-US","BW"," 7:54am","14-Sep-11"
"Coca-Cola Hellenic Included in Dow Jones Sustainability Indexes for Fourth Consecutive Year","CCH-GR,KO-US,0956...","BW"," 6:49am","13-Sep-11"
"Insider Stock Picks for Las Vegas Sands, Halliburton, Coca-Cola, Applied Materials, Newmont Mining & Johnson Controls","NEM-US,KO-US,JCI-...","PRN"," 6:00am","13-Sep-11"
"The Coca-Cola Co.(KO) Schedules Investor and Analyst Meeting for 21-September-2011 2:00 PM ET","KO-US","FCST"," 2:56pm","12-Sep-11"
"SVP ANDERSON Sells 16,500 of COCA COLA CO (KO)","KO-US,KO","EDG","11:13am","12-Sep-11"
"iCrossing Boosts Presence in Latin America and Europe With Acquisition of Wallaby Group ","KO-US","MW"," 5:00am","12-Sep-11"
"CORRECTED TRANSCRIPT: The Coca-Cola Co.(KO-US), Barclays Capital Back to School Consumer Conference, 8-September-2011 9:45 AM ET","KO-US","FCST","11:12am","8-Sep-11"
"Coca-Cola suspends €17M investment in France following tax raise on sodas -- Le Figaro","KO-US","SA"," 8:27am","8-Sep-11"
"Coca-Cola® Leads the Charge toward Greener Fleets","KO-US,05K2KG-E,KO","BW"," 6:00am","8-Sep-11"
"The Coca-Cola Co.(KO) Schedules Q3 2011 Earnings Call for 18-October-2011 9:30 AM ET","KO-US","FCST"," 8:44am","7-Sep-11"
"The Coca-Cola Co.(KO-US) Schedules Q3 2011 Earnings Release for 18-October-2011 Before Market Open ET","KO-US","FCST"," 8:42am","7-Sep-11"
"CEO CAHILLANE STEVEN A Disposes 25,831 of COCA COLA CO (KO)","KO-US,KO","EDG"," 1:13pm","6-Sep-11"
"Diet Coke Brings Extraordinary New Style to the Soft Drink Aisle","06467Z-E,KO-US","BW"," 8:06am","2-Sep-11"
"Critical Stock Alerts for Coca-Cola, Charles Schwab, JDS Uniphase, AMD, Amgen & Riverbed","KO-US,JDSU-US,AMG...","PRN"," 6:00am","2-Sep-11"
"COCA COLA CO files (8-K) Current report: Item 2.03 - Off-Balance Sheet Arrangements, for period end 1-Sep-11 (KO-US)","KO-US,KO","EDG"," 2:06pm","1-Sep-11"
"EVP CUMMINGS JR Sells 84,370 of COCA COLA CO (KO)","KO-US,KO","EDG","10:18am","1-Sep-11"
"Holder BOZER AHMET C Sells 123,796 of COCA COLA CO (KO)","KO-US,KO","EDG"," 5:44am","1-Sep-11"
"Coke Zero Helps Football Fans Enjoy Everything","KO-US,EA-US,0856P...","BW"," 8:27am","31-Aug-11"
"The Coca-Cola Company Announces Expiration of Previously Announced Exchange Offer","00CTTW-E,KO-US,06...","BW"," 5:45am","31-Aug-11"
"Significant Insider Trading at Exxon, Cisco, EMC, MGM, Coca-Cola & Netflix","XOM-US,NFLX-US,MG...","PRN"," 6:10am","24-Aug-11"
"T.J. Martell Foundation to Honor Legends at 36th Annual Awards Gala","KO-US,064S5F-E","PRN"," 1:00pm","22-Aug-11"
"The Zacks Analyst Blog Highlights: Hewlett-Packard Co., Dell, Autonomy Corp. plc and Coca-Cola","KO-US,IBM-US,DELL...","PRN"," 6:54am","22-Aug-11"
"The Coca-Cola Co.(KO-US) Schedules Barclays Capital Back to School Consumer Conference for 8-September-2011 9:45 AM ET","KO-US","FCST"," 6:10am","22-Aug-11"
"The Coca-Cola Company to Participate in the Barclays Capital Back-to-School Consumer Conference","KO-US,KO","BW"," 6:00am","22-Aug-11"
"COCA COLA CO files (8-K) Current report: Item 2.03 - Off-Balance Sheet Arrangements, for period end 19-Aug-11 (KO-US)","KO-US,KO","EDG"," 2:05pm","19-Aug-11"
"Insider Hot Stock Picks: EMC, Coca-Cola, Procter & Gamble, JDS Uniphase, Bristol Myers Squibb & Marriott","PG-US,MAR-US,KO-U...","PRN"," 6:00am","19-Aug-11"
"Holder REINICHE DOMINIQUE Sells 106,394 of COCA COLA CO (KO)","KO-US,KO","EDG"," 1:03pm","18-Aug-11"
"Coca-Cola invests $4B for long-term sustainable growth in China","19-HK,KO-US","SA"," 1:05am","18-Aug-11"
"Coca-Cola Invests US$4 Billion for Long-Term Sustainable Growth in China","09KKRY-E,073D71-E...","BW"," 1:00am","18-Aug-11"
"The Coca-Cola Company Announces Pricing of Previously Announced Exchange Offer","00CTTW-E,KO-US","BW"," 2:00pm","17-Aug-11"
"Wingstop Introduces Rio Grande Valley to Coca-Cola Freestyle®","05TC0L-E,KO-US","PRN"," 6:00am","17-Aug-11"
"The Coca-Cola Company Announces Expiration of Early Participation Period of Previously Announced Exchange Offer","00CTTW-E,KO-US,06...","BW"," 5:45am","17-Aug-11"
"Holder REINICHE DOMINIQUE Sells 65,431 of COCA COLA CO (KO)","KO-US,KO","EDG","11:01am","16-Aug-11"
"Ownership Updates: COCA COLA CO  COM (KO) for 16-Aug-2011","KO-US,19121610","FIO","12:28am","16-Aug-11"
"Simply Delicioso: Ingrid Hoffmann, Univision and Coca-Cola Launch Contest Full of "Sabor" for Hispanic Heritage Month","UVEL-HK,KO-US","BW"," 9:00am","12-Aug-11"
"The Coca-Cola System Donates $1.4 Million USD for Hunger Relief in Kenya, Ethiopia and Somalia","09LB2V-E,KO-US,0B...","BW"," 8:34am","12-Aug-11"
"COCA COLA CO files (8-K) Current report: Items 2.03 - Off-Balance Sheet Arrangements, 9.01 - Financial Statements and Exhibits, for period end 3-Aug-11 (KO-US)","KO-US,KO","EDG"," 2:29pm","8-Aug-11"
"Coca-Cola added to Conviction Buy List at Goldman Sachs","KO-US","SA"," 7:36pm","7-Aug-11"
"SEC release:  COCA COLA CO replies to SEC correspondence (CORRESP) - filed Aug 5, 2011 (KO-US)","KO-US,KO","EDG"," 6:14am","5-Aug-11"
"The Coca-Cola Foundation Awards $6 Million to Strengthen Global Community Efforts","09LB2V-E,KO-US","BW"," 7:00am","4-Aug-11"
"The Coca-Cola Company Commences Exchange Offer","00CTTW-E,KO-US","BW"," 3:52pm","3-Aug-11"
"Fitch Rates Coca-Cola Co's Notes Offering 'A+'; Outlook Stable","KO-US,CCE-US,00CT...","BW"," 2:44pm","3-Aug-11"
"The Coca-Cola Company Prices $2.0 Billion of Senior Notes","KO-US,KO","BW"," 1:20pm","3-Aug-11"
"Firehouse Subs® Partners with Coca-Cola® as First Chain on the Planet to Roll out "Fountain of the Future" Nationally","KO-US,KO","BW"," 8:19am","3-Aug-11"
"Coca-Cola Awards $10,000 Recreation Grant to Lake Macbride State Park; Gov. Terry Branstad Applauds Commitment to Park and Fitness","09PC86-E,KO-US,07...","BW"," 8:00am","3-Aug-11"
"The Coca-Cola Company to Commence Exchange Offer","00CTTW-E,KO-US","BW"," 7:15am","3-Aug-11"
"The Coca-Cola Company Announces $2.0 Billion of Senior Notes Offering","00CTTW-E,KO-US","BW"," 7:15am","3-Aug-11"
"COCA COLA CO files (10-Q) Basic quarterly filing, for period end 1-Jul-11 (KO-US)","KO-US,KO","EDG"," 9:10am","1-Aug-11"
"COCA COLA CO: 10-Q FactSet Blackline Report for period ending 7/01/2011","KO-US","FBLK"," 9:10am","1-Aug-11"
"CEO KENT Gifts 6,500 of COCA COLA CO (KO)","KO-US,KO","EDG"," 2:26pm","28-Jul-11"
"Coca-Cola Awards $10,000 Recreation Grant to Sandy Hook - Gateway National Recreation Area","064B4Q-E,KO-US,07...","PRN"," 2:07pm","28-Jul-11"
"Coca-Cola Enterprises, Inc. Reports Second-Quarter 2011 Results","CCE-US,KO-US","BW"," 4:30am","28-Jul-11"
"Sodexo and Coca-Cola Celebrate Feeding Our Future® for Serving More Than 125,000 Free Summer Lunches to Atlanta Children","KO-US,09JNNX-E","PRN"," 9:20am","27-Jul-11"
"The Coca-Cola Foundation Makes a Splash for Education and Youth Development This Summer","09LB2V-E,KO-US","BW"," 9:00am","26-Jul-11"
"Coca-Cola Signs Worldwide Deal with Start-Up, Music Dealers","KO-US,KO","BW"," 8:22am","26-Jul-11"
"The Coca-Cola Company Announces Recipients of 2011-2012 Goizueta Scholars Fund Award","KO-US,07MF58-E","BW","10:30am","25-Jul-11"
"Coca-Cola to Give Exceptional Teens a Chance to Shine in London 2012 Olympic Torch Relay","KO-US,0BV8P9-E","BW"," 9:33am","25-Jul-11"
"My Coke Rewards is Back at Hardee's","002G2R-E,KO-US,00...","BW"," 5:00am","25-Jul-11"
"Analyst's Notes >> COCA COLA CO (Argus Research) 5 pages","KO-US,MORN-US","FRC","12:39pm","21-Jul-11"
"SVP ANDERSON Sells 16,500 of COCA COLA CO (KO)","KO-US,KO","EDG","11:58am","21-Jul-11"
"Holder DOUGLAS J ALEXANDER JR Sells 20,000 of COCA COLA CO (KO)","KO-US,KO","EDG","11:57am","21-Jul-11"
"The Board of Directors of The Coca-Cola Company Announces Quarterly Dividend","KO-US,07XCDN-E,06...","BW","11:45am","21-Jul-11"
"CALLSTREET REPORT: The Coca-Cola Co.(KO), Q2 2011 Earnings Call, 19-July-2011 9:30 AM ET","KO-US","FCST"," 1:00pm","19-Jul-11"
"COCA COLA CO files (8-K) Current report: Items 2.02 - Results of Operations, 9.01 - Financial Statements and Exhibits, for period end 19-Jul-11 (KO-US)","KO-US,KO","EDG"," 5:00am","19-Jul-11"
"Follow-up: Coca-Cola reports Q2 results","KO-US","SA"," 4:35am","19-Jul-11"
"Coca-Cola reports Q2 EPS $1.17 vs Reuters $1.16","KO-US","SA"," 4:31am","19-Jul-11"
"The Coca-Cola Company Reports Second Quarter and Year-to-Date 2011 Results","KO-US,KO","BW"," 4:30am","19-Jul-11"
"The Coca-Cola Company Reports Second Quarter and Year-to-Date 2011 Results","KO-US","FFR"," 9:00pm","18-Jul-11"
"Consensus metrics for Coca-Cola","KO-US","SA","10:27am","18-Jul-11"
"Rrriiinnnggg: Sprite® Spark Parks is Back in Session to Refresh School Playrounds and Athletic Fields Nationwide","07LLBM-E,06467Z-E...","BW"," 9:00am","18-Jul-11"
"The Coca-Cola Foundation Awards $1 Million in Grants for China Study-Abroad Programs","09LB2V-E,KO-US","BW","10:30am","15-Jul-11"
"Coca-Cola Japan Reconstruction Fund to Contribute 1.5 Billion Yen to Reconstruction of Elementary and Junior High Schools","KO-US","PRN"," 9:00pm","14-Jul-11"
"SEC release:  COCA COLA CO replies to SEC correspondence (CORRESP) - filed Jul 14, 2011 (KO-US)","KO-US,KO","EDG"," 6:14am","14-Jul-11"
"Coca-Cola Reveals the Secret Formula for Canadian Happiness","KO-US","CNW"," 2:59am","14-Jul-11"
"Grants Give Hundreds of California Families a Jumpstart on Better Health and Nutrition","KO-US","PRN"," 9:00am","13-Jul-11"
"Frontier Strategy Group Launches New Emerging Markets Insights Blog ","KO-US","MW"," 6:13am","13-Jul-11"
"COCA-COLA CO (KO=US) (Pechala's Reports) 5 pages","KO-US","FRC"," 1:48pm","10-Jul-11"
"Dir WILLIAMS Updates Ownership of COCA COLA CO (KO)","KO-US,KO","EDG","10:45am","6-Jul-11"
"Dir WALLENBERG Updates Ownership of COCA COLA CO (KO)","KO-US,KO","EDG","10:43am","6-Jul-11"
"Dir UEBERROTH Updates Ownership of COCA COLA CO (KO)","KO-US,KO","EDG","10:41am","6-Jul-11"
"Dir ROBINSON III Updates Ownership of COCA COLA CO (KO)","KO-US,KO","EDG","10:39am","6-Jul-11"
"Dir NUNN Updates Ownership of COCA COLA CO (KO)","KO-US,KO","EDG","10:37am","6-Jul-11"
"Dir MCHENRY Updates Ownership of COCA COLA CO (KO)","KO-US,KO","EDG","10:35am","6-Jul-11"
"Dir LAGOMASINO Updates Ownership of COCA COLA CO (KO)","KO-US,KO","EDG","10:33am","6-Jul-11"
"Dir KEOUGH Updates Ownership of COCA COLA CO (KO)","KO-US,KO","EDG","10:31am","6-Jul-11"
"Dir HERMAN Updates Ownership of COCA COLA CO (KO)","KO-US,KO","EDG","10:29am","6-Jul-11"
"Dir GREENBERG Updates Ownership of COCA COLA CO (KO)","KO-US,KO","EDG","10:27am","6-Jul-11"
"Dir DILLER Updates Ownership of COCA COLA CO (KO)","KO-US,KO","EDG","10:25am","6-Jul-11"
"Dir BUFFETT Updates Ownership of COCA COLA CO (KO)","KO-US,KO","EDG","10:22am","6-Jul-11"
"Dir ALLEN Updates Ownership of COCA COLA CO (KO)","KO-US,KO","EDG","10:20am","6-Jul-11"
"Dir ALLEN Updates Ownership of COCA COLA CO (KO)","KO-US,KO","EDG","10:17am","6-Jul-11"
"Equity Research on The Coca-Cola Company and PepsiCo, Inc. - the Close Race ","KO-US,PEP-US","MW"," 6:13am","5-Jul-11"
"Coca-Cola's "Shape" Ad is Top Ad of the Quarter and Coke's Top Most Effective Ad in the Last Three Years According to Ace Metrix","KO-US,07S7ND-E","BW"," 6:00am","5-Jul-11"
"The 2011 ESSENCE Music Festival Presented by Coca-Cola: Celebrating the "Roots of R&B" With Headline Performances by Kanye West, Usher, Jennifer Hudson, Chaka Khan, Mary J. Blige, Trey Songz, Fantasia, Charlie Wilson, Jill Scott, Boyz II Men, El Debarge, Kem and New Edition","KO-US,05KXVT-E","PRN"," 9:01pm","1-Jul-11"
"Coke Zero Makes Race Fans' Wildest Dreams Come True with Prizes from Daytona to Homestead","KO-US,KO","BW","10:30am","1-Jul-11"
"Coca-Cola® Jazzes Up the ESSENCE Music Festival™ with $125,000 in Scholarships to Schools in Louisiana","KO-US,KO","BW"," 4:30pm","30-Jun-11"
"Coca-Cola® and Viejas Casino Team Up for "Summer Splash" Promotion","09YW6N-E,KO-US","BW"," 8:08am","30-Jun-11"
"The Coca-Cola Co. (KO-US) - Annual Report for the Period Ending 31-Dec-2010 (Japanese)","KO-US","FFR"," 9:00pm","29-Jun-11"
"COCA COLA CO files (11-K) Annual report for ESOPs, for period end 31-Dec-10 (KO-US)","KO-US,KO","EDG","11:02am","29-Jun-11"
"COCA COLA CO files (11-K) Annual report for ESOPs, for period end 31-Dec-10 (KO-US)","KO-US,KO","EDG","11:01am","29-Jun-11"
