"ABBOTT LABORATORIES files (8-K) Current report: Items 1.01 - Entry into Definitive Agreement, 9.01 - Financial Statements and Exhibits, for period end 24-May-10 (ABT-US)","ABT-US,ABT","EDG"," 5:43am","27-May-10"
"Feeding America and Abbott Partner For Hurricane Relief Preparation","ABT-US","PRN"," 4:00am","27-May-10"
"The New England Journal of Medicine Publishes Results of Landmark CREST Study, Showing Similar Positive Outcomes for Abbott's Carotid Stent System and Surgery","ABT-US,ABT","PRN"," 2:00pm","26-May-10"
"Global Medical Meeting and Event Management Leader Opens US Office","ABT-US,06WYFP-E","PRN"," 7:00am","26-May-10"
"Abbott Labs announces European launch of Trek Catheter system","ABT-US","SA"," 5:03am","26-May-10"
"Abbott Announces European Launch of TREK(TM) Catheter System, Representing an Advancement in Balloon Technology","ABT-US,ABT","PRN"," 5:00am","26-May-10"
"Boston Scientific begins Platinum Plus trial for Promus Element stent system","ABT-US,BSX-US","SA","11:27pm","25-May-10"
"ABBOTT LABORATORIES files (424B5) Prospectus used for both 424B2 and 424B3 information (ABT-US)","ABT-US,ABT","EDG"," 1:47pm","25-May-10"
"Analyst's Notes >> CAREER EDUCATION CORP (Argus Research) 5 pages","CECO-US,ABT-US","FRC"," 7:31am","25-May-10"
"Medtronic says its Resolute zotarolimus-eluting stent as safe and effective as Xience V everolimus-eluting stent from Abbott (ABT)","ABT-US,MDT-US","SA"," 7:16am","25-May-10"
"Abbott's Groundbreaking Bioresorbable Technology Continues to Demonstrate Exceptional Clinical Results","ABT-US,ABT","PRN"," 7:05am","25-May-10"
"MARKET DIGEST >> TUESDAY, MAY 25, 2010 (Argus Research) 11 pages","CECO-US,ADSK-US,F...","FRC"," 5:05am","25-May-10"
"New Data Reinforces Safety Profile of Abbott's Market-Leading XIENCE V(R) Drug Eluting Stent","ABT-US,ABT","PRN"," 4:35am","25-May-10"
"Abbott's says its mitraclip system demonstrates strong safety results and improved clinical outcomes for common causes of leaky heart valves","ABT-US","SA"," 4:32am","25-May-10"
"Abbott's Investigational MitraClip(R) System Demonstrates Strong Safety Results and Improved Clinical Outcomes for Common Causes of Leaky Heart Valves","ABT-US,ABT","PRN"," 4:30am","25-May-10"
"ABBOTT LABORATORIES files (FWP) Free writing prospectus after a registration statement has been filed (ABT-US)","ABT-US,ABT","EDG"," 2:21pm","24-May-10"
"Abbott receives FDA clearance for new Freestyle Lite test strips","ABT-US","SA"," 9:02am","24-May-10"
"Abbott Receives FDA Clearance for New, Easier-to-Use FreeStyle Lite® Test Strips","ABT-US,ABT","PRN"," 9:00am","24-May-10"
"ABBOTT LABORATORIES files (424B3) Prospectus detailing significant change to previous prospectus (ABT-US)","ABT-US,ABT","EDG"," 5:52am","24-May-10"
"Biogen Idec and Abbott announce enrollment of first patient in global phase III study of daclizumab for relapsing-remitting MS","ABT-US,BIIB-US","SA"," 5:35am","24-May-10"
"Biogen Idec and Abbott Announce Enrollment of First Patient in Global Phase III Study of Daclizumab for Relapsing-Remitting Multiple Sclerosis","BIIB-US,ABT-US,06...","BW"," 5:30am","24-May-10"
"Biogen Idec und Abbott melden Aufnahme des ersten Patienten in weltweite Phase-III-Studie über Daclizumab zur Behandlung von rezidivierend-remittierender multipler Sklerose","BIIB,US09062X103,...","BW"," 5:30am","24-May-10"
"Biogen Idec et Abbott annoncent le recrutement du premier patient dansle cadre d'une étude globale de Phase III du Daclizumab dans le traitement de la sclérose en plaques cyclique","BIIB,US09062X103,...","BW"," 5:30am","24-May-10"
"Abbott Labs upgraded to hold from sell at Citi","ABT-US","SA"," 3:00am","24-May-10"
"WSJ says Abbott Labs' price for Piramal Healthcare is not cheap","ABT-US","SA","10:56am","22-May-10"
"ABBOTT LABORATORIES files (8-K) Current report: Items 1.01 - Entry into Definitive Agreement, 7.01 - Regulation FD, 9.01 - Financial Statements and Exhibits, for period end 21-May-10 (ABT-US)","ABT-US,ABT","EDG"," 2:11pm","21-May-10"
"CORRECTED TRANSCRIPT: Abbott Laboratories(ABT-US), Acquisition of Healthcare Solutions of Piramal Healthcare by Abbott Laboratories Call, 21-May-2010 8:30 AM ET","ABT-US","FCST","12:33pm","21-May-10"
"Abbott Laboratories agreed to acquire Piramal Healthcare Ltd /Domestic Formulations Business/","ABT-US,500302-IN,...","FFW"," 2:55am","21-May-10"
"Abbott Laboratories(ABT-US) Schedules Acquisition of Healthcare Solutions of Piramal Healthcare by Abbott Laboratories Call for 21-May-2010 8:30 AM ET","ABT-US","FCST","11:13pm","20-May-10"
"Abbott Labs (ABT) to purchase Piramal Healthcare's Solutions for $2.12B upfront, plus $400M annually for next four years","500302-IN,ABT-US,...","SA","11:01pm","20-May-10"
"Abbott to Become No. 1 Pharmaceutical Company in India with Acquisition of Piramal's Healthcare Solutions Business","ABT-US,530965-IN,...","PRN","10:53pm","20-May-10"
"Abbott to Present New Clinical Data on Current and Future Innovations in Interventional Cardiology at EuroPCR 2010","ABT-US,ABT","PRN"," 5:00am","20-May-10"
"Abbott Honored as a Great Place to Work Across Europe","ABT-US,0BJBSV-E,ABT","PRN"," 9:01pm","19-May-10"
"SVP BLASER Acquires 27,000 of ABBOTT LABORATORIES (ABT)","ABT-US,ABT","EDG"," 2:31pm","19-May-10"
"Abbott issues press release regarding previously reported FDA approval for Prism Chagas test","ABT-US","SA"," 5:34am","19-May-10"
"Abbott Receives FDA Approval for First Fully Automated Blood Test for 'Kissing Bug' Disease","ABT-US,ABT","PRN"," 5:30am","19-May-10"
"(OTC: KKUR) to Begin Testing Its 100% Accurate Cancer Detection System ","KKUR-US,ABT-US,BE...","MW"," 4:30am","18-May-10"
"Ownership Updates: ABBOTT LABS  COM (ABT) for 18-May-2010","00282410","FIO"," 4:08am","18-May-10"
"Abbott Introduces New, Easier-to-Use and More Accurate Line of FreeStyle Test Strips in Europe","ABT-US,05X6NP-E,0...","PRNE"," 1:00am","14-May-10"
"Analyst's Notes >> ABBOTT LABORATORIES (Argus Research) 5 pages","ABT-US,4401-TW","FRC","12:48pm","13-May-10"
"MARKET UPDATE >> THURSDAY, MAY 13, 2010 (Argus Research) 20 pages","CSCO-US,APC-US,AB...","FRC","12:46pm","13-May-10"
"Abbott Presents Do-It-Yourself Home Makeover Tips for Arthritis Awareness Month","ABT-US,ABT","PRN"," 5:27am","13-May-10"
"IntraLinks Announces Partnership With SAFE-BioPharma; Will Provide Digital Identity Capabilities With its Life Sciences Solutions","ABT,AMGN,AMRN,AZN...","CNW"," 6:00am","12-May-10"
"(RNS)  Abbott Laboratories  Forms 4,8-K,3,DEF14A, 13D,D,1","ABT,US002824100","FECA","10:10am","11-May-10"
"DJ Abbott Laboratories Forms 4,8-K,3,DEF14A, 13D,D,10Q,TO,TO-T,& TO-T/A","ABT-US,ABT,US0028...","DJRN","10:10am","11-May-10"
"Abbott Labs announced licensing agreement with Zydus Cadila; formal creation of stand-alone EPD","ABT-US","SA"," 4:49am","11-May-10"
"Abbott Accelerates Emerging Markets Pharmaceutical Leadership With Zydus Cadila Collaboration; Separately Creates Stand-Alone Established Products Division","ABT-US,ABT","PRN"," 4:42am","11-May-10"
"Assegai Wins Big Settlement Against ABBOTT's Subsidiary","ABT-US,ABT","PRN"," 6:15am","10-May-10"
"Assegai réussit à obtenir une entente à l'amiable avec une filiale d'ABBOTT","ABT","CNW"," 6:15am","10-May-10"
"Assegai gana una elevada compensación en contra de una filial de ABBOTT","ABT,ABT.N,ABT@US","PRNE","12:15am","10-May-10"
"Assegai touche une indemnisation de la filiale d'ABBOTT","ABT,ABT.N,ABT@US","PRNE","12:15am","10-May-10"
"Assegai erhält grosse Abfindungssumme von ABBOTTs Tochtergesellschaft","ABT,ABT.N,ABT@US","PRNE","12:15am","10-May-10"
"Assegai Wins Big Settlement Against ABBOTT's Subsidiary","ABT-US","PRNA"," 6:28pm","9-May-10"
"Heinz Family Philanthropies, Welvista and Abbott Announce Solution to Help Patients on State ADAP Waiting Lists for No-Cost HIV Medications","ABT-US","PRN"," 9:14am","7-May-10"
"SEC release:  ABBOTT LABORATORIES replies to SEC correspondence (CORRESP) - filed May 6, 2010 (ABT-US)","ABT-US,ABT","EDG","11:34am","6-May-10"
"Abbott 2009 Global Citizenship Report Highlights Company's Progress in 'Redefining Responsibility'","ABT-US,ABT","PRN"," 7:01am","6-May-10"
"Medtronic mentioned positively at Wells Fargo","ABT-US,MDT-US","SA"," 5:42am","6-May-10"
"SVP WARMUTH Acquires 10,000 of ABBOTT LABORATORIES (ABT)","ABT-US,ABT","EDG"," 2:07pm","5-May-10"
"NEJM publishes SPIRIT IV trial results","ABT-US","SA"," 2:03pm","5-May-10"
"The New England Journal of Medicine Publication of SPIRIT IV Trial Results Confirm Superior Safety and Efficacy of Abbott's XIENCE V(R) Drug Eluting Stent Compared to TAXUS","ABT-US,ABT","PRN"," 2:00pm","5-May-10"
"Abbott Laboratories(ABT) Schedules Sanford Bernstein Strategic Decisions Conference for 4-June-2010 10:00 AM ET","ABT-US","FCST","11:41am","5-May-10"
"Abbott Chairman and CEO Miles D. White to Present at Sanford Bernstein Strategic Decisions Conference","ABT-US,ABT","PRN","11:24am","5-May-10"
"Watson Pharmaceuticals confirms patent challenge","ABT-US,WPI-US","SA"," 5:10am","5-May-10"
"Watson Confirms SIMCOR(R) Patent Challenge","ACT-US,ABT-US,05M...","PRN"," 5:00am","5-May-10"
"Abbott Opens Asia-Pacific Nutrition Research & Development Center in Singapore","ABT-US,ABT","PRN","12:30am","5-May-10"
"SVP MASON Disposes 3,486 of ABBOTT LABORATORIES (ABT)","ABT-US,ABT","EDG"," 3:06pm","4-May-10"
"SVP CHEN Disposes 3,156 of ABBOTT LABORATORIES (ABT)","ABT-US,ABT","EDG"," 3:05pm","4-May-10"
"SVP HANCE Disposes 1,412 of ABBOTT LABORATORIES (ABT)","ABT-US,ABT","EDG"," 3:04pm","4-May-10"
"FDA discloses paragraph IV patent certifications","ABT-US,BMY-US,NVS...","SA","12:53pm","4-May-10"
"ABBOTT LABORATORIES: 10-Q FactSet Blackline Report for period ending 3/31/2010","ABT-US","FBLK","11:19am","4-May-10"
"ABBOTT LABORATORIES files (10-Q) Basic quarterly filing, for period end 31-Mar-10 (ABT-US)","ABT-US,ABT","EDG"," 8:09am","4-May-10"
"FDA releases list of drugs with potential safety signals identified by the AERS","ABT-US,AVNR-US,BM...","SA","10:52am","3-May-10"
"FDA says that GnRH agonists may increase the risk of diabetes","ABT-US,AZN-GB,BVF...","SA"," 8:12am","3-May-10"
"Abbott Labs receives FDA approval for Creon to include dosing information for patients with chronic pancreatitis and pancreatectomy","ABT-US,EURX,JNJ-U...","SA"," 5:05am","3-May-10"
"Abbott Receives FDA Approval for CREON(R) to Include Dosing Information for Patients With Chronic Pancreatitis and Pancreatectomy","ABT-US,ABT","PRN"," 5:02am","3-May-10"
"/R E P E A T -- Invitation to the media and the general public - Edmonton parents are invited to attend the first educational conference on the diagnosis and treatment of feeding difficulties in young children/","ABT","CNW"," 4:00am","3-May-10"
"EvaluatePharma ranks world's biggest drugsellers for 2016","ABT-US,AZN-GB,GSK...","SA"," 9:15pm","2-May-10"
"FDA approves Abbott Labs' Prism Chagas test","ABT-US,JNJ-US","SA","11:42am","1-May-10"
"Watson Pharmaceuticals confirms TriLipix patent challenge","500257-IN,ABT-US,...","SA"," 1:08pm","30-Apr-10"
"Critical Alerts for EMC, McDonald's, Abbott Labs, Thermo Fisher Scientific, and AFLAC Released by Seven Summits Research","TMO-US,MCD-US,EMC...","PRN"," 6:31am","30-Apr-10"
"/R E P E A T -- Invitation to the media and the general public - Edmonton parents are invited to attend the first educational conference on the diagnosis and treatment of feeding difficulties in young children/","ABT","CNW"," 4:00am","30-Apr-10"
"ABBOTT LABORATORIES files (8-K) Current report: Item 5.07 - Submission of Matters to a Vote, for period end 23-Apr-10 (ABT-US)","ABT-US,ABT","EDG"," 2:21pm","29-Apr-10"
"Absolute Software's a Winner at SC Awards","ABT-CA,ABT,ABT.","PRN"," 9:06am","28-Apr-10"
"Abbott receives FDA approval for once-daily dosing of kaletra (lopinavir / ritonavir) for treatment-experienced patients","ABT-US","SA"," 8:49am","28-Apr-10"
"Abbott Receives FDA Approval for Once-Daily Dosing of Kaletra (R) (lopinavir / ritonavir) for Treatment-Experienced Patients","ABT-US,ABT","PRN"," 8:47am","28-Apr-10"
"Abbott Recognized as One of the 'Best Places to Work in Industry' by The Scientist magazine","ABT-US,ABT","PRN"," 7:05am","28-Apr-10"
"Despite Concern, Americans Aren't Protecting Themselves Against Diabetes","ABT-US,ABT","PRN"," 6:00am","28-Apr-10"
"Mylan receives approval for generic version of Flomax","4503-JP,ABT-US,MY...","SA"," 4:36am","28-Apr-10"
"Dir OWEN Acquires 2,108 of ABBOTT LABORATORIES (ABT)","ABT-US,ABT","EDG"," 3:25pm","27-Apr-10"
"SVP WARMUTH Sells 10,024 of ABBOTT LABORATORIES (ABT)","ABT-US,ABT","EDG"," 3:25pm","27-Apr-10"
"Dir TILTON Acquires 2,108 of ABBOTT LABORATORIES (ABT)","ABT-US,ABT","EDG"," 3:25pm","27-Apr-10"
"Dir ROBERTS Acquires 2,108 of ABBOTT LABORATORIES (ABT)","ABT-US,ABT","EDG"," 3:24pm","27-Apr-10"
"Dir FARRELL Acquires 2,108 of ABBOTT LABORATORIES (ABT)","ABT-US,ABT","EDG"," 3:24pm","27-Apr-10"
"SVP FUSSELL Sells 23,600 of ABBOTT LABORATORIES (ABT)","ABT-US,ABT","EDG"," 3:24pm","27-Apr-10"
"Dir FULLER Acquires 2,108 of ABBOTT LABORATORIES (ABT)","ABT-US,ABT","EDG"," 3:23pm","27-Apr-10"
"Dir SCOTT III Acquires 2,108 of ABBOTT LABORATORIES (ABT)","ABT-US,ABT","EDG"," 3:23pm","27-Apr-10"
"Dir SMITHBURG Acquires 2,108 of ABBOTT LABORATORIES (ABT)","ABT-US,ABT","EDG"," 3:23pm","27-Apr-10"
"Dir OSBORN Acquires 2,108 of ABBOTT LABORATORIES (ABT)","ABT-US,ABT","EDG"," 3:22pm","27-Apr-10"
"Dir DALEY Acquires 2,108 of ABBOTT LABORATORIES (ABT)","ABT-US,ABT","EDG"," 3:22pm","27-Apr-10"
"Dir AUSTIN Acquires 2,108 of ABBOTT LABORATORIES (ABT)","ABT-US,ABT","EDG"," 3:21pm","27-Apr-10"
"Dir ALPERN Acquires 2,108 of ABBOTT LABORATORIES (ABT)","ABT-US,ABT","EDG"," 3:20pm","27-Apr-10"
"Actavis begins shipping generic Flomax","4503-JP,ABT-US","SA"," 2:05pm","27-Apr-10"
"Reportlinker Adds Implantable Medical Devices Market","ABT-US,0B1GW7-E","PRN"," 9:34am","26-Apr-10"
"Abbott Labs' request for en banc hearing in case vs Becton, Dickinson (BDX) is approved; 25-Jan ruling vacated","ABT-US,BAYN-DE,BD...","SA"," 8:12am","26-Apr-10"
"ABBOTT LABORATORIES - INTERIM report for 2009 (ENGLISH).","ABT-US","FFR"," 9:42pm","25-Apr-10"
"Follow-up: Earnings scorecard","AAPL-US,ABT-US,AM...","SA","10:33am","23-Apr-10"
"Abbott Annual Meeting Highlights Continued Strong Performance in 2009; Sustained Growth in 2010","ABT-US,ABT","PRN"," 8:10am","23-Apr-10"
"CALLSTREET REPORT: Abbott Laboratories(ABT-US), Q1 2010 Earnings Call, 21-April-2010 9:00 AM ET","ABT-US","FCST"," 3:13pm","21-Apr-10"
"Abbott Completes Acquisition of Facet Biotech","ABT-US,ABT","PRN","12:05pm","21-Apr-10"
"(RNS) Abbott Laboratories 1st Quarter Results 2010 News","ABT-US","FFR"," 5:50am","21-Apr-10"
"(RNS)  Abbott Laboratories  1st Quarter Results 2010 News","ABT,US002824100","FECA"," 5:50am","21-Apr-10"
"DJ Abbott Laboratories 1st Quarter Results 2010 News Release","ABT-US,ABT,US0028...","DJRN"," 5:50am","21-Apr-10"
"DJ Abbott Laboratories 1st Quarter Results 2010 News -2-","ABT,US0028241000","DJRN"," 5:50am","21-Apr-10"
"Drug Manufacturing Industry on an Explosive Journey ","ABT-US,KERX-US","MW"," 5:43am","21-Apr-10"
"ABBOTT LABORATORIES files (8-K) Current report: Items 2.02 - Results of Operations, 9.01 - Financial Statements and Exhibits, for period end 21-Apr-10 (ABT-US)","ABT-US,ABT","EDG"," 5:27am","21-Apr-10"
"Follow up: Abbott Labs reports Q1 product sales","ABT-US","SA"," 4:46am","21-Apr-10"
"Abbott Labs reports Q1 EPS $0.81 vs Reuters $0.80; EPS includes impact of health care legislation","ABT-US","SA"," 4:45am","21-Apr-10"
"Abbott Reports Strong First Quarter Results; Forecasts Double-Digit Ongoing Earnings Growth in 2010","ABT-US,ABT","PRN"," 4:42am","21-Apr-10"
"Consensus product sales for Abbott Labs","ABT-US","SA"," 6:04am","20-Apr-10"
"Abbott Successfully Completes Tender Offer for Shares of Facet Biotech","ABT-US,ABT","PRN"," 5:50am","20-Apr-10"
"SVP PATTON JR Disposes 3,499 of ABBOTT LABORATORIES (ABT)","ABT-US,ABT","EDG"," 2:36pm","16-Apr-10"
"Abbott Begins Biopreparedness Evaluation Program With State Public Health Labs","ABT-US,ABT","PRN"," 9:00am","15-Apr-10"
"Patheon, Inc. names Mark Kontny, Ph.D., as its President of Global Pharmaceutical Development Services and its Chief Scientific Officer","PTI-CA,ABT-US,IGA...","PRN"," 7:11am","15-Apr-10"
"Boston Scientific ICD manufacturing changes should be approved by FDA by 16-Apr, says Soleil","ABT-US,ANPI,BSX-U...","SA"," 3:27am","14-Apr-10"
"FDA releases phase-out dates for COPD inhalers containing CFCs","ABT-US,FRX-US,KG","SA","10:20am","13-Apr-10"
"Johnson & Johnson issues press release on FDA approval for Pancreaze","ABT-US,EURX,JNJ-US","SA"," 8:15am","13-Apr-10"
"Johnson & Johnson receives FDA approval for Pancreaze","ABT-US,EURX,JNJ-US","SA"," 2:32pm","12-Apr-10"
"Follow-up: DOJ probes Abbott Labs' marketing of Depakote -- Dow Jones","ABT-US,SAN-FR","SA","12:43pm","12-Apr-10"
"Follow-up: DOJ probes Abbott Labs' marketing of antiseizure drug Depakote -- Dow Jones","ABT-US,SAN-FR","SA","12:35pm","12-Apr-10"
"DOJ probes Abbott Labs' marketing of antiseizure drug Depakote -- Dow Jones","ABT-US","SA","12:34pm","12-Apr-10"
"Eurand NV mentioned positively at Cowen & Co.","ABT-US,EURX,SOLB-BE","SA"," 5:33am","12-Apr-10"
"Axis-Shield and Abbott (ABT) in pact to develop diabetes immunoassay","ABT-US,ASD.LN","SA","11:13pm","11-Apr-10"
"Axis-Shield PLC announces Re Agreement ","ABT-US,ASD-GB","MW","11:00pm","11-Apr-10"
"SVP CHEN Updates Ownership of ABBOTT LABORATORIES (ABT)","ABT-US,ABT","EDG"," 2:07pm","9-Apr-10"
"Abbott Labs acquisition of Facet Biotech (FACT) clears antitrust review","ABT-US,FACT","SA"," 5:57am","8-Apr-10"
"Abbott Acquisition of Facet Biotech Clears U.S. Antitrust Review","ABT-US,ABT","PRN"," 5:55am","8-Apr-10"
"AIDS Foundation of Chicago and Abbott Mark 25-Year Milestones in the Fight Against AIDS","ABT-US,07R25C-E","BW"," 6:50am","5-Apr-10"
"Dir ALPERN Updates Ownership of ABBOTT LABORATORIES (ABT)","ABT-US,ABT","EDG"," 2:09pm","2-Apr-10"
"Dir DALEY Updates Ownership of ABBOTT LABORATORIES (ABT)","ABT-US,ABT","EDG"," 2:09pm","2-Apr-10"
"Dir FULLER Updates Ownership of ABBOTT LABORATORIES (ABT)","ABT-US,ABT","EDG"," 2:08pm","2-Apr-10"
"Dir OSBORN Updates Ownership of ABBOTT LABORATORIES (ABT)","ABT-US,ABT","EDG"," 2:07pm","2-Apr-10"
"Dir TILTON Updates Ownership of ABBOTT LABORATORIES (ABT)","ABT-US,ABT","EDG"," 2:07pm","2-Apr-10"
"Wockhardt may be negotiating better deal for nutritional business - Economic Times","532300-IN,ABT-US,...","SA"," 7:38pm","1-Apr-10"
"April is Daffodil Month - Join the Canadian Cancer Society and Our Corporate Partners in the Fight Against Cancer","ABT-US","CNW"," 3:00am","1-Apr-10"
"Wockhardt, Abbot (ABT) jointly terminate nutritional business agreement","532300-IN,ABT-US,...","SA"," 9:25pm","31-Mar-10"
"Abbott Laboratories(ABT) Schedules Annual General Meeting for 23-April-2010 10:00 AM ET","ABT-US","FCST","10:55am","31-Mar-10"
"Abbott Submits Test to Aid in Identifying Patients at Risk of Developing Kidney Injury","ABT-US,ABT","PRN"," 6:30am","31-Mar-10"
"Abbott Labs sues Lupin (LPC.IN) to block generic version of cholesterol drug TriLipix -- Bloomberg","500257-IN,ABT-US,...","SA"," 6:23am","31-Mar-10"
"Abbott Hosts Conference Call for First-Quarter Earnings","ABT-US,ABT","PRN"," 5:55am","31-Mar-10"
"Depomed submits NDA for DM-1796 for management of postherpetic neuralgia (PHN)","ABT-US,DEPO-US","SA"," 1:32pm","30-Mar-10"
"FDA panel to discuss BLA for AstraZeneca Numax","ABT-US,AZN-GB","SA"," 7:16am","30-Mar-10"
"AstraZeneca and Abbott Receive FDA Complete Response Letter on CERTRIAD(TM) New Drug Application","AZN-GB,ABT-US,ABT","PRN"," 5:02am","30-Mar-10"
"AstraZeneca and Abbott receive complete response letter for Certriad","ABT-US,AZN-GB","SA"," 5:01am","30-Mar-10"
"Critical Alerts For Goldman Sachs, Dow Chemical, Abbott Labs, Eli Lilly, and Smith International Released By Seven Summits Research","SII-US,LLY-US,GS-...","PRN"," 6:31am","29-Mar-10"
"Barron's Cover ranks the 30 Most Respected CEOs","1211-HK,494-HK,70...","SA"," 2:02pm","27-Mar-10"
"BetterInvesting Magazine Releases June's Stock to Study and Undervalued Stock Choices for Investors' Informational and Educational Use","IBM-US,ABT-US,ABT...","PRN"," 2:14pm","26-Mar-10"
"Ten-Year Data on Pharmaceutical Mergers and Acquisitions, from DealSearchOnline.com, Reveals Top Deals and Key Companies","ABT-US","BW","12:36pm","25-Mar-10"
"Bernstein comments on stent pricing trends","ABT-US,BSX-US,JNJ...","SA"," 3:41am","25-Mar-10"
"Abbott Commences Tender Offer for All Outstanding Shares of Facet Biotech Corporation","ABT-US,00CGQ3-E,ABT","PRN"," 5:00am","23-Mar-10"
"Abbott completes acquisition of STARLIMS Technologies","ABT-US,LIMS","SA"," 1:02pm","22-Mar-10"
"Abbott Completes Acquisition of STARLIMS Technologies","ABT-US,ABT","PRN"," 1:01pm","22-Mar-10"
"Starlims halted","ABT-US,LIMS","SA"," 5:16am","22-Mar-10"
"Dir OWEN Sells 12,029 of ABBOTT LABORATORIES (ABT)","ABT-US,ABT","EDG"," 5:27pm","19-Mar-10"
"The Abbott Fund, Boston University School of Medicine and Leading Health Institutions in Vietnam Inaugurate the Abbott Fund Institute of Nutrition Science at Bach Mai Hospital","ABT-US,ABT","PRN"," 7:14am","19-Mar-10"
"Boston Scientific stock reacting to wire headlines regarding FDA statement on heart device recall","ABT-US,ANPI,BSX-U...","SA"," 6:21am","18-Mar-10"
"Boston Scientific should be able to resume sales of ICD devices within 4-6 weeks, says Bernstein","ABT-US,ANPI,BSX-U...","SA"," 4:58am","17-Mar-10"
"ABBOTT LABORATORIES files (DEF 14A) Definitive proxy statements, for period end 23-Apr-10 (ABT-US)","ABT-US,ABT","EDG"," 2:05pm","15-Mar-10"
"FDA will review primary data from ACCORD Lipid trial","ABT-US","SA"," 6:46am","15-Mar-10"
"Impax Labs confirms patent challenge relating to TRILIPIX delayed -release capsules","ABT-US,IPXL-US","SA"," 6:37am","15-Mar-10"
"Abbott Labs says ACCORD Lipid results support treatment (14-Mar, 8:00ET)","ABT-US","SA"," 4:54am","15-Mar-10"
"Abbott Labs announces positive data from ABSORB trial on its bioresorbable vasculare scaffold technology","ABT-US","SA"," 4:33am","15-Mar-10"
"Abbott Announces Positive Data From ABSORB Trial on Its Bioresorbable Vascular Scaffold Technology","ABT-US,ABT","PRN"," 4:30am","15-Mar-10"
"New Data Demonstrates Abbott's Investigational MitraClip(R) System Has Potential to be a Valuable Treatment Option for Patients With Mitral Regurgitation, the Most Common Heart Valve Condition","06RVC7-E,ABT","PRN"," 5:05am","14-Mar-10"
"Abbott Statement: ACCORD Lipid Results Support Treatment Guidelines for Fibrate Use","ABT","PRN"," 5:00am","14-Mar-10"
"CEO WHITE Sells 70,700 of ABBOTT LABORATORIES (ABT)","ABT-US,ABT","EDG"," 2:04pm","12-Mar-10"
"ABBOTT LABORATORIES files (D) Companies selling securities with a Reg D exemption (ABT-US)","ABT-US,ABT","EDG"," 2:00pm","12-Mar-10"
"Abbott Labs downgraded to sell from hold at Citi","ABT-US","SA"," 2:30am","12-Mar-10"
"Abbott Labs seeks FDA approval of a new 6-month 45-mg formulation of Lupron Depot for the palliative treatment of advanced prostate cancer","ABT-US","SA","12:10pm","11-Mar-10"
"Abbott Seeks FDA Approval of a New Six-Month 45-mg Formulation of Lupron(R) Depot for the Palliative Treatment of Advanced Prostate Cancer","ABT-US,ABT","PRN","12:08pm","11-Mar-10"
"Barron's Weekday Trader highlights four biotech takeout targets","ABT-US,ALPMY,ALTH...","SA"," 3:54pm","10-Mar-10"
"CORRECTED TRANSCRIPT: Abbott Laboratories(ABT-US), Cowen & Company Health Care Conference, 10-March-2010 8:45 AM ET","ABT-US","FCST"," 9:27am","10-Mar-10"
"Abbott Supports McGill University Nurse Practitioner Programs","ABT-US","CNW"," 4:13am","10-Mar-10"
"Abbott receives FDA approval for new cataract multifocal intraocular lens","ABT-US","SA"," 4:01am","10-Mar-10"
"Abbott Receives U.S. FDA Approval for New Cataract Multifocal Intraocular Lens","ABT-US,ABT","PRN"," 4:00am","10-Mar-10"
"Facet Biotech trading +66.8% to $27.05, post-resumption","ABT-US,BIIB-US,FACT","SA"," 2:23pm","9-Mar-10"
"Follow-up: Abbott Labs to purchase Facet Biotech for $27/share cash","ABT-US,BIIB-US,FACT","SA"," 1:59pm","9-Mar-10"
"Abbott Labs to purchase Facet Biotech for $27/share cash; FACT remains halted","ABT-US,BIIB-US,FACT","SA"," 1:52pm","9-Mar-10"
"Abbott Enhances Pharmaceutical Pipeline with Acquisition of Facet Biotech","ABT-US,ABT,FACT","PRN"," 1:52pm","9-Mar-10"
"FDA discloses paragraph IV patent certifications","ABT-US,PARAGRAPH4...","SA","12:20pm","9-Mar-10"
"Abbott Labs and BG Medicine extend existing development collaboration to include development Galectin-3 tesst for i-STAT System","ABT-US,BGMD-US","SA"," 1:42pm","8-Mar-10"
"BG Medicine and Abbott to Develop Galectin-3 Test for the i-STAT® System","STAT-US,BGMD-US,A...","BW"," 1:30pm","8-Mar-10"
"(RNS)  Abbott Laboratories  Doc re. FSA viewing facility","ABT,US002824100","FECA"," 8:36am","4-Mar-10"
"DJ Abbott Laboratories Doc re. FSA viewing facility","ABT-US,ABT,US0028...","DJRN"," 8:36am","4-Mar-10"
"Zacks Bull and Bear of the Day Highlights: Skyworks Solutions, Tetra Tech, Bristol-Myers Squibb Co., Abbott Laboratories and Novartis","TTEK-US,SWKS-US,N...","BW"," 2:00pm","3-Mar-10"
"Abbott Labs enters agreement with GlaxoSmithKline to develop molecular diagnostic test","ABT-US,GSK-GB","SA"," 9:03am","3-Mar-10"
"Abbott to Collaborate With GSK on Molecular Diagnostic Test to Select Candidate Patients for Future Skin Cancer Immunotherapy","GSK-GB,ABT-US,ABT","PRN"," 9:00am","3-Mar-10"
"NICE recommends use of Roche's cancer drug MabThera for rheumatoid arthritis - wires","ABT-US,BMY-US,MRK...","SA"," 4:10pm","2-Mar-10"
"VP LINDER Disposes 5,603 of ABBOTT LABORATORIES (ABT)","ABT-US,ABT","EDG"," 3:54pm","2-Mar-10"
"EVP MICHAEL Sells 20,000 of ABBOTT LABORATORIES (ABT)","ABT-US,ABT","EDG"," 3:53pm","2-Mar-10"
"EVP ASHLEY Disposes 19,542 of ABBOTT LABORATORIES (ABT)","ABT-US,ABT","EDG"," 3:53pm","2-Mar-10"
"EVP CAPEK Disposes 11,731 of ABBOTT LABORATORIES (ABT)","ABT-US,ABT","EDG"," 3:53pm","2-Mar-10"
