"Abbott's announces results from phase 3 trial of LCIG","ABT-US","SA"," 1:02pm","17-Apr-12"
"Abbott's Investigational Treatment for Advanced Parkinson's Disease Demonstrates Positive Results in Phase 3 Clinical Trial","ABT-US","PRN"," 1:00pm","17-Apr-12"
"Abbott licenses Biomarkers for use in differentiating aggressive from nonaggressive prostate cancer","ABT-US","SA"," 6:03am","17-Apr-12"
"Abbott Licenses Biomarkers for Use in Differentiating Aggressive from Nonaggressive Prostate Cancer","ABT-US","PRN"," 6:00am","17-Apr-12"
"Ownership Updates: ABBOTT LABS  COM (ABT) for 17-Apr-2012","00282410","FIO","12:30am","17-Apr-12"
"StreetAccount consensus metrics for Abbott Labs","ABT-US","SA"," 2:48pm","16-Apr-12"
"IE Discovery's CEO, Chris May, to Lead Discussion on Legal Holds at InsideCounsel SuperConference","07QVML-E,SHLD-US,...","PRN","11:00am","16-Apr-12"
"QLT Announces the Appointment of Christopher Muller as Chief Commercial Officer","07L4TM-E,QLTI-CA,...","GNW"," 3:30am","16-Apr-12"
"Encouraging Phase III Study Results Show PET Imaging with Florbetaben Reliably Detects Beta-Amyloid in the Brain","0CHQ6Z-E,500302-I...","CNW"," 1:02pm","15-Apr-12"
"St. Jude Medical's heart-rhythm division facing a growing image problem - WSJ","ABT-US,BSX-US,EW-...","SA"," 1:16pm","14-Apr-12"
"Research and Markets: Global Rheumatoid Arthritis Drugs Market 2011-2015 - The Global Rheumatoid Arthritis Drugs Market to Grow At A CAGR Of 12.1 Percent over the Period 2011-2015","005D7X-E,PFE-US,J...","BW","10:18am","13-Apr-12"
"RBCC: New N3D Prototype Could be the Beginning of Something Big","0C8BZM-E,0C8BZH-E...","BW"," 2:00am","12-Apr-12"
"Abbott Labs announces that EC has approved HUMIRA (adalimumab) for treatment of ulcerative colitis","ABT-US,ROG-CH","SA"," 9:08pm","10-Apr-12"
"Abbott's HUMIRA® (adalimumab) Approved in Europe for Treatment of Ulcerative Colitis (UC)","ABT-US,ABT.N,ABT@US","PRNE"," 9:00pm","10-Apr-12"
"EVP GONZALEZ Disposes 6,909 of ABBOTT LABORATORIES (ABT)","ABT-US,ABT","EDG"," 2:03pm","10-Apr-12"
"ABBOTT LABORATORIES files (8-K) Current report: Item 8.01 - Other Events, for period end 9-Apr-12 (ABT-US)","ABT-US,ABT","EDG"," 3:03am","10-Apr-12"
"Doctors want FDA to raise safety reporting requirements for heart devices - WSJ","ABT-US,BSX-US,EW-...","SA","12:41am","10-Apr-12"
"World-Renowned Experts Gather on Tuesday April 17 for First Ever Online Prostate Summit to Discuss Prostate Cancer Risk Screening and Novel Therapies","ABT-US","GNW","11:14am","9-Apr-12"
"Abbott receives approval for XIENCE PRIME Everolimus Eluting Coronary Stent System in Japan","ABT-US","SA"," 6:02am","9-Apr-12"
"Abbott Receives Approval for Next-Generation XIENCE PRIME™ Drug Eluting Stent in Japan","ABT-US","PRN"," 6:00am","9-Apr-12"
"Natural Alternatives and Abott Laboratories amends licence and supply agreement","ABT-US,NAII-US","SA"," 8:40am","5-Apr-12"
"Most Attractive Stocks: Citigroup, Microsoft, Abbott, Texas Instruments, Atmel, and Monsanto","MON-US,C-US,TXN-U...","PRN"," 6:05am","5-Apr-12"
"Abbott to present positive phase 2 results from multiple Interferon-Free studies of combination regimens for the treatment of Hepatitis C","ABT-US,IDIX-US","SA"," 7:23am","4-Apr-12"
"Abbott to Present Positive Phase 2 Results from Multiple Interferon-Free Studies of Combination Regimens for the Treatment of Hepatitis C","ABT-US","PRN"," 7:19am","4-Apr-12"
"Research and Markets: Abbott Laboratories Inc in Packaged Food (World) - Use Five-Year Forecasts to Assess How the Market is Predicted to Develop","ABT-US","BW"," 4:34am","4-Apr-12"
"Waife & Associates Announces New Senior Associate in Germany","ABT-US","PRN"," 4:30am","4-Apr-12"
"SVP WARMUTH Sells 13,335 of ABBOTT LABORATORIES (ABT)","ABT-US,ABT","EDG"," 2:06pm","3-Apr-12"
"Dir ALPERN Updates Ownership of ABBOTT LABORATORIES (ABT)","ABT-US,ABT","EDG"," 2:05pm","3-Apr-12"
"Dir ALPERN Updates Ownership of ABBOTT LABORATORIES (ABT)","ABT-US,ABT","EDG"," 2:05pm","3-Apr-12"
"Dir FULLER Updates Ownership of ABBOTT LABORATORIES (ABT)","ABT-US,ABT","EDG"," 2:04pm","3-Apr-12"
"Dir OSBORN Updates Ownership of ABBOTT LABORATORIES (ABT)","ABT-US,ABT","EDG"," 2:04pm","3-Apr-12"
"Dir TILTON Updates Ownership of ABBOTT LABORATORIES (ABT)","ABT-US,ABT","EDG"," 2:03pm","3-Apr-12"
"Dir LIDDY Updates Ownership of ABBOTT LABORATORIES (ABT)","ABT-US,ABT","EDG"," 2:03pm","3-Apr-12"
"Under Armour Names Karl-Heinz ("Charlie") Maurath President of International","UA-US,HSP-US,XOM-...","CNW"," 6:01am","2-Apr-12"
"Abbott's PLEX-ID molecular system and tests for broad microbial identification obtains CE marking","ABT-US","SA"," 3:01am","30-Mar-12"
"Abbott's PLEX-ID Molecular System and Tests for Broad Microbial Identification Obtain CE Marking","ABT-US","PRN"," 3:00am","30-Mar-12"
"Medigene's drug Veregen obtains market approval in Switzerland","ABT-US,MDG1-DE","SA","10:35pm","29-Mar-12"
"VP LINDER Sells 29,331 of ABBOTT LABORATORIES (ABT)","ABT-US,ABT","EDG"," 2:05pm","29-Mar-12"
"Abbott Laboratories(ABT-US) Schedules Q1 2012 Earnings Call for 18-April-2012 9:00 AM ET","ABT-US","FCST"," 6:12am","28-Mar-12"
"Abbott Laboratories(ABT) Schedules Q1 2012 Earnings Release for 18-April-2012 Before Market Open ET","ABT-US","FCST"," 6:12am","28-Mar-12"
"Abbott Hosts Conference Call for First-Quarter Earnings","ABT-US","PRN"," 6:00am","28-Mar-12"
"Nestle Health Science Announces BOOST® Complete Nutritional Drink Florida Sampling Tour","0BSX4S-E,NESN-CH,...","PRN"," 6:00am","28-Mar-12"
"Abbott Labs added to Short Term Buy list at Deutsche Bank","ABT-US","SA"," 4:25am","26-Mar-12"
"RBCC: Michael J. Fox Foundation Invests $179 Million in the Fight Against Parkinson's Disease","0C8BZH-E,06T2SB-E...","BW"," 2:00am","26-Mar-12"
"Boston Scientific announces results from PERSEUS and PLATINUM clinical trials","ABT-US,BSX-US","SA"," 9:23am","25-Mar-12"
"Abbott Laboratories (ABT-US) - Annual Report for the Period Ending 31-Dec-2011 (English)","ABT-US","FFR"," 9:34pm","23-Mar-12"
"VP LINDER Sells 38,706 of ABBOTT LABORATORIES (ABT)","ABT-US,ABT","EDG"," 2:11pm","23-Mar-12"
"SVP FUSSELL Acquires 1,395 of ABBOTT LABORATORIES (ABT)","ABT-US,ABT","EDG"," 2:09pm","23-Mar-12"
"Scan Added:  ABBOTT LABORATORIES files (ARS) Annual report to security holders (paper filing), for period end 31-Dec-11 (ABT-US)","ABT-US,ABT","EDG","12:59pm","23-Mar-12"
"The Zacks Analyst Blog Highlights: Hewlett-Packard, Apple, Microsoft, Amazon.com and Abbott Labs","AMZN-US,AMZN-US,M...","PRN"," 6:30am","23-Mar-12"
"RBCC Prepares to Join the $3 Billion Fight Against Parkinson's Disease","0C8BZH-E,RBCC-US,...","BW"," 5:17am","23-Mar-12"
"CER Research Responds to Abbott Laboratories on China Infant Formula Report","ABT-US","PRN"," 3:22am","23-Mar-12"
"Fledgling Recovery Not Housebroken (Capital Markets Research) (Moodys) 27 pages","WCC-US,USB-US,POP...","FRC"," 2:29pm","22-Mar-12"
"SVP ALBAN Sells 824 of ABBOTT LABORATORIES (ABT)","ABT-US,ABT","EDG"," 2:18pm","22-Mar-12"
"EVP FREYMAN Acquires 3,369 of ABBOTT LABORATORIES (ABT)","ABT-US,ABT","EDG"," 2:17pm","22-Mar-12"
"Health care reform: background, considerations, and potential outcomes ahead of Supreme Court arguments","ABT-US,AET-US,AFL...","SA"," 1:08pm","22-Mar-12"
"Abbott Laboratories Chinese Infant Formula Violates China National Standards, According to Tests","ABT-US","PRN"," 3:54am","22-Mar-12"
"Dir FULLER Sells 19,284 of ABBOTT LABORATORIES (ABT)","ABT-US,ABT","EDG"," 2:05pm","21-Mar-12"
"EVP LANDGRAF Sells 30,000 of ABBOTT LABORATORIES (ABT)","ABT-US,ABT","EDG"," 2:04pm","21-Mar-12"
"Abbott Selects AbbVie as New Name for Future Research-Based Pharmaceutical Company","ABT-US","PRN"," 6:34am","21-Mar-12"
"FDA grants orphan drug designation to Abbott Labs' ilorasertib for ovarian cancer","ABT-US","SA"," 6:08am","21-Mar-12"
"Abbott Reinforces Global Vascular Leadership with New Data on Innovative Technologies at ACC 2012","ABT-US","PRN"," 6:00am","20-Mar-12"
"N3D Unveils the Next Generation of 3D Cell Culturing System","0C8BZM-E,0C8BZH-E...","BW"," 2:00am","20-Mar-12"
"Watson Pharmaceuticals confirms it filed ANDA seeking approval to market generic versions of Abbott's Niaspan","ABT-US,ACT-US","SA"," 6:00am","19-Mar-12"
"Biotechs face longer road to riches these days - WSJ","4502-JP,ABT-US,AZ...","SA"," 2:43am","19-Mar-12"
"RBCC and n3D Aim to Help Bring Stem Cell Treatments to Market Faster","0C8BZM-E,0C8BZH-E...","BW"," 2:00am","19-Mar-12"
"Abbott Labs upgraded to buy from hold at Deutsche Bank","ABT-US","SA"," 1:44am","19-Mar-12"
"Pronova BioPharma and Takeda Pharmaceutical Company Limited announced the results from a phase 3 trial of TAK-085for the Treatment of Hyperlipidemia","4502-JP,ABT-US,GS...","SA","11:19pm","18-Mar-12"
"Abbott Laboratories (ABT-US) - Annual Report for the Period Ending 31-Dec-2011 (English)","ABT-US","FFR"," 8:31pm","15-Mar-12"
"SVP MASON Sells 39,779 of ABBOTT LABORATORIES (ABT)","ABT-US,ABT","EDG"," 2:06pm","15-Mar-12"
"ABBOTT LABORATORIES files (DEF 14A) Definitive proxy statements, for period end 27-Apr-12 (ABT-US)","ABT-US,ABT","EDG"," 2:05pm","15-Mar-12"
"Companies interested in bidding for MN Pharma (private) preparing second round bids -- Reuters citing sources","ABT-US,AMGN-US,FR...","SA"," 9:09am","15-Mar-12"
"RBCC Closes Deal with Game Changing Biotech Firm","0C8BZM-E,0C8BZH-E...","BW"," 5:14am","15-Mar-12"
"Abbott Labs announces enrollment in two Phase III studies of HUMIRA","ABT-US","SA"," 3:02am","15-Mar-12"
"Abbott Announces Patient Enrollment in Two Phase 3 Studies of HUMIRA® (adalimumab) for Moderate to Severe Hidradenitis Suppurativa","ABT-US","PRN"," 3:00am","15-Mar-12"
"DJ Mumbai Bourse: Press Release From Abbott India","500488-IN,ABT-US","DJMS","10:41pm","14-Mar-12"
"EVP LANDGRAF Sells 30,000 of ABBOTT LABORATORIES (ABT)","ABT-US,ABT","EDG"," 3:06pm","14-Mar-12"
"CORRECTED TRANSCRIPT: Abbott Laboratories(ABT), Barclays Capital Global Health Care Conference, 14-March-2012 2:30 PM ET","ABT-US","FCST"," 2:30pm","14-Mar-12"
"SVP WARMUTH Acquires 1,910 of ABBOTT LABORATORIES (ABT)","ABT-US,ABT","EDG"," 2:16pm","14-Mar-12"
"Research and Markets: Global Prefilled Syringes Market 2010-2014 - The Global Prefilled Syringes Market to Grow At A CAGR Of 9 Percent over the Period 2010-2014","09S4GJ-E,088XSK-E...","BW"," 8:34am","14-Mar-12"
"RBCC: Promising New Parkinson's Therapies May Also Treat Brain Injuries","0C8BZH-E,RBCC-US,...","BW"," 2:00am","14-Mar-12"
"Pharma IQ's Compound Management Survey Report","06530B-E,AZN-GB,A...","PRN"," 1:00am","14-Mar-12"
"SVP BLASER Sells 8,750 of ABBOTT LABORATORIES (ABT)","ABT-US,ABT","EDG"," 2:29pm","13-Mar-12"
"FDA's Arthritis Advisory Committee recommends continued development of Pfizer (PFE), JNJ and Regeneron (REGN) pain drugs -- Dow Jones","ABT-US,AMGN-US,JN...","SA"," 1:43pm","12-Mar-12"
"RBCC Identifies Promising New Business Targets at Texas' Premiere Life Sciences Forum","0C8BZH-E,RBCC-US,...","BW"," 2:00am","12-Mar-12"
"Abbott reports publication of comparative efficacy data for Zemplar (paricalcitol) in treating secondary hyperparathyroidism in Hemodialysis patients","ABT-US","SA","12:09am","12-Mar-12"
"New Publication Presents Comparative Efficacy Data for Abbott's Zemplar® (paricalcitol) in Treating Secondary Hyperparathyroidism in Hemodialysis Patients","ABT-US,ABT.N,ABT@US","PRNE","12:00am","12-Mar-12"
"Depomed Reports Fourth Quarter and Year-End 2011 Financial Results","DEPO-US,ABT-US,DEPO","GNW"," 1:05pm","8-Mar-12"
"Abbott's New FreeStyle InsuLinx Blood Glucose Monitoring System Receives FDA Clearance","ABT-US","PRN"," 7:00am","8-Mar-12"
"Follow-up: FDA releases briefing documents ahead of Monday's Arthritis Advisory Committee meeting","ABT-US,AMGN-US,JN...","SA"," 5:24am","8-Mar-12"
"FDA releases briefing documents ahead of Monday's Arthritis Advisory Committee meeting","ABT-US,AMGN-US,JN...","SA"," 5:03am","8-Mar-12"
"Innovation on Access: Pharmaceutical Donations Support Nonprofit Effort to Bring Medicine to People Without Health Insurance","ABT-US","PRN"," 3:00am","8-Mar-12"
"EVP CAPEK Sells 100,000 of ABBOTT LABORATORIES (ABT)","ABT-US,ABT","EDG"," 2:32pm","7-Mar-12"
"CORRECTED TRANSCRIPT: Abbott Laboratories(ABT-US), Cowen Group Health Care Conference, 7-March-2012 11:20 AM ET","ABT-US","FCST","11:52am","7-Mar-12"
"Abbott Laboratories(ABT) Schedules Barclays Capital Global Health Care Conference for 14-March-2012 2:30 PM ET","ABT-US","FCST","10:32am","7-Mar-12"
"Abbott's receives FDA approval for Absolute Pro Vascular Self-Expanding Stent System","ABT-US","SA"," 6:02am","7-Mar-12"
"Abbott's Absolute Pro® Vascular Self-Expanding Stent System Receives FDA Approval for Treatment of Iliac Artery Disease","ABT-US","PRN"," 6:00am","7-Mar-12"
"Abbott to Present at Barclays Capital 2012 Global Healthcare Conference","ABT-US","PRN"," 5:00am","7-Mar-12"
"Follow-up: FDA approves Discovery Labs' Surfaxin (lucinactant)","ABT-US,CRTX-US,DS...","SA"," 1:16pm","6-Mar-12"
"FDA approves Discovery Labs' Surfaxin (lucinactant); stock remains halted","ABT-US,CRTX-US,DS...","SA"," 1:11pm","6-Mar-12"
"Discovery Laboratories halted; news pending","ABT-US,CRTX-US,DS...","SA","12:38pm","6-Mar-12"
"Research and Markets: Rapid Tests and Point of Care Market to 2017 - Clinical Chemistry Tests to be the Major Revenue Generator","078WL3-E,06MT03-E...","BW","10:39am","6-Mar-12"
"Discovery Laboratories trading +18% ahead of FDA decision on Surfaxin","ABT-US,CRTX-US,DS...","SA","10:26am","6-Mar-12"
"Abbott and Merck announces collaboration on diagnostic test","ABT-US,MRK-US","SA"," 6:04am","6-Mar-12"
"Abbott and Merck Collaborate to Develop Companion Diagnostic Test for Investigational Cancer Therapy","ABT-US","PRN"," 6:00am","6-Mar-12"
"Crohn's and Colitis Foundation of Canada and Abbott Announce new IBD Initiative in Support of Students","0C5H4Y-E,ABT-US","CNW"," 2:59am","6-Mar-12"
"Preview of upcoming FDA decision on Surfaxin (lucinactant)","ABT-US,CRTX-US,DS...","SA"," 1:27pm","5-Mar-12"
"Abbott to Collaborate on Rapid Molecular Test to Identify Serious Infections in Bones and Joints","ABT-US","PRN"," 6:00am","5-Mar-12"
"SVP FUSSELL Sells 907 of ABBOTT LABORATORIES (ABT)","ABT-US,ABT","EDG"," 2:23pm","2-Mar-12"
"SVP MAZZO Sells 654 of ABBOTT LABORATORIES (ABT)","ABT-US,ABT","EDG"," 2:22pm","2-Mar-12"
"SVP MASON Sells 1,561 of ABBOTT LABORATORIES (ABT)","ABT-US,ABT","EDG"," 2:22pm","2-Mar-12"
"CEO WHITE Disposes 88,360 of ABBOTT LABORATORIES (ABT)","ABT-US,ABT","EDG"," 2:22pm","2-Mar-12"
"VP LINDER Sells 1,288 of ABBOTT LABORATORIES (ABT)","ABT-US,ABT","EDG"," 2:22pm","2-Mar-12"
"SVP WHITE Disposes 6,051 of ABBOTT LABORATORIES (ABT)","ABT-US,ABT","EDG"," 2:22pm","2-Mar-12"
"SVP WARMUTH Sells 18,456 of ABBOTT LABORATORIES (ABT)","ABT-US,ABT","EDG"," 2:22pm","2-Mar-12"
"SVP ALBAN Sells 1,204 of ABBOTT LABORATORIES (ABT)","ABT-US,ABT","EDG"," 2:21pm","2-Mar-12"
"EVP ASHLEY Disposes 17,073 of ABBOTT LABORATORIES (ABT)","ABT-US,ABT","EDG"," 2:21pm","2-Mar-12"
"SVP FORREST Acquires 4,736 of ABBOTT LABORATORIES (ABT)","ABT-US,ABT","EDG"," 2:21pm","2-Mar-12"
"EVP FREYMAN Disposes 27,207 of ABBOTT LABORATORIES (ABT)","ABT-US,ABT","EDG"," 2:20pm","2-Mar-12"
"EVP CAPEK Disposes 14,884 of ABBOTT LABORATORIES (ABT)","ABT-US,ABT","EDG"," 2:20pm","2-Mar-12"
"Officer SCHUMACHER Disposes 17,452 of ABBOTT LABORATORIES (ABT)","ABT-US,ABT","EDG"," 2:20pm","2-Mar-12"
"EVP MICHAEL Sells 1,527 of ABBOTT LABORATORIES (ABT)","ABT-US,ABT","EDG"," 2:20pm","2-Mar-12"
"EVP GONZALEZ Disposes 5,417 of ABBOTT LABORATORIES (ABT)","ABT-US,ABT","EDG"," 2:20pm","2-Mar-12"
"EVP LANDGRAF Sells 16,887 of ABBOTT LABORATORIES (ABT)","ABT-US,ABT","EDG"," 2:20pm","2-Mar-12"
"SVP HANCE Sells 81,485 of ABBOTT LABORATORIES (ABT)","ABT-US,ABT","EDG"," 2:19pm","2-Mar-12"
"SVP BLASER Sells 1,507 of ABBOTT LABORATORIES (ABT)","ABT-US,ABT","EDG"," 2:19pm","2-Mar-12"
"SVP HANCE Sells 94,988 of ABBOTT LABORATORIES (ABT)","ABT-US,ABT","EDG"," 2:19pm","2-Mar-12"
"STARLIMS Technologies Ltd agreed to acquire Varilab","LIMS-US,ABT-US,0C...","FFW"," 7:15am","2-Mar-12"
"Watson Pharmaceuticals launches generic PROMETRIUM","ABT-US,ACT-US","SA"," 6:37am","2-Mar-12"
"Abbott Labs subsidiary STARLIMS Technologies acquires several distribution partners","ABT-US","SA"," 6:04am","2-Mar-12"
"Abbott's STARLIMS Business Acquires Distribution Partners to Build International Presence","ABT-US","PRN"," 6:00am","2-Mar-12"
"Teva Pharmaceutical launches generic equivalent of Abbot's (ABT) Prometrium Capsules in US","ABT-US,TEVA-US","SA"," 5:52am","2-Mar-12"
"Abbott to build nutrition manufacturing facility in Ohio","ABT-US","SA"," 6:02am","1-Mar-12"
"Abbott to Build Nutrition Manufacturing Facility in Ohio","ABT-US","PRN"," 6:00am","1-Mar-12"
"Highlights from the Galapagos Genomics conference call","ABT-US,GLPG-BE","SA"," 8:32am","29-Feb-12"
"Ownership Updates: ABBOTT LABS  COM (ABT) for 29-Feb-2012","00282410","FIO","12:59am","29-Feb-12"
"Abbott Labs (ABT), Galapagos Genomics announce collaboration on GLPG0634","ABT-US,GLPG-BE","SA","10:39pm","28-Feb-12"
"(HUG)  Galapagos NV  Abbott and Galapagos Announce Global Collaboration for Novel Oral Therapy, GLPG0634, in Phase II to Treat Autoimmune Diseases ","GLPG-BE,ABT-US,0C...","FECA","10:32pm","28-Feb-12"
"Abbott and Galapagos Announce Global Collaboration for Novel Oral Therapy, GLPG0634, in Phase II to Treat Autoimmune Diseases","GLPG-BE,ABT-US","PRN","10:30pm","28-Feb-12"
"MOODY'S >> INVESTORS SERVICE (Moodys) 12 pages","BSX-US,HSP-US,BDX...","FRC"," 3:54pm","28-Feb-12"
"SVP MAZZO Sells 1,000 of ABBOTT LABORATORIES (ABT)","ABT-US,ABT","EDG"," 2:28pm","28-Feb-12"
"BioCurex Wholly Owned Subsidiary, OncoPet Diagnostics, Signs Distribution Agreement With Animal Health International","05SKRL-E,05NJQ2-E...","GNW"," 5:30am","28-Feb-12"
"EVP GONZALEZ Sells 208,926 of ABBOTT LABORATORIES (ABT)","ABT-US,ABT","EDG"," 2:46pm","24-Feb-12"
"ABBOTT LABORATORIES files (8-K) Current report: Items 5.03 - Amendments to Corporate Charters, 9.01 - Financial Statements and Exhibits, for period end 17-Feb-12 (ABT-US)","ABT-US,ABT","EDG"," 2:09pm","24-Feb-12"
"Abbott Laboratories(ABT-US) Schedules Cowen Group Health Care Conference for 7-March-2012 11:20 AM ET","ABT-US","FCST"," 9:52am","23-Feb-12"
"Abbott Collaborates with Leading U.S. Forensics Center on Human Identification Testing","ABT-US","PRN"," 7:00am","23-Feb-12"
"Abbott to Present at Cowen and Company 32nd Annual Health Care Conference","ABT-US","PRN"," 5:30am","23-Feb-12"
"EVP MICHAEL Acquires 39,600 of ABBOTT LABORATORIES (ABT)","ABT-US,ABT","EDG"," 3:19pm","22-Feb-12"
"SVP BLASER Acquires 26,700 of ABBOTT LABORATORIES (ABT)","ABT-US,ABT","EDG"," 3:17pm","22-Feb-12"
"EVP LANDGRAF Acquires 30,500 of ABBOTT LABORATORIES (ABT)","ABT-US,ABT","EDG"," 3:17pm","22-Feb-12"
"SVP MAZZO Acquires 12,200 of ABBOTT LABORATORIES (ABT)","ABT-US,ABT","EDG"," 3:17pm","22-Feb-12"
"EVP ASHLEY Acquires 42,700 of ABBOTT LABORATORIES (ABT)","ABT-US,ABT","EDG"," 3:15pm","22-Feb-12"
"EVP CAPEK Acquires 28,900 of ABBOTT LABORATORIES (ABT)","ABT-US,ABT","EDG"," 3:11pm","22-Feb-12"
"EVP GONZALEZ Acquires 53,873 of ABBOTT LABORATORIES (ABT)","ABT-US,ABT","EDG"," 3:10pm","22-Feb-12"
"CEO WHITE Acquires 167,600 of ABBOTT LABORATORIES (ABT)","ABT-US,ABT","EDG"," 3:09pm","22-Feb-12"
"SVP MASON Acquires 22,900 of ABBOTT LABORATORIES (ABT)","ABT-US,ABT","EDG"," 3:05pm","22-Feb-12"
"SVP HANCE Acquires 24,400 of ABBOTT LABORATORIES (ABT)","ABT-US,ABT","EDG"," 3:03pm","22-Feb-12"
"VP LINDER Acquires 19,000 of ABBOTT LABORATORIES (ABT)","ABT-US,ABT","EDG"," 3:02pm","22-Feb-12"
"SVP WARMUTH Updates Ownership of ABBOTT LABORATORIES (ABT)","ABT-US,ABT","EDG"," 3:01pm","22-Feb-12"
"Officer SCHUMACHER Acquires 44,200 of ABBOTT LABORATORIES (ABT)","ABT-US,ABT","EDG"," 2:58pm","22-Feb-12"
"SVP ALBAN Acquires 26,700 of ABBOTT LABORATORIES (ABT)","ABT-US,ABT","EDG"," 2:57pm","22-Feb-12"
"SVP FUSSELL Acquires 24,400 of ABBOTT LABORATORIES (ABT)","ABT-US,ABT","EDG"," 2:55pm","22-Feb-12"
"SVP WHITE Acquires 23,911 of ABBOTT LABORATORIES (ABT)","ABT-US,ABT","EDG"," 2:53pm","22-Feb-12"
"EVP FREYMAN Acquires 59,400 of ABBOTT LABORATORIES (ABT)","ABT-US,ABT","EDG"," 2:52pm","22-Feb-12"
"SVP FORREST Disposes 1,457 of ABBOTT LABORATORIES (ABT)","ABT-US,ABT","EDG"," 2:35pm","22-Feb-12"
"Analyst's Notes >> ABBOTT LABORATORIES (Argus Research) 5 pages","ABT-US,CRO-GB","FRC"," 7:12am","22-Feb-12"
"Ownership Updates: ABBOTT LABS  COM (ABT) for 22-Feb-2012","00282410","FIO","12:39am","22-Feb-12"
"ABBOTT LABORATORIES files (10-K) Basic annual filing, for period end 31-Dec-11 (ABT-US)","ABT-US,ABT","EDG","12:12pm","21-Feb-12"
"ABBOTT LABORATORIES: 10-K FactSet Blackline Report for period ending 12/31/2011","ABT-US","FBLK","12:12pm","21-Feb-12"
"FDA grants orphan drug designation for Abbott brain cancer drug","ABT-US","SA","10:01am","21-Feb-12"
"MARKET DIGEST >> TUESDAY, FEBRUARY 21, 2012 (Argus Research) 6 pages","CRO-GB,NEE-US,ABT...","FRC"," 6:34am","21-Feb-12"
"Barron's Summary","AAPL-US,ABT-US,CI...","SA"," 9:15am","18-Feb-12"
"Abbott Labs increases quarterly dividend by 6.3% to $0.51 from $0.48","ABT-US","SA"," 8:48am","17-Feb-12"
"Abbott Announces 40th Consecutive Annual Increase in Quarterly Dividend","ABT-US","PRN"," 8:47am","17-Feb-12"
"Abbott Receives Positive Opinion for HUMIRA® in Ulcerative Colitis from EMA's CHMP","ABT-US,ABT.N,ABT@US","PRNE"," 4:54am","17-Feb-12"
"EU's CHMP adopted a positive opinion recommending a variation to the terms of the marketing authorisation for Humira","ABT-US,ROG-CH","SA"," 4:22am","17-Feb-12"
"RBCC Sets Sights on Top Emerging Biotech Innovations","0C8BZM-E,0C8BZH-E...","BW"," 2:00am","17-Feb-12"
"SVP MURRAY Sells 2,371 of ABBOTT LABORATORIES (ABT)","ABT-US,ABT","EDG"," 2:16pm","16-Feb-12"
"CORRECTED TRANSCRIPT: Abbott Laboratories(ABT-US), Leerink Swann Global Health Care Conference, 15-February-2012 9:00 AM ET","ABT-US","FCST","10:22am","15-Feb-12"
"BioSante Pharmaceuticals confirms FDA approval for Bio-T-Gel for the treatment of male hypogonadism","ABT-US,AUXL-US,AN...","SA"," 9:04am","15-Feb-12"
"Research and Markets: Australia Diabetes Care Devices Market Outlook to 2017 - Glucose Monitoring and Insulin Delivery","07GVF3-E,05QZSX-E...","BW"," 5:16am","15-Feb-12"
"Ownership Updates: ABBOTT LABS  COM (ABT) for 15-Feb-2012","00282410","FIO"," 1:20am","15-Feb-12"
"BioSante Pharmaceuticals trading higher following Bloomberg headline indicating FDA approval for BioSante/TEVA Bio-T-Gel","ABT-US,AUXL-US,AN...","SA"," 2:10pm","14-Feb-12"
"Preview of upcoming FDA decision on BioSante/TEVA's Bio-T-Gel (testosterone) for hypogonadism","ABT-US,AUXL-US,AN...","SA","12:05pm","13-Feb-12"
"Study published in Clinical Chemistry journal says Abbott's Tacrolimus assay demonstrates consistent organ transplant drug monitoring","ABT-US","SA"," 6:04am","13-Feb-12"
"Study Shows Abbott's Tacrolimus Assay Demonstrates Consistent Organ Transplant Drug Monitoring","ABT-US","PRN"," 6:00am","13-Feb-12"
"Follow-up: FDA issues guidance on biosimilars","068270-KR,ABT-US,...","SA"," 9:15am","9-Feb-12"
"FDA sets "shortcut path" for biosimilars - WSJ","068270-KR,ABT-US,...","SA"," 9:06am","9-Feb-12"
"FDA to host media-only conference call at 14:00ET to discuss draft guidance documents on biosimilar development","068270-KR,ABT-US,...","SA"," 8:47am","9-Feb-12"
"Scan Added:  ABBOTT LABORATORIES files (NO ACT) Postponement or waiver  of enforcement action, for period end 22-Dec-11 (ABT-US)","ABT-US,ABT","EDG"," 8:42am","9-Feb-12"
"ABBOTT LABORATORIES files (SC 13G) Acquisition of beneficial ownership of 5% or more (ABT-US)","ABT-US,ABT","EDG"," 6:59am","9-Feb-12"
"A Forward Look, the Year Ahead - Featured Research on Acorda Therapeutics Inc and Abbott Laboratories ","ACOR-US,ABT-US","MW"," 6:00am","9-Feb-12"
"Vein Illumination Leader AccuVein Inc. Announces Daniel Delaney as Chief Operating Officer","HSP-US,ABT-US,087...","GNW"," 5:18am","9-Feb-12"
"Endologix Completes Enrollment in PEVAR Randomized Trial","ELGX-US,ABT-US,ELGX","GNW"," 5:00am","9-Feb-12"
"SVP MURRAY -Initial Statement of Ownership of ABBOTT LABORATORIES (ABT)","ABT-US,ABT","EDG"," 2:24pm","8-Feb-12"
"Abbott Creates New Similac SimplySmart™ Baby Bottle with Innovative Features","ABT-US","PRN"," 6:00am","8-Feb-12"
"ResearchMoz: Global Drug Eluting (DES), Bare Metal (BMS) and Other Coronary Stents Market (2011 - 2016)","07R16P-E,BSX-US,J...","PRN"," 3:30am","8-Feb-12"
"Big VC Biotech Spending on the Rise for 2012","0C8BZH-E,RBCC-US,...","BW"," 2:00am","8-Feb-12"
"EVP MICHAEL Sells 51,311 of ABBOTT LABORATORIES (ABT)","ABT-US,ABT","EDG"," 3:16pm","7-Feb-12"
"FDA approves Sandoz's generics of Abbott's Nimbex and Nimbex preservative-free","ABT-US,NVS-US","SA"," 1:23pm","6-Feb-12"
"Thousands of Canadians Stretch Their Philanthropic Muscles to Raise Funds for Critical Arthritis Research","07GWQ3-E,07G1J1-E...","MW","12:29pm","6-Feb-12"
"SVP FUSSELL Sells 21,281 of ABBOTT LABORATORIES (ABT)","ABT-US,ABT","EDG"," 3:18pm","3-Feb-12"
"SVP MURRAY Acquires 5,000 of ABBOTT LABORATORIES (ABT)","ABT-US,ABT","EDG"," 3:16pm","3-Feb-12"
"Sucampo Pharmaceuticals announces Lubiprostone Meets Primary Endpoint in Phase 3 Clinical Trial for Opioid-Induced Bowel Dysfunction (OBD)","4502-JP,ABT-US,SC...","SA","12:01am","2-Feb-12"
"Abbott Laboratories(ABT-US) Schedules Leerink Swann Global Health Care Conference for 15-February-2012 9:00 AM ET","ABT-US","FCST"," 6:18am","1-Feb-12"
"Abbott to Present at Leerink Swann 2012 Global Healthcare Conference","ABT-US","PRN"," 5:30am","1-Feb-12"
"GlaxoSmithKline (GSK.LN), Eli Lilly (LLY), and Pfizer (PFE) all said to be interested in MN Pharma - Bloomberg","ABT-US,GSK-GB,LLY...","SA"," 5:36am","31-Jan-12"
"DNDi and Abbott Expand Partnership to Boost Innovation for Neglected Tropical Diseases","ABT-US","PRN"," 3:05am","30-Jan-12"
"RBCC Explores New Cures for Cancer, Brain Injuries & Headaches","0C8BZH-E,RBCC-US,...","BW"," 2:00am","30-Jan-12"
"Follow-up: Earnings scorecard","AAPL-US,ABT-US,AL...","SA"," 9:19am","27-Jan-12"
