"Abbott Laboratories terminated license and suuply agreement with Natural Alternatives -- 8K","NAII-US,ABT-US","SA","12:14pm","4-Dec-13"
"Product Recalls, New Appointments, Awareness Campaigns, and Stock Price Movements - Research Report on Abbott, AbbVie, Viropharma, Valeant Pharmaceuticals, and Salix Pharmaceuticals","ABBV-US,ABT-US,SL...","PRN"," 5:00am","2-Dec-13"
"Despite new highs, stock market offers some bargains, analyst says","ABT-US,DLR-US,HSP...","MCT"," 4:11pm","30-Nov-13"
"KKR to invest $200m in India pharma group Gland","4568-JP,ABT-US,KK...","FTH","12:35am","28-Nov-13"
"New Agreements and Stock Movements in Healthcare Companies - Research Report on Abbott, Thermo Fisher, Intuitive Surgical, Mindray, and Zeltiq","ABT-US,ISRG-US,MR...","PRN"," 5:00am","27-Nov-13"
"(RNS)  Abbott Laboratories  Statement of Change in beneficial ownership","ABT-US,US002824100","FECA","11:00pm","26-Nov-13"
"DJ Abbott Laboratories Statement of Change in beneficial ownership","ABT-US,ABT","DJRN","11:00pm","26-Nov-13"
"CEO WHITE Sells 149,874 of ABBOTT LABORATORIES (ABT)","ABT-US,ABT","EDG"," 2:15pm","26-Nov-13"
"CEO WHITE Sells 150,527 of ABBOTT LABORATORIES (ABT)","ABT-US,ABT","EDG"," 2:15pm","26-Nov-13"
"Pfizer set to change India management structure in line with global model","500095-IN,ABT-US,...","MCT","12:55am","26-Nov-13"
"Interros Holding Co CJSC agreed to acquire NPO Petrovax Pharm LLC","ABT-US,05L1HT-E,0...","FFW"," 9:15am","22-Nov-13"
"Cipla plans bigger global presence","500087-IN,500359-...","MCT","12:53am","22-Nov-13"
"Vital Signs (Vermilion Technical Research, LLC) 18 pages","POST-US,BAC-US,UT...","FRC"," 6:47am","20-Nov-13"
"Abbott's White: Employers to scrap health plans under Obamacare","ABBV-US,ABT-US,06...","MCT"," 3:09pm","19-Nov-13"
"GPS board agrees to letter granting tax incentive for Apple site in Mesa","AAPL-US,ABT-US,FS...","MCT"," 8:41am","19-Nov-13"
"Federal Legislation Support, Philanthropic Activities, and Patent Challenges - Research Report on Mylan, Abbott, Actavis, AbbVie, and Agilent Technologies","A-US,ABBV-US,ABT-...","PRN"," 5:00am","19-Nov-13"
"Big drugmakers such as Novartis turn from expansion to divestment","ABBV-US,ABT-US,GS...","FTH"," 4:33am","19-Nov-13"
"Abbott Named Top Dealmaker for Sixth Consecutive Year by The Deal","ABT-US","PRN","10:25am","18-Nov-13"
"Critical Alerts For Abbott Laboratories, CSX, SodaStream, Darden Restaurants, and Automatic Data Processing Released By InvestorsObserver","ABT-US,ADP-US,CSX...","PRN"," 6:31am","15-Nov-13"
"China to ease one-child policy - Xinhua","ABT-US,MJN-US","SA"," 5:00am","15-Nov-13"
"Ownership Updates: ABBOTT LABS  COM (ABT) for 15-Nov-2013","00282410","FIO"," 1:30am","15-Nov-13"
"Moody's assigns Aa2 to Miami County's (OH) $4.6M GOLT Bonds, Ser. 2013 and MIG 1 to $3.2M GOLT BANs, Ser. 2013 (Moodys) 9 pages","8309-JP,CGU-AU,AB...","FRC"," 1:22pm","14-Nov-13"
"Experience A Day in the Life of an Insulin-using Patient with Diabetes through Interactive Infographic","ABT-US","PRN"," 7:00am","14-Nov-13"
"Abbott Supports Relief Efforts in the Philippines","ABT-US","PRN"," 1:15pm","13-Nov-13"
"Clinical Study Results, Approvals, Financial Results, New Facilities, and Business Expansions - Research Report on Merck, UnitedHealth Group, NPS Pharmaceuticals, Abbott, and Medtronic","ABT-US,MDT-US,MRK...","PRN"," 5:00am","11-Nov-13"
"Vital Signs (Vermilion Technical Research, LLC) 16 pages","DD-US,APA-US,ESV-...","FRC"," 3:20am","11-Nov-13"
"(RNS)  Abbott Laboratories  Statement of Change in beneficial ownership","ABT-US,US002824100","FECA","11:00pm","10-Nov-13"
"DJ Abbott Laboratories Statement of Change in beneficial ownership","ABT-US,ABT","DJRN","11:00pm","10-Nov-13"
"Ownership Updates: ABBOTT LABS  COM (ABT) for 10-Nov-2013","00282410","FIO"," 9:00am","10-Nov-13"
"Efforts hope to make region â€œSilicon Valleyâ€ of water-related business","0458-HK,ABT-US,PG...","MCT"," 3:05pm","9-Nov-13"
"Ownership Updates: ABBOTT LABS  COM (ABT) for  9-Nov-2013","00282410","FIO"," 1:20am","9-Nov-13"
"EVP FUSSELL Sells 10,466 of ABBOTT LABORATORIES (ABT)","ABT-US,ABT","EDG"," 2:08pm","8-Nov-13"
"Before the Bell Scans: Boston Scientific Corp., Abbott Laboratories, Zimmer Holdings Inc., and EnteroMedics Inc.","ABT-US,BSX-US,ETR...","PRN"," 6:50am","8-Nov-13"
"(RNS)  Abbott Laboratories  Doc re. 3rd Quarter Form 10-Q","ABT-US,US002824100","FECA","11:00pm","7-Nov-13"
"DJ Abbott Laboratories Doc re. 3rd Quarter Form 10-Q","ABT-US,ABT","DJRN","11:00pm","7-Nov-13"
"ABBOTT LABORATORIES files (10-Q) Basic quarterly filing, for period end 30-Sep-13 (ABT-US)","ABT-US,ABT","EDG"," 1:06pm","7-Nov-13"
"Abbott Laboratories: 10-Q FactSet Blackline Report for period ending 09/30/2013","ABT-US","FBLK"," 1:06pm","7-Nov-13"
"Similac® se asocia con la Asociación Nacional de Enfermeras Hispanas para el lanzamiento de StrongMoms® Español","ABT-US","PRNL"," 6:00am","7-Nov-13"
"Partners In Health, Abbott and the Abbott Fund Open Nutrition Facility in Haiti","ABT-US","PRN"," 5:00am","6-Nov-13"
"When China slows, so do western profits - WSJ","ABT-US,BN-FR,CSCO...","SA"," 7:24pm","5-Nov-13"
"Baby Foods and Infant Formula - Global Strategic Business Report","ABT-US","GNW"," 5:00am","5-Nov-13"
"DJ Abbott Laboratories Statement of change in beneficial ownership","ABT-US,ABT","DJRN","11:00pm","3-Nov-13"
"BRIEF: Piramal Enterprises acquires Indian rights of skincare brand Caladryl","500302-IN,ABT-US,...","MCT"," 9:01pm","1-Nov-13"
"SVP CONTRERAS Sells 25,368 of ABBOTT LABORATORIES (ABT)","ABT-US,ABT","EDG"," 2:05pm","1-Nov-13"
"MARKET DIGEST >> FRIDAY, NOVEMBER 1, 2013 (Argus Research) 26 pages","YM-CA,INCY-US,SBH...","FRC"," 6:42am","1-Nov-13"
"Financial Results, FDA Approvals, Study Results and Legal Settlements - Research Report on Aetna, Intuitive Surgical, Abbott, Questcor, and Valeant Pharmaceuticals","ABT-US,AET-US,ISR...","PRN"," 6:00am","1-Nov-13"
"Abbott announces meaningful changes to quality of life for patients treated with MitraClip therapy","ABT-US","SA"," 5:17pm","30-Oct-13"
"Abbott's MitraClip® Treatment Demonstrates Positive Results for Patients with Degenerative Mitral Regurgitation at Prohibitive Risk for Surgery","ABT-US","PRN"," 5:12pm","30-Oct-13"
"Humira sales help Abbvie 3Q profit beat expectations","ABBV-US,ABT-US","MCT","12:01pm","25-Oct-13"
"Abbott gets FDA approval for heart valve clip","ABBV-US,ABT-US","MCT"," 7:23am","25-Oct-13"
"BRIEF: Humira sales boost help Abbvie 3Q profit beat expectations","ABBV-US,ABT-US","MCT"," 6:43am","25-Oct-13"
"Abbott's MitraClip device now available in the US following FDSA approval","ABT-US","SA"," 6:08am","25-Oct-13"
"Abbott's First-In-Class MitraClip® Device Now Available for U.S. Patients","ABT-US","PRN"," 6:04am","25-Oct-13"
"DJ Abbott Laboratories Initial Statement of Beneficial Ownership","ABT-US,ABT","DJRN","11:00pm","24-Oct-13"
"EVP LANDGRAF -Initial Statement of Ownership of ABBOTT LABORATORIES (ABT)","ABT-US,ABT","EDG"," 2:16pm","24-Oct-13"
"Abbott Again Recognized by Science Magazine as One of the Top Employers in the Healthcare Industry","ABT-US","PRN"," 1:11pm","24-Oct-13"
"Clinical Study Results, Financial Results, Prestigious Awards, and Regulatory Approvals - Research Report on Abbott, Opko, Varian Medical Systems, ICU Medical and Quintiles","ABT-US,ICUI-US,OP...","PRN"," 5:00am","24-Oct-13"
"DJ Abbott Laboratories Statement of change in beneficial ownership","ABT-US,ABT","DJRN","11:00pm","23-Oct-13"
"EVP FREYMAN Acquires 1,428 of ABBOTT LABORATORIES (ABT)","ABT-US,ABT","EDG"," 2:10pm","23-Oct-13"
"Barron's Summary","005930-KR,4502-JP...","SA","11:56am","19-Oct-13"
"Pre-Market Review: Boston Scientific Corp., Abbott Laboratories, Zimmer Holdings Inc., and EnteroMedics Inc.","ABT-US,BSX-US,ETR...","PRN"," 2:06pm","18-Oct-13"
"New Study Demonstrates Importance of Oral Nutritional Supplements in Helping Hospitals Achieve Medicare Readmission Reduction Requirements","ABT-US","PRN"," 6:00am","18-Oct-13"
"Clinical Study Results, Acquisitions, Upcoming Earnings Schedules, and New Drug Technologies- Research Report on Abbott, St. Jude Medical, Cigna, Edwards Lifesciences, and Novogen","ABT-US,CI-US,EW-U...","PRN"," 5:00am","18-Oct-13"
"Hammond company builds robots that make factories more productive","ABT-US,LEA-US","MCT"," 3:16am","18-Oct-13"
"Analyst's Notes >> ABBOTT LABORATORIES (Argus Research) 4 pages","ABT-US,BMY-US,MOR...","FRC","11:47am","17-Oct-13"
"MARKET UPDATE >> THURSDAY, OCTOBER 17, 2013 (Argus Research) 14 pages","HAWK-US,BN-FR,BMY...","FRC","11:43am","17-Oct-13"
"CALLSTREET REPORT: Abbott Laboratories(ABT-US), Q3 2013 Earnings Call, 16-October-2013 9:00 AM ET","ABT-US","FCST"," 2:08pm","16-Oct-13"
"Abbott beats profit expectations in 3Q","ABBV-US,ABT-US,DA...","MCT"," 7:12am","16-Oct-13"
"Early Street Takeaways - ABT Q3 Earnings","ABT-US","SA"," 6:57am","16-Oct-13"
"Molecular Diagnostics - Global Strategic Business Report","TECN-CH,HOLX-US,G...","GNW"," 6:04am","16-Oct-13"
"ABBOTT LABORATORIES files (8-K) Current report: Items 2.02 - Results of Operations, 9.01 - Financial Statements and Exhibits, for period end 16-Oct-13 (ABT-US)","ABT-US,ABT","EDG"," 5:43am","16-Oct-13"
"(RNS)  Abbott Laboratories  3rd Quarter Results","ABT-US,US002824100","FECA"," 5:12am","16-Oct-13"
"StreetAccount Metrics Recap - ABT Q3 Earnings; increases dividend","ABT-US","SA"," 4:49am","16-Oct-13"
"Abbott Labs reports Q3 EPS $0.55 ex-items vs FactSet $0.52","ABT-US","SA"," 4:46am","16-Oct-13"
"Abbott Reports Third-Quarter 2013 Results","ABT-US","PRN"," 4:44am","16-Oct-13"
"Companies becoming stateless to seek more green will need to stop looking for it in Ireland - WSJ","AA-US,AAPL-US,ABB...","SA"," 9:33pm","15-Oct-13"
"StreetAccount Consensus Metrics Preview - ABT Q3 Earnings","ABT-US","SA","10:00am","14-Oct-13"
"Moody's downgrades North Chicago School District 187, IL's GO to Baa2 from A3; Outlook negative (Moodys) 10 pages","NVY-CA,ABT-US,830...","FRC"," 9:32am","14-Oct-13"
"Moody's assigns a (P)Baa3 first-time rating to Adani Abbott Point (Moodys) 6 pages","NS8U-SG,ABT-US","FRC"," 4:53pm","13-Oct-13"
"StreetAccount's list of upcoming earnings previews","ABT-US,ADS-US,AF-...","SA","10:30am","11-Oct-13"
"New Study Shows Oral Nutritional Supplement Use in Pediatric Inpatients Is Associated with Decreases in Length of Hospital Stay, Costs","ABT-US","PRN"," 6:00am","11-Oct-13"
"Celadon files $86M IPO through JP Morgan and Barclays","CGI-US,GSK-GB,NVS...","SA"," 3:17am","11-Oct-13"
"Upcoming Earnings Schedules, Acquisitions, Partnerships, and Unrestricted Grants for Community Programs - Research Report on Intuitive Surgical, Abbott, MAKO Surgical, Allscripts, and ABIOMED","ABMD-US,ABT-US,IS...","PRN"," 5:00am","10-Oct-13"
"Bioabsorbable Stents - Global Strategic Business Report - 2013 Profiles 16 Companies inside the Market","RVA-AU,ABT-US,007...","GNW"," 8:10am","7-Oct-13"
"Big pharma companies paid up to $25K each to attend IMMPACT meetings - Washington Post","ABT-US,AZN-GB,BMY...","SA","12:33am","7-Oct-13"
"DJ Abbott Laboratories Statements of changes in beneficial ownership","ABT-US,ABT","DJRN","11:00pm","2-Oct-13"
"Dir LIDDY Updates Ownership of ABBOTT LABORATORIES (ABT)","ABT-US,ABT","EDG"," 2:15pm","2-Oct-13"
"Dir TILTON Updates Ownership of ABBOTT LABORATORIES (ABT)","ABT-US,ABT","EDG"," 2:15pm","2-Oct-13"
"Dir OSBORN Updates Ownership of ABBOTT LABORATORIES (ABT)","ABT-US,ABT","EDG"," 2:15pm","2-Oct-13"
"Dir ALPERN Updates Ownership of ABBOTT LABORATORIES (ABT)","ABT-US,ABT","EDG"," 2:14pm","2-Oct-13"
"Molecular Diagnostics in Genetic Testing","ABT-US,002WQB-E","GNW"," 7:34am","30-Sep-13"
"Conference Calls, New Appointments, Agreements, Pricing of Offerings and New Clinical Trials - Research Report on Abbott, Cubist, Pacific Biosciences, Synageva, and Oncothyreon","ABT-US,CBST-US,GE...","PRN"," 5:00am","30-Sep-13"
"Abu Dhabi hosts the 3rd Advanced Rheumatology Review Course [Emirates News Agency (WAM) (United Arab Emirates)] (Middle East & North African Newspapers)","A.2663069084-US,A...","IA"," 9:01pm","28-Sep-13"
"SVP CONTRERAS -Initial Statement of Ownership of ABBOTT LABORATORIES (ABT)","ABT-US,ABT","EDG"," 2:10pm","26-Sep-13"
"Don't Miss Gains in ABT, PFE and SIRI","PFE-US,ABT-US","MW"," 1:00am","26-Sep-13"
"Abbott Laboratories(ABT-US) Schedules Q3 2013 Earnings Release for 16-October-2013 Before Market Open ET","ABT-US","FCST"," 9:14am","25-Sep-13"
"Abbott Laboratories(ABT-US) Schedules Q3 2013 Earnings Call for 16-October-2013 9:00 AM ET","ABT-US","FCST"," 9:14am","25-Sep-13"
"Abbott Hosts Conference Call for Third-Quarter Earnings","ABT-US","PRN"," 9:00am","25-Sep-13"
"Buybacks up nearly 25% q/q in Q2 - FactSet","AAPL-US,ABT-US,AI...","SA"," 8:42am","24-Sep-13"
"Disposable Syringe Markets Report: Comprehensive 2013 Analysis","RVP-US,MMSI-US,BJ...","GNW"," 7:34am","24-Sep-13"
"Groupe Danone's unit opens an investigation after Dumex accusation of bribing doctors -- Reuters","BN-FR,ABT-US,MJN-...","SA"," 3:29am","23-Sep-13"
"Teva announces launch of generic equivalent to NIASPAN in US","TEVA-IL,ABBV-US,A...","SA"," 6:52am","20-Sep-13"
"Early Briefing and Review: Boston Scientific Corp., Abbott Laboratories, Zimmer Holdings Inc., and EnteroMedics Inc.","ABT-US,BSX-US,ETR...","PRN"," 5:14am","20-Sep-13"
"SVP FORREST Acquires 12,101 of ABBOTT LABORATORIES (ABT)","ABT-US,ABT","EDG"," 3:37pm","19-Sep-13"
"Legal Actions, Quarterly Dividends, Collaborations, and New Appointments - Research Report on Johnson & Johnson, Zoetis, Abbott, Teva Pharmaceuticals, and Baxter","ABT-US,BAX-US,JNJ...","PRN"," 5:00am","19-Sep-13"
"Abbott receives Ce Mark for FreeStyle Optium Neo Blood Glucose, Ketone monitoring system","ABT-US","SA"," 6:31am","17-Sep-13"
"Abbott Receives CE Mark for FreeStyle Optium Neo Blood Glucose and Ketone Monitoring System™","ABT-US","PRN"," 6:30am","17-Sep-13"
"Successful Clinical Trials, Recognitions, Enrollment in Studies, Product Launches, and Strategic Announcements - Research Report on Boston Scientific, Gilead, Abbott, Actavis, and Covidien","ABT-US,ACT-US,BSX...","PRN"," 5:00am","17-Sep-13"
"Collaborations, New Studies, and New Drug Applications - Research Report on Amgen, Gilead, Abbott, Biogen Idec, and UnitedHealth","ABT-US,AMGN-US,BI...","PRN"," 5:00am","16-Sep-13"
"Dumex accused of bribing doctors, nurses to feed newborn with its products - CCTV","BN-FR,ABT-US,MJN-...","SA"," 3:00am","16-Sep-13"
"DJ Abbott Laboratories Dividend Declaration","ABT-US,ABT","DJRN"," 8:50am","13-Sep-13"
"Abbott Declares 359th Consecutive Quarterly Dividend","ABT-US","PRN","11:30am","12-Sep-13"
"Abbott Named the Leading Healthcare Company on the Dow Jones Sustainability Index (DJSI)","ABT-US","PRN"," 9:22am","12-Sep-13"
"Pay-for-performance seems to be working - WSJ","ABT-US,ADM-US,AEP...","SA"," 8:18pm","11-Sep-13"
"Fort Lauderdale's Nipro aims to dominate diabetic market","8086-JP,ABT-US,JN...","MCT"," 9:01pm","7-Sep-13"
"Preliminary results suggest troponin test may help diagnose heart attacks","ABT-US","SA","11:36pm","3-Sep-13"
"New Data Suggests Abbott's High Sensitive Troponin Test May Help Doctors More Accurately Diagnose Heart Attacks in Women","ABT-US","PRN","11:30pm","3-Sep-13"
"Oral Nutritional Supplements in the Hospital Demonstrate Significant Health and Cost Benefits in New Research","ABT-US","PRN"," 5:00am","30-Aug-13"
"Diversifying Businesses through Acquisitions, New Technologies and Next-Generation Products - Research Report on Medtronic, Abbott, Boston Scientific, St. Jude, and Cyberonics","ABT-US,BSX-US,CYB...","PRN"," 5:00am","27-Aug-13"
"Bosch Healthcare Reacquires the Rights to Its Patents in the Diabetes Field from Abbott","061P8Q-E,ABT-US","BW"," 7:21am","23-Aug-13"
"Abbott completes acquisition of IDEV Technologies","ABT-US","SA"," 6:02am","21-Aug-13"
"Abbott Completes Acquisition of IDEV Technologies","006Z7Y-E,ABT-US","PRN"," 6:00am","21-Aug-13"
"Moody's assigns Aaa to Community College District 532's (IL) $32.4M GO Bonds (Alt Rev), Series 2013A and $27.2M Local Government Program Revenue Bonds, Series 2013B (Moodys) 10 pages","GBAB-US,WFC-US,AB...","FRC"," 1:03pm","20-Aug-13"
"Abbott completes acquisition of OptiMedica","ABT-US","SA"," 6:31am","19-Aug-13"
"Abbott Completes Acquisition of OptiMedica","007999-E,ABT-US","PRN"," 6:30am","19-Aug-13"
"FTC grants antitrust clearance for Abbott Labs purchase of IDEV Technologies","ABT-US","SA"," 6:13am","15-Aug-13"
"Abbott Partners with Music Saves Lives® to Encourage Young Donors to Give the Gift of Blood","ABT-US","PRN"," 6:00am","15-Aug-13"
"Bright Food Will Benefit from Fonterra's Milk Powder Contamination Scare (Simplified Chinese translation) (Moodys) 3 pages","WISH-US,ABT-US,SM...","FRC","12:06am","15-Aug-13"
"Bright Food Will Benefit from Fonterra's Milk Powder Contamination Scare (Moodys) 3 pages","WISH-US,600597-CN...","FRC"," 4:32pm","14-Aug-13"
"Ownership Updates: ABBOTT LABS  COM (ABT) for 14-Aug-2013","00282410","FIO"," 3:00am","14-Aug-13"
"NICE consults on draft guidance supporting the case for adopting the E-vita open plus for treating complex disease of the heart artery","ABT-US,BSX-US,COV...","SA"," 1:15am","14-Aug-13"
"CMS issues decision memo for cardiac pacemakers","ABT-US,BSX-US,JNJ...","SA"," 2:11pm","13-Aug-13"
"Analyst's Notes >> ABBVIE INC (Argus Research) 5 pages","ABBV-US,160512-CN...","FRC"," 6:41am","12-Aug-13"
"(RNS)  Abbott Laboratories  Doc re. Form 10-Q","ABT-US,US002824100","FECA"," 9:05am","9-Aug-13"
"DJ Abbott Laboratories Doc re. Form 10-Q","ABT-US,ABT","DJRN"," 9:05am","9-Aug-13"
"Ownership Updates: ABBOTT LABS  COM (ABT) for  9-Aug-2013","00282410","FIO"," 2:11am","9-Aug-13"
"NDRC fines six baby formula companies CNY668.73M (~$109M)","1112-HK,2269-JP,A...","SA","10:02pm","6-Aug-13"
"Chinese regulator to fine 6 baby formula companies total of CNY670M ($109.5M) over price fixing - Xinhua, without citing sources","1112-HK,ABT-US,BN...","SA"," 8:43pm","6-Aug-13"
"ABBOTT LABORATORIES files (10-Q) Basic quarterly filing, for period end 30-Jun-13 (ABT-US)","ABT-US,ABT","EDG"," 9:34am","6-Aug-13"
"ABBOTT LABORATORIES: 10-Q FactSet Blackline Report for period ending 6/30/2013","ABT-US","FBLK"," 9:34am","6-Aug-13"
"FTC grants anti-trust clearance for Abbott Labs' acquisition of OptiMedica Corp","ABT-US","SA"," 5:54am","5-Aug-13"
"Abbott's announces data suggesting Troponin test may help doctors predict heart attack risk","ABT-US","SA"," 6:06am","30-Jul-13"
"New Data for Abbott's Investigational High Sensitive Troponin Test Shows It May Help Doctors Predict Heart Attack Risk","06Y31D-E,ABT-US","PRN"," 6:00am","30-Jul-13"
"Foundation Medicine files $86.3M IPO through Goldman and JPMorgan","09NWNQ-E,SQNM-US,...","SA"," 2:46pm","29-Jul-13"
"Abbott Features Solutions to Help Labs Prepare for the Evolving Healthcare Landscape at the American Association for Clinical Chemistry Lab Expo","ABT-US","PRN"," 6:00am","29-Jul-13"
"DJ Abbott Laboratories Statements of Changes in Beneficial Ownership","ABT-US,ABT","DJRN"," 9:41am","26-Jul-13"
"Abbott Labs receives FDA clearance for FreeStyle Precision Pro Blood Glucose and Beta-Ketone Monitoring System","ABT-US","SA"," 6:32am","25-Jul-13"
"Abbott Receives FDA Clearance for FreeStyle Precision Pro Blood Glucose and Beta-Ketone Monitoring System™","ABT-US","PRN"," 6:30am","25-Jul-13"
"EVP ALLEN Sells 146 of ABBOTT LABORATORIES (ABT)","ABT-US,ABT","EDG"," 2:33pm","24-Jul-13"
"Analyst's Notes >> ABBOTT LABORATORIES (Argus Research) 4 pages","ABT-US,BN-FR,BMY-...","FRC"," 6:53am","19-Jul-13"
"MARKET DIGEST >> FRIDAY, JULY 19, 2013 (Argus Research) 26 pages","COP-US,KMP-US,KMI...","FRC"," 6:49am","19-Jul-13"
"CALLSTREET REPORT: Abbott Laboratories(ABT-US), Q2 2013 Earnings Call, 17-July-2013 9:00 AM ET","ABT-US","FCST","12:16pm","17-Jul-13"
"Early Street Takeaways - ABT Q2 Earnings","ABT-US","SA"," 6:41am","17-Jul-13"
"ABBOTT LABORATORIES files (8-K) Current report: Items 2.02 - Results of Operations, 9.01 - Financial Statements and Exhibits, for period end 17-Jul-13 (ABT-US)","ABT-US,ABT","EDG"," 5:35am","17-Jul-13"
"(RNS)  Abbott Laboratories  ABT 2nd Quarter Earnings Results","ABT-US,US002824100","FECA"," 4:56am","17-Jul-13"
"DJ Abbott Laboratories ABT 2nd Quarter Earnings Results","ABT-US,ABT","DJRN"," 4:56am","17-Jul-13"
"DJ Abbott Laboratories ABT 2nd Quarter Earnings -2-","ABT-US,ABT","DJRN"," 4:56am","17-Jul-13"
"StreetAccount Metrics Recap - ABT Q2 Earnings","ABT-US","SA"," 4:47am","17-Jul-13"
"Abbott Labs reports Q2 EPS $0.46 vs FactSet $0.44","ABT-US","SA"," 4:46am","17-Jul-13"
"Abbott Reports Second-Quarter 2013 Results","ABT-US","PRN"," 4:44am","17-Jul-13"
"Abbott Laboratories agreed to acquire Vistatek Produtos Óticos SA","ABT-US,0BQGDL-E","FFW"," 4:00am","17-Jul-13"
"StreetAccount Consensus Metrics Preview - ABT Q2 Earnings","ABT-US","SA"," 1:34pm","15-Jul-13"
"Impax Laboratories launches generic TRILIPIX (ABT) delayed release capsules, 45 mg and 135 mg","IPXL-US,ABT-US","SA"," 1:10pm","15-Jul-13"
"RiverVest Venture Partners' Medical Device Portfolio Company Sold to Abbott Laboratories for $310 million","05YTGT-E,006Z7Y-E...","BW","12:00pm","15-Jul-13"
"Follow-up: Abbott Laboratories agrees to acquire OptiMedica (private) for $250M, plus additional payments of up to $150M","ABT-US","SA"," 8:01am","15-Jul-13"
"Abbott Laboratories agrees to acquire OptiMedica (private) for $250M, plus additional payments of up to $150M","ABT-US","SA"," 7:59am","15-Jul-13"
"(RNS)  Abbott Laboratories  ABT to Enter Laser Cataract Surgery Market","007999-E,05KPD6-E...","FECA"," 7:58am","15-Jul-13"
"DJ Abbott Laboratories ABT to Enter Laser Cataract Surgery Market","ABT-US,ABT","DJRN"," 7:58am","15-Jul-13"
"(RNS)  Abbott Laboratories  ABT to Acquire IDEV Technologies","006Z7Y-E,ABT-US,U...","FECA"," 7:50am","15-Jul-13"
"DJ Abbott Laboratories ABT to Acquire IDEV Technologies","ABT-US,ABT","DJRN"," 7:50am","15-Jul-13"
"Abbott Laboratories agreed to acquire OptiMedica Corp","ABT-US,007999-E","FFW"," 7:35am","15-Jul-13"
"Abbott Laboratories agreed to acquire IDEV Technologies Inc","ABT-US,006Z7Y-E","FFW"," 7:15am","15-Jul-13"
"Abbott to acquire IDEV Technologies (private) for $310M in cash and debt","ABT-US","SA"," 5:32am","15-Jul-13"
"Abbott to Acquire IDEV Technologies to Expand Global Peripheral Technology Portfolio","ABT-US","PRN"," 5:30am","15-Jul-13"
"Abbott to Enter Laser Cataract Surgery Market through Acquisition of OptiMedica","ABT-US","PRN"," 5:30am","15-Jul-13"
"Abbott announces approval of XIENCE Xpedition drug eluting stent system in Japan","ABT-US","SA"," 6:31am","10-Jul-13"
"Abbott Announces Approval of Next-Generation XIENCE Xpedition™ Drug Eluting Stent System in Japan","ABT-US","PRN"," 6:30am","10-Jul-13"
"Ownership Updates: ABBOTT LABS  COM (ABT) for  7-Jul-2013","00282410","FIO"," 9:10am","7-Jul-13"
"Ownership Updates: ABBOTT LABS  COM (ABT) for  6-Jul-2013","00282410","FIO"," 1:40am","6-Jul-13"
"SVP PAVEE Updates Ownership of ABBOTT LABORATORIES (ABT)","ABT-US,ABT","EDG"," 2:47pm","3-Jul-13"
"SVP DEVOS Updates Ownership of ABBOTT LABORATORIES (ABT)","ABT-US,ABT","EDG"," 2:47pm","3-Jul-13"
"Dir TILTON Updates Ownership of ABBOTT LABORATORIES (ABT)","ABT-US,ABT","EDG"," 2:59pm","2-Jul-13"
"Dir OSBORN Updates Ownership of ABBOTT LABORATORIES (ABT)","ABT-US,ABT","EDG"," 2:58pm","2-Jul-13"
"Dir ALPERN Updates Ownership of ABBOTT LABORATORIES (ABT)","ABT-US,ABT","EDG"," 2:58pm","2-Jul-13"
"Dir LIDDY Updates Ownership of ABBOTT LABORATORIES (ABT)","ABT-US,ABT","EDG"," 2:58pm","2-Jul-13"
"EVP ALLEN Disposes 324 of ABBOTT LABORATORIES (ABT)","ABT-US,ABT","EDG"," 2:57pm","2-Jul-13"
"SVP DEVOS -Initial Statement of Ownership of ABBOTT LABORATORIES (ABT)","ABT-US,ABT","EDG"," 2:49pm","2-Jul-13"
"SVP PAVEE -Initial Statement of Ownership of ABBOTT LABORATORIES (ABT)","ABT-US,ABT","EDG"," 2:49pm","2-Jul-13"
"Mead Johnson Nutrition issues statement on China's antitrust probe into baby milk formula companies","MJN-US,ABT-US,BN-...","SA"," 9:42am","2-Jul-13"
"China opens antitrust probe into foreign baby milk formula companies - Beijing Times","ABT-US,BN-FR,MJN-...","SA"," 2:17am","2-Jul-13"
"Abbott Labs initiated outperform at Cowen","ABT-US","SA"," 5:28am","1-Jul-13"
"Abbott Laboratories (ABT-US), Abbott Laboratories Pakistan Ltd. (ABOT-PK) - Preliminary Interim Report for the Period Ending 30-Jun-2013 (English)","ABT-US,ABOT-PK","FFR"," 9:00pm","29-Jun-13"
"Abbott Laboratories(ABT-US) Schedules Q2 2013 Earnings Release for 17-July-2013 Before Market Open ET","ABT-US","FCST"," 5:40am","28-Jun-13"
"Abbott Laboratories(ABT-US) Schedules Q2 2013 Earnings Call for 17-July-2013 9:00 AM ET","ABT-US","FCST"," 5:40am","28-Jun-13"
"(RNS)  Abbott Laboratories  Announcement of 2Q Earnings Conf Call","05KPD6-E,ABT-US,U...","FECA"," 5:30am","28-Jun-13"
"DJ Abbott Laboratories Announcement of 2Q Earnings Conf Call","ABT-US,ABT","DJRN"," 5:30am","28-Jun-13"
"Abbott Hosts Conference Call for Second-Quarter Earnings","ABT-US","PRN"," 5:30am","28-Jun-13"
"EU's CHMP adopted a positive opinion recommending the granting of a marketing authorisation for Cholib","ABT-US","SA"," 4:30am","28-Jun-13"
"Appeals Court rules against Johnson & Johnson and Pfizer in drug-eluting stent patent case, affirming district court ruling","JNJ-US,ABT-US,BSX...","SA"," 8:07am","26-Jun-13"
"Scan Added:  ABBOTT LABORATORIES files (11-K) Annual report for ESOPs, for period end 31-Dec-12 (ABT-US)","ABT-US,ABT","EDG"," 1:59pm","25-Jun-13"
"Abbott Announces New Test to Help Doctors Determine Personalized Treatment Path for Patients with Hepatitis C","ABT-US","PRN"," 9:01am","20-Jun-13"
"FDA approves Abbott Labs' RealTime HCV Genotype II","ABT-US","SA"," 8:48am","20-Jun-13"
"FactSet Buyback Quarterly (FactSet Research Desk) 12 pages","IBM-US,CAT-US,V-U...","FRC","12:46pm","19-Jun-13"
"CORRECTED TRANSCRIPT: Abbott Laboratories(ABT-US), Wells Fargo Health Care Conference, 19-June-2013 10:05 AM ET","ABT-US","FCST","11:30am","19-Jun-13"
