"Market Alert: UDTT Is on the Move!","91345920,ABT,NOC,...","MW"," 6:48am","23-Apr-08"
"SectorWatch.biz Issues MarketStats on KBLB, DGX, LH, BRLI, and ABT","ABT,BRLI,DGX,KBLB...","PRN"," 6:00am","23-Apr-08"
"Abbott Labs notes Xience V study published in JAMA","ABT-US,ANPI,BSX-US","SA"," 1:02pm","22-Apr-08"
"Study in JAMA Shows Patients Treated With Abbott's XIENCE(TM) V Drug Eluting Stent Experience Better Outcomes Than Patients Treated With Market-Leading Drug Eluting Stent","ABT","PRN"," 1:00pm","22-Apr-08"
"Abbott Laboratories(ABT) Schedules Morgan Stanley Global Healthcare Unplugged Conference for 30-April-2008 8:30 AM ET","ABT-US","FCST"," 9:01am","22-Apr-08"
"Abbott to Present at Morgan Stanley Global Healthcare Unplugged Conference","ABT","PRN"," 8:51am","22-Apr-08"
"Smiths Medical to Promote and Distribute Abbott's FreeStyle Navigator Continuous Glucose Monitoring System","ABT","PRN"," 5:46am","22-Apr-08"
"Seattle Genetics discloses amendment to development and supply agreement with Abbott (ABT)","ABT-US,SGEN-US","SA"," 1:43pm","18-Apr-08"
"DexCom shares continue to trade near the high of the day on better than average volume","ABT-US,DXCM-US,MD...","SA","10:49am","18-Apr-08"
"SVP PATTON JR Disposes 1,741 of ABBOTT LABORATORIES (ABT)","ABT-US,ABT","EDG"," 8:58am","18-Apr-08"
"Hot Stock to Watch - MIHS! April 18, 2008","29413P10,ABT,ENTK...","MW"," 5:35am","18-Apr-08"
"CALLSTREET REPORT: Abbott Laboratories(ABT-US), Q1 2008 Earnings Call, 16-April-2008 9:00 AM ET","ABT-US","FCST"," 4:29pm","16-Apr-08"
"ABBOTT LABORATORIES files (8-K) Current report: Items 2.02 - Results of Operations, 9.01 - Financial Statements and Exhibits, for period end 16-Apr-08 (ABT-US)","ABT-US,ABT","EDG"," 6:00am","16-Apr-08"
"DJ Abbott Laboratories 1st Quarter Results","ABT,US0028241000","DJRN"," 5:08am","16-Apr-08"
"Follow up: Abbott Labs guides Q2 EPS $0.78-0.80 vs Reuters $0.79","ABT-US","SA"," 4:47am","16-Apr-08"
"Abbott Labs reports Q1 EPS $0.63 ex-items vs Reuters $0.62","ABT-US","SA"," 4:42am","16-Apr-08"
"Abbott Reports Double-Digit Sales and Earnings Growth in First Quarter and Reaffirms Full-Year Growth Outlook","ABT","PRN"," 4:42am","16-Apr-08"
"Abbott Labs issues press release on previously reported approval for Humira (adalimumab) in Japan","4523-JP,ABT-US","SA"," 4:26am","16-Apr-08"
"Abbott Announces HUMIRA(R) (adalimumab) Approved in Japan for the Treatment of Rheumatoid Arthritis","ABT","PRN"," 4:24am","16-Apr-08"
"Eisai Company, Abbott Japan win approval to sell Humira in Japan - Bloomberg","4523-JP,ABT-US","SA","10:08pm","15-Apr-08"
"Consensus drug sales estimates for Abbott Labs","ABT-US","SA"," 1:24pm","15-Apr-08"
"Wall Street News Alert: Breaking News Alert - BPYT! April 15, 2008","ABT,BAX,BPYT,LLY","MW"," 6:38am","15-Apr-08"
"Innovative Diagnostic Instrument Introduced by Abbott for Low- to Mid-Volume Laboratory Market Segment","ABT","PRN"," 6:17am","15-Apr-08"
"SkyePharma announces positive results of Flutiform Paediatric study","ABT-US,SKP-GB","SA","11:36pm","14-Apr-08"
"Abbott Labs denied dismissal of suit brought by GlaxoSmithKline (GSK) - Bloomberg","ABT-US,GSK-GB","SA","11:49am","14-Apr-08"
"Innogenetics receives $9.5M from Abbott (ABT) as part of settlement resolving genotyping lawsuit--Bloomberg","ABT-US,INNX.BB","SA"," 9:02am","14-Apr-08"
"Seven Summits Research Releases Comments on IBM, ABT, CAT, DD and TXT","ABT,CAT,DD,IBM,TXT","PRN"," 6:31am","14-Apr-08"
"Abbott FreeStyle Freedom(R) Lite Blood Glucose Monitoring System Now Available With No Coding for People With Diabetes","ABT","PRN"," 6:03am","14-Apr-08"
"New Analyst Reports Scheduled for ABSOLUTE SOFTWARE CORPORATION, SHAW COMMUNICATIONS INC, and GLOBESTAR MINING CORP","ABT,GMI,SJR.B","MW","11:07am","11-Apr-08"
"Follow-up: Abbott Labs no lung cancer signals in inhaled-insulin trials - Dow Jones","ABT-US,MNKD-US,NK...","SA","10:00am","10-Apr-08"
"Abbott Labs: no lung cancer signals in inhaled-insulin trials-- Dow Jones","ABT-US","SA"," 9:33am","10-Apr-08"
"DJ Abbott Laboratories Doc re. Forms 4, Proxy, 8-K","ABT,US0028241000","DJRN","11:00pm","9-Apr-08"
"FDA reports new pediatric exclusivity extensions","ABT-US,GSK-GB,MRK...","SA","12:25pm","9-Apr-08"
"Follow-up: Bristol-Myers says FDA approves Orencia for Juvenile Idiopathic Arthritis (JIA)","ABT-US,BMY-US,RGE...","SA","12:22pm","8-Apr-08"
"New Abbott Kaletra(R) (lopinavir/ritonavir) Lower-Strength Tablet for Pediatric Use Approved in Europe","ABT","PRNE","11:00pm","6-Apr-08"
"La Fédération internationale de chimie clinique conclut un partenariat avec l'initiative Labs Are Vital(TM)","ABT","PRNE"," 2:30pm","4-Apr-08"
"Internationale Vereinigung für Klinische Chemie schliesst sich der "Labs Are Vital(TM)"-Initiative an","ABT","PRNE"," 8:53am","4-Apr-08"
"La International Federation of Clinical Chemistry crea una asociación con la iniciativa Labs Are Vital(TM)","ABT","PRNE"," 7:22am","4-Apr-08"
"International Federation of Clinical Chemistry Forms Partnership With the Labs Are Vital(TM) Initiative","ABT","PRN"," 3:56am","4-Apr-08"
"Dir REYNOLDS Sells 5,124 of ABBOTT LABORATORIES (ABT)","ABT-US,ABT","EDG"," 3:30pm","2-Apr-08"
"Dir SCOTT III Updates Ownership of ABBOTT LABORATORIES (ABT)","ABT-US,ABT","EDG"," 3:30pm","2-Apr-08"
"Dir TILTON Updates Ownership of ABBOTT LABORATORIES (ABT)","ABT-US,ABT","EDG"," 3:30pm","2-Apr-08"
"Dir SMITHBURG Updates Ownership of ABBOTT LABORATORIES (ABT)","ABT-US,ABT","EDG"," 3:30pm","2-Apr-08"
"Dir POWELL JR Updates Ownership of ABBOTT LABORATORIES (ABT)","ABT-US,ABT","EDG"," 3:29pm","2-Apr-08"
"Dir OSBORN Updates Ownership of ABBOTT LABORATORIES (ABT)","ABT-US,ABT","EDG"," 3:29pm","2-Apr-08"
"Dir FULLER Updates Ownership of ABBOTT LABORATORIES (ABT)","ABT-US,ABT","EDG"," 3:29pm","2-Apr-08"
"Dir DALEY Updates Ownership of ABBOTT LABORATORIES (ABT)","ABT-US,ABT","EDG"," 3:29pm","2-Apr-08"
"Abbott Laboratories(ABT-US) Schedules Q1 2008 Earnings Release for 16-April-2008 Before Market Open ET","ABT-US","FCST"," 8:41am","1-Apr-08"
"Abbott Laboratories(ABT-US) Schedules Q1 2008 Earnings Call for 16-April-2008 9:00 AM ET","ABT-US","FCST"," 8:41am","1-Apr-08"
"Abbott Hosts Conference Call for First-Quarter Earnings","ABT","PRN"," 8:28am","1-Apr-08"
"ImaRx Therapeutics Reports Business Update and Financial Results for Fourth Quarter and Full Year 2007","ABT,MBX","PRN"," 1:41pm","31-Mar-08"
"Teva Pharmaceutical provides update on generic prevacid litigation","4502-JP,ABT-US,TE...","SA","12:24pm","31-Mar-08"
"Merck reports extended-release Niacin/Laropiprant (cordaptive) caused less flushing than patients treated with Niaspan in phase III study","ABT-US,BRL,MRK-US","SA"," 8:07am","31-Mar-08"
"Abbott Labs phase III study of investigational TriLipix(ABT-335) meets primary endpoints","ABT-US,SOLB-BE","SA"," 8:05am","31-Mar-08"
"Abbott's Phase III Studies of Investigational TriLipix(TM) (ABT-335), in Combination With Statins, Meets Primary Endpoints on Improving LDL, Triglycerides and HDL","ABT","PRN"," 8:01am","31-Mar-08"
"Seven Summits Research Releases Comments on NOK, SNDK, ABT, MU, and AAP","AAP,ABT,MU,NOK,SNDK","PRN"," 7:54am","31-Mar-08"
"Abbott Labs announces presentation of data from SPIRIT II trial of Xience V","ABT-US,BSX-US","SA"," 6:07am","31-Mar-08"
"Stents similar to bypass surgery for key artery - Dow Jones","ABT-US,BSX-US,JNJ...","SA"," 6:04am","31-Mar-08"
"Abbott's XIENCE(TM) V Drug Eluting Stent Demonstrates Consistent and Positive Clinical Outcomes Out to Two Years","ABT","PRN"," 6:00am","31-Mar-08"
"Abbott Laboratories (ABT-US) - Interim Report for the Period Ending 31-Mar-2008 (English)","ABT-US","FFR"," 9:00pm","30-Mar-08"
"Dir OWEN Sells 12,624 of ABBOTT LABORATORIES (ABT)","ABT-US,ABT","EDG"," 3:26pm","28-Mar-08"
"SVP BOHUON Acquires 7,712 of ABBOTT LABORATORIES (ABT)","ABT-US,ABT","EDG"," 2:00pm","28-Mar-08"
"SVP HANCE Sells 10,321 of ABBOTT LABORATORIES (ABT)","ABT-US,ABT","EDG"," 1:48pm","26-Mar-08"
"EVP SCHUMACHER Acquires 2,211 of ABBOTT LABORATORIES (ABT)","ABT-US,ABT","EDG"," 1:48pm","26-Mar-08"
"Abbott Labs' Depakote wins US approval for pediatric use-- Bloomberg","ABT-US,SAN-FR","SA","12:44pm","26-Mar-08"
"Shire and TAP Pharmaceutical agree to co-promote Lialda","4502-JP,ABT-US,SH...","SA","10:03am","26-Mar-08"
"ABBOTT LABORATORIES files (8-K) Current report: Item 1.01 - Entry into Definitive Agreement, for period end 19-Mar-08 (ABT-US)","ABT-US,ABT","EDG"," 2:11pm","24-Mar-08"
"EVP LIEPMANN Acquires 11,853 of ABBOTT LABORATORIES (ABT)","ABT-US,ABT","EDG"," 1:41pm","21-Mar-08"
"SVP HANCE Sells 1,157 of ABBOTT LABORATORIES (ABT)","ABT-US,ABT","EDG"," 8:53am","21-Mar-08"
"Zogenix files $86.25M IPO through BofA","ABT-US,ALO,ENDP-U...","SA"," 2:34pm","20-Mar-08"
"Scan Added:  ABBOTT LABORATORIES files (ARS) Annual report to security holders (paper filing), for period end 31-Dec-07 (ABT-US)","ABT-US,ABT","EDG"," 1:54pm","20-Mar-08"
"Great Plains Energy (GXP) downgraded and Abbott Labs (ABT) upgraded at Wachovia, we're told","ABT-US,GXP-US","SA"," 4:36am","20-Mar-08"
"ABBOTT LABORATORIES files (DEF 14A) Definitive proxy statements, for period end 25-Apr-08 (ABT-US)","ABT-US,ABT","EDG"," 1:52pm","19-Mar-08"
"Follow-up: Takeda Pharmaceutical and Abbott Labs to conclude TAP Pharma JV","4502-JP,ABT-US","SA"," 1:16pm","19-Mar-08"
"Takeda Pharmaceutical and Abbott Labs to conclude TAP Pharma JV","4502-JP,ABT-US","SA"," 1:13pm","19-Mar-08"
"Takeda, Abbott Announce Plans to Conclude TAP Joint Venture","ABT","PRN"," 1:09pm","19-Mar-08"
"ABBOTT LABORATORIES - ANNUAL report for 2007 (ENGLISH).","ABT-US","FFR","11:57am","19-Mar-08"
"Aggressive Stock Alert: ERUC! March 19, 2008","ABT,ERUC,GFIG,HUM","MW"," 6:35am","19-Mar-08"
"Axis-Shield says it has received FDA approval for its HbA1c test","ABT-US","SA","12:48am","19-Mar-08"
"Takeda Pharmaceutical in talks to acquire ABT's stake in the TAP Pharma JV - Nikkei","4502-JP,ABT-US","SA"," 2:15pm","18-Mar-08"
"CORRECTED TRANSCRIPT: Abbott Laboratories(ABT-US), Lehman Brothers Global Healthcare Conference, 18-March-2008 9:30 AM ET","ABT-US","FCST","11:01am","18-Mar-08"
"Abbott Labs sued by 19 states for blocking generic Tricor-- Bloomberg","ABT-US,SOLB-BE","SA","10:00am","18-Mar-08"
"Dir SMITHBURG Acquires 1,498 of ABBOTT LABORATORIES (ABT)","ABT-US,ABT","EDG"," 5:06pm","17-Mar-08"
"Scan Added:  ABBOTT LABORATORIES files (REGDEX) Reg D exemption notice of sales of securities (ABT-US)","ABT-US,ABT","EDG"," 2:39pm","17-Mar-08"
"CORRECTED TRANSCRIPT: Abbott Laboratories(ABT-US), Cowen & Co. Health Care Conference, 17-March-2008 11:30 AM ET","ABT-US","FCST","12:59pm","17-Mar-08"
"Abbott Labs announces publication of study in The Lancet","ABT-US","SA"," 3:03pm","13-Mar-08"
"The Lancet Publishes Results From World's First Clinical Trial of a Fully Bioabsorbable Drug Eluting Coronary Stent","ABT","PRN"," 3:00pm","13-Mar-08"
"Abbott Labs announces two-year Humira data for Crohn's disease","ABT-US","SA"," 4:08am","13-Mar-08"
"Abbott Labs receives FDA approval for glucose monitoring system","ABT-US","SA"," 4:06am","13-Mar-08"
"FDA Approves Abbott's FreeStyle Navigator(R) Continuous Glucose Monitoring System","ABT","PRN"," 4:04am","13-Mar-08"
"Abbott's HUMIRA(R) (adalimumab) Shows Long-Term Improvement In Fistula Response and Healing Rates In Difficult-to-Treat Patients With Crohn's Disease","ABT-US,ABT","PRNE"," 2:15am","13-Mar-08"
"FDA approval of Simcor triggers $100M milestone payment to Abbott from Solvay (SOLB.BB)","ABT-US,SOLB-BE","SA","12:40am","12-Mar-08"
"FDA issues alert on UCB's Tussionex cough medicine","ABT-US,ENDP-US,UC...","SA","10:17am","11-Mar-08"
"Abbott reçoit le marquage CE pour l'endoprothèse vasculaire active XIENCE(TM) V plus petite","ABT","PRNE"," 8:27am","11-Mar-08"
"Abbott recibe la Marca CE para el stent liberador de fármacos de pequeño tamaño XIENCE(TM) V","ABT","PRNE"," 5:07am","11-Mar-08"
"Abbott erhält CE-Kennzeichnung für kleineren medikamentenbeschichteten XIENCE(TM)-V-Stent","ABT","PRNE"," 4:42am","11-Mar-08"
"Abbott Labs receives CE Mark approval for a 2.25 mm version of its XIENCE V Everolimus stent system (2 ET)","ABT-US","SA"," 2:20am","11-Mar-08"
"Abbott Receives CE Mark for Smaller-Size XIENCE(TM) V Drug Eluting Stent","ABT","PRN","11:00pm","10-Mar-08"
"Major pharmaceutical sector downgraded to market weight from overweight at Credit Suisse","ABT-US,BMY-US,JNJ...","SA"," 6:26am","10-Mar-08"
"Hagens Berman: Eleven Defendants Settle in Average Wholesale Price Litigation","ABT,ACT,G0083B10","PRN"," 3:29pm","7-Mar-08"
"FDA to issue alert on prescription cough medication -- WSJ","ABT-US,ENDP-US,UC...","SA","12:32pm","7-Mar-08"
"Abbott Laboratories(ABT-US) Schedules Lehman Brothers Global Healthcare Conference for 18-March-2008 9:30 AM ET","ABT-US","FCST"," 6:29am","7-Mar-08"
"Abbott to collaborate with Genentech (DNA), Roche (ROG.VX), OSI (OSIP) on molecular test for lung cancer","ABT-US,DNA,OSIP,R...","SA"," 6:05am","7-Mar-08"
"Abbott to Collaborate With Genentech, Roche and OSI on Molecular Test for Lung Cancer Therapy Response","ABT","PRN"," 6:03am","7-Mar-08"
"Abbott Laboratories(ABT-US) Schedules Cowen & Co. Health Care Conference for 17-March-2008 11:30 AM ET","ABT-US","FCST"," 5:41am","7-Mar-08"
"Abbott to Present at Lehman Brothers Healthcare Conference","ABT","PRN"," 5:35am","7-Mar-08"
"Abbott to Present at Cowen and Company Health Care Conference","ABT","PRN"," 5:30am","7-Mar-08"
"DJ Abbott Laboratories Doc re. Forms 4","ABT,US0028241000","DJRN","11:00pm","6-Mar-08"
"SVP HANCE Sells 1,217 of ABBOTT LABORATORIES (ABT)","ABT-US,ABT","EDG"," 4:26pm","6-Mar-08"
"EVP TYREE Sells 10,096 of ABBOTT LABORATORIES (ABT)","ABT-US,ABT","EDG"," 2:36pm","6-Mar-08"
"SVP LANDGRAF Acquires 486 of ABBOTT LABORATORIES (ABT)","ABT-US,ABT","EDG"," 3:27pm","5-Mar-08"
"SVP PATTON JR Acquires 327 of ABBOTT LABORATORIES (ABT)","ABT-US,ABT","EDG"," 3:26pm","5-Mar-08"
"SVP SZELA Sells 334 of ABBOTT LABORATORIES (ABT)","ABT-US,ABT","EDG"," 5:16pm","4-Mar-08"
"SVP HANCE Disposes 2,402 of ABBOTT LABORATORIES (ABT)","ABT-US,ABT","EDG"," 5:15pm","4-Mar-08"
"SVP LANDGRAF Disposes 2,683 of ABBOTT LABORATORIES (ABT)","ABT-US,ABT","EDG"," 5:15pm","4-Mar-08"
"VP LINDER Sells 334 of ABBOTT LABORATORIES (ABT)","ABT-US,ABT","EDG"," 5:15pm","4-Mar-08"
"SVP PATTON JR Sells 294 of ABBOTT LABORATORIES (ABT)","ABT-US,ABT","EDG"," 5:13pm","4-Mar-08"
"EVP TYREE Sells 14,638 of ABBOTT LABORATORIES (ABT)","ABT-US,ABT","EDG"," 5:12pm","4-Mar-08"
"CEO WHITE Disposes 18,411 of ABBOTT LABORATORIES (ABT)","ABT-US,ABT","EDG"," 5:12pm","4-Mar-08"
"EVP SCHUMACHER Disposes 3,630 of ABBOTT LABORATORIES (ABT)","ABT-US,ABT","EDG"," 5:12pm","4-Mar-08"
"EVP MICHAEL Disposes 2,683 of ABBOTT LABORATORIES (ABT)","ABT-US,ABT","EDG"," 5:10pm","4-Mar-08"
"EVP LIEPMANN Disposes 3,630 of ABBOTT LABORATORIES (ABT)","ABT-US,ABT","EDG"," 5:10pm","4-Mar-08"
"SVP FUSSELL Disposes 2,938 of ABBOTT LABORATORIES (ABT)","ABT-US,ABT","EDG"," 5:10pm","4-Mar-08"
"EVP FREYMAN Disposes 3,630 of ABBOTT LABORATORIES (ABT)","ABT-US,ABT","EDG"," 5:10pm","4-Mar-08"
"SVP CHEN Disposes 2,683 of ABBOTT LABORATORIES (ABT)","ABT-US,ABT","EDG"," 5:08pm","4-Mar-08"
"EVP CAPEK Disposes 2,431 of ABBOTT LABORATORIES (ABT)","ABT-US,ABT","EDG"," 5:08pm","4-Mar-08"
"SVP BOHUON Acquires 6,800 of ABBOTT LABORATORIES (ABT)","ABT-US,ABT","EDG"," 5:07pm","4-Mar-08"
"EVP ASHLEY Disposes 7,259 of ABBOTT LABORATORIES (ABT)","ABT-US,ABT","EDG"," 5:07pm","4-Mar-08"
"NY Times says the drug companies may be worth a look","ABT-US,BIIB-US,GI...","SA","12:18pm","1-Mar-08"
"Luminex and Abbott (ABT) sign agreement for global distribution of the xTAG resporatory viral panel","ABT-US,LMNX-US","SA"," 2:17pm","28-Feb-08"
"Church & Dwight awarded $14.6M in patent infringement verdict against Abbot Labs (ABT)","ABT-US,CHD-US","SA"," 9:34am","28-Feb-08"
"Scan Added:  ABBOTT LABORATORIES files (NO ACT) Postponement or waiver  of enforcement action, for period end 27-Dec-07 (ABT-US)","ABT-US,ABT","EDG"," 5:01am","28-Feb-08"
"EVP TYREE Acquires 1,912 of ABBOTT LABORATORIES (ABT)","ABT-US,ABT","EDG"," 2:16pm","27-Feb-08"
"Abbott (ABT), Genentech (DNA), WEHI enter research collaboration","ABT-US,DNA","SA"," 5:06am","27-Feb-08"
"Bernstein says monetization of Teva Pharmaceutical's Prevacid challenge is unlikely","4502-JP,ABT-US,TE...","SA"," 4:16am","27-Feb-08"
"SVP FUSSELL Acquires 447 of ABBOTT LABORATORIES (ABT)","ABT-US,ABT","EDG"," 1:12pm","26-Feb-08"
"Labs are Vital(TM) Program Targets Science-Minded Students Through Facebook Social Media Network","ABT","PRN"," 6:03am","25-Feb-08"
"Abbott Labs issues press release regarding previously reported FDA approval for supplemental Humira indication","ABT-US","SA"," 6:58am","22-Feb-08"
"Abbott Receives FDA Approval for HUMIRA(R) (Adalimumab) for Polyarticular Juvenile Idiopathic Arthritis","ABT","PRN"," 6:56am","22-Feb-08"
"FDA approves supplemental indication for Abbott Labs' Humira","ABT-US,DNA","SA"," 8:34pm","21-Feb-08"
"DJ Abbott Laboratories Doc re. Forms 4 & Form 10-K","ABT,US0028241000","DJRN","11:00pm","20-Feb-08"
"SVP SZELA Sells 591 of ABBOTT LABORATORIES (ABT)","ABT-US,ABT","EDG"," 3:31pm","20-Feb-08"
"SVP PATTON JR Sells 554 of ABBOTT LABORATORIES (ABT)","ABT-US,ABT","EDG"," 3:31pm","20-Feb-08"
"SVP HANCE Sells 818 of ABBOTT LABORATORIES (ABT)","ABT-US,ABT","EDG"," 3:31pm","20-Feb-08"
"SVP LANDGRAF Acquires 15,912 of ABBOTT LABORATORIES (ABT)","ABT-US,ABT","EDG"," 3:30pm","20-Feb-08"
"VP LINDER Sells 591 of ABBOTT LABORATORIES (ABT)","ABT-US,ABT","EDG"," 3:30pm","20-Feb-08"
"SVP BOHUON Acquires 4,166 of ABBOTT LABORATORIES (ABT)","ABT-US,ABT","EDG"," 3:30pm","20-Feb-08"
"EVP CAPEK Acquires 23,000 of ABBOTT LABORATORIES (ABT)","ABT-US,ABT","EDG"," 3:29pm","20-Feb-08"
"EVP FREYMAN Acquires 26,416 of ABBOTT LABORATORIES (ABT)","ABT-US,ABT","EDG"," 3:29pm","20-Feb-08"
"EVP TYREE Sells 884 of ABBOTT LABORATORIES (ABT)","ABT-US,ABT","EDG"," 3:28pm","20-Feb-08"
"EVP MICHAEL Sells 818 of ABBOTT LABORATORIES (ABT)","ABT-US,ABT","EDG"," 3:28pm","20-Feb-08"
"CEO WHITE Acquires 108,331 of ABBOTT LABORATORIES (ABT)","ABT-US,ABT","EDG"," 3:28pm","20-Feb-08"
"EVP LIEPMANN Sells 884 of ABBOTT LABORATORIES (ABT)","ABT-US,ABT","EDG"," 3:27pm","20-Feb-08"
"Officer ASHLEY Sells 1,834 of ABBOTT LABORATORIES (ABT)","ABT-US,ABT","EDG"," 3:27pm","20-Feb-08"
"EVP SCHUMACHER Acquires 22,792 of ABBOTT LABORATORIES (ABT)","ABT-US,ABT","EDG"," 3:26pm","20-Feb-08"
"SVP FUSSELL Sells 884 of ABBOTT LABORATORIES (ABT)","ABT-US,ABT","EDG"," 3:26pm","20-Feb-08"
"SVP CHEN Acquires 17,892 of ABBOTT LABORATORIES (ABT)","ABT-US,ABT","EDG"," 3:26pm","20-Feb-08"
"Supreme Court affirms Appellate Court ruling in favor of Medtronic (reported on the wires earlier)","ABT-US,ANPI,BSX-U...","SA"," 8:01am","20-Feb-08"
"ABBOTT LABORATORIES files (10-K) Basic annual filing, for period end 31-Dec-07 (ABT-US)","ABT-US,ABT","EDG"," 2:08pm","19-Feb-08"
"ABBOTT LABORATORIES: 10-K FactSet Blackline Report for period ending @NA","ABT-US","FBLK"," 6:37am","19-Feb-08"
"Abbott Receives FDA Approval for SIMCOR(R) (Niaspan(R) / simvastatin), a Novel Combination Medicine for Comprehensive Cholesterol Management","ABT","PRN"," 1:55pm","15-Feb-08"
"Abbott Labs receives FDA approval for Simcor - Dow Jones","ABT-US,SOLB-BE","SA"," 1:41pm","15-Feb-08"
"Abbott Labs increases quarterly dividend by 10.8% to $0.36 from $0.325","ABT-US","SA"," 7:03am","15-Feb-08"
"Abbott Announces 10.8 Percent Increase in Quarterly Dividend","ABT","PRN"," 7:02am","15-Feb-08"
"SVP FUSSELL Acquires 5,178 of ABBOTT LABORATORIES (ABT)","ABT-US,ABT","EDG"," 9:32am","14-Feb-08"
"Wall Street News Alert: Aggressive Stock Alert: ELHI! February 14, 2008","68231X10,ABT,GILD...","MW"," 6:33am","14-Feb-08"
"On Valentine's Day, Abbott Urges Women to Take Heart With Launch of 'Faces of Heart Disease' Exhibit to Raise Heart Health Awareness","ABT","PRN"," 9:51am","13-Feb-08"
"ABBOTT LABORATORIES files (SC 13G/A) Acquisition of beneficial ownership of 5% or more (Amended) (ABT-US)","ABT-US,ABT","EDG"," 8:28am","13-Feb-08"
"SVP FUSSELL Sells 11,156 of ABBOTT LABORATORIES (ABT)","ABT-US,ABT","EDG"," 3:56pm","12-Feb-08"
"SVP HANCE Sells 6,744 of ABBOTT LABORATORIES (ABT)","ABT-US,ABT","EDG"," 3:55pm","12-Feb-08"
"SVP LANDGRAF Sells 30,300 of ABBOTT LABORATORIES (ABT)","ABT-US,ABT","EDG"," 3:53pm","12-Feb-08"
"SVP CHEN Sells 35,929 of ABBOTT LABORATORIES (ABT)","ABT-US,ABT","EDG"," 3:51pm","12-Feb-08"
"VP LINDER Sells 8,822 of ABBOTT LABORATORIES (ABT)","ABT-US,ABT","EDG"," 3:48pm","12-Feb-08"
"SVP PATTON JR Sells 912 of ABBOTT LABORATORIES (ABT)","ABT-US,ABT","EDG"," 3:47pm","12-Feb-08"
"EVP MICHAEL Sells 31,045 of ABBOTT LABORATORIES (ABT)","ABT-US,ABT","EDG"," 3:44pm","12-Feb-08"
"Dir ROBERTS Sells 9,427 of ABBOTT LABORATORIES (ABT)","ABT-US,ABT","EDG"," 3:42pm","12-Feb-08"
"EVP SCHUMACHER Sells 1,735 of ABBOTT LABORATORIES (ABT)","ABT-US,ABT","EDG"," 3:41pm","12-Feb-08"
"CEO WHITE Sells 109,000 of ABBOTT LABORATORIES (ABT)","ABT-US,ABT","EDG"," 3:37pm","12-Feb-08"
"CEO WHITE Sells 63,069 of ABBOTT LABORATORIES (ABT)","ABT-US,ABT","EDG"," 3:35pm","12-Feb-08"
"FDA discloses paragraph IV patent certifications","ABT-US,GSK-GB,NVS...","SA","12:57pm","11-Feb-08"
"Dir SMITHBURG Gifts 4,000 of ABBOTT LABORATORIES (ABT)","ABT-US,ABT","EDG","12:52pm","8-Feb-08"
"SVP LANDGRAF Gifts 765 of ABBOTT LABORATORIES (ABT)","ABT-US,ABT","EDG","12:48pm","8-Feb-08"
"CEO WHITE Gifts 16,488 of ABBOTT LABORATORIES (ABT)","ABT-US,ABT","EDG","12:46pm","8-Feb-08"
"Mylan restores availability of generic Levothyroxine in Florida","ABT-US,MYL-US","SA"," 5:04am","8-Feb-08"
"EVP FREYMAN Acquires 76 of ABBOTT LABORATORIES (ABT)","ABT-US,ABT","EDG"," 5:02pm","7-Feb-08"
"Bristol-Myers announces results from CASTLE study of Reyataz","ABT-US,BMY-US,NVS...","SA"," 3:12pm","6-Feb-08"
"Generic-drug firms taking more risks to stay competitive - WSJ","ABT-US,BRL,JNJ-US...","SA","11:58pm","5-Feb-08"
"AstraZeneca's Medimmune submits BLA for Motavizumab","ABT-US,AZN-GB","SA"," 9:02am","4-Feb-08"
"Abbott Labs gets French reimbursement ok for Xience stent--Dow Jones","ABT-US","SA"," 8:06am","1-Feb-08"
"Abbott 'Goes Red' to Educate Bay Area Women About Heart Disease","ABT","PRN"," 8:00am","1-Feb-08"
"Abbott consigue el reembolso en Francia del stent liberador de fármacos XIENCE(TM) V","ABT","PRNE"," 5:30am","1-Feb-08"
"Abbott 'Goes Red' to Educate Chicago-Area Women About Heart Disease","ABT","PRN"," 5:08am","1-Feb-08"
"Abbott Gains Reimbursement for XIENCE(TM) V Drug Eluting Stent in France","ABT-US,0890RW-E,ABT","PRNE"," 2:00am","1-Feb-08"
"Abbott obtient l'inscription au remboursement du stent actif XIENCE V","ABT","PRNE"," 2:00am","1-Feb-08"
"FDA warns of risk of suicidal thoughts with epilepsy drugs","ABT-US,GSK-GB,JNJ...","SA","10:23am","31-Jan-08"
"Abbott Molecular Inc agreed to acquire a minority stake in Ibis Biosciences Inc from Isis Pharmaceuticals Inc","VYSI-US,ISIS-US,A...","FFW"," 7:35am","31-Jan-08"
"Lev Pharmaceuticals receives complete response letter from FDA for Cinryze; Conference call at 8:30 today","ABT-US,DYAX-US,JI...","SA"," 5:28am","31-Jan-08"
"ISIS Pharmaceuticals announces equity investment in Ibis Biosciences subsidiary by Abbott (ABT)","ABT-US,ISIS-US","SA"," 4:13am","31-Jan-08"
"Follow-up: FDA revises data, Teva Pharmaceutical receives tentative approval for generic of Boehringer Ingelheim's Flomax","4503-JP,500359-IN...","SA"," 8:52am","30-Jan-08"
"Teva Pharmaceutical receives FDA approval for tamsulosin HCl 0.4mg Capsules","4503-JP,500359-IN...","SA"," 7:44am","30-Jan-08"
"Danish study finds Boston Scientific (BSX) and J&J (JNJ) drug-coated stents are equally effective at reducing heart attacks and deaths -- Bloomberg","ABT-US,ANPI,BSX-U...","SA"," 1:05pm","29-Jan-08"
"Abbott Laboratories(ABT) Schedules Merrill Lynch Global Pharmaceutical, Biotechnology & Medical Device Conference for 5-February-2008 10:20 AM ET","ABT-US","FCST"," 9:49am","29-Jan-08"
"Abbott Labs' Ross Nutritionals receives FDA warning letter dated 12-Dec","ABT-US","SA"," 6:43am","29-Jan-08"
"Abbott to Present at Merrill Lynch Healthcare Conference","ABT","PRN"," 6:00am","29-Jan-08"
"Preview of FDA decision on Lev Pharmaceuticals' Cinryze for hereditary angioedema","ABT-US,DYAX-US,JI...","SA","12:37pm","28-Jan-08"
"Abbott Labs reiterated top pick at RBC","ABT-US","SA"," 6:30am","28-Jan-08"
"Abbott's Kaletra(R) and Aluvia(R) (lopinavir/ritonavir) New Lower-Strength Tablet for Pediatric Use Receives Positive Opinion from EMEA","ABT","PRN"," 3:00am","28-Jan-08"
"DJ Abbott Laboratories Doc re. Form 3 and Form 8-K","ABT,US0028241000","DJRN","11:00pm","27-Jan-08"
"Barron's The Trader considers what the market needs to go higher, positive on Apple and defensive stocks","AAPL-US,ABK,ABT-U...","SA","10:20pm","26-Jan-08"
"UK to keep reimbursement for coated heart stents -- WSJ","ABT-US,ANPI,BSX-U...","SA"," 1:54pm","25-Jan-08"
"Wall Street News Alert: ERUC Is Thursday's Stock to Watch for January 24, 2008","ABT,COPI,ERUC,HUM","MW"," 6:33am","24-Jan-08"
"CALLSTREET REPORT: Abbott Laboratories(ABT-US), Q4 2007 Earnings Call, 23-January-2008 9:00 AM ET","ABT-US","FCST"," 8:05pm","23-Jan-08"
"Follow-up: Teva Pharmaceutical reports tentative FDA approval of generic Prevacid","4502-JP,ABT-US,TE...","SA"," 7:46am","23-Jan-08"
"Teva Pharmaceutical reports tentative approval of generic Prevacid","4502-JP,ABT-US,TE...","SA"," 7:37am","23-Jan-08"
"Abbott Labs CEO says currently not targeting any significant acquisitions -- Reuters","ABT-US","SA"," 6:44am","23-Jan-08"
"ABBOTT LABORATORIES files (8-K) Current report: Items 2.02 - Results of Operations, 9.01 - Financial Statements and Exhibits, for period end 23-Jan-08 (ABT-US)","ABT-US,ABT","EDG"," 5:42am","23-Jan-08"
"DJ Abbott Laboratories ABT 4Q EARNINGS RESULT","ABT,US0028241000","DJRN"," 5:17am","23-Jan-08"
"Follow up: Abbott Labs reports Q4 drug sales","ABT-US","SA"," 4:46am","23-Jan-08"
"Abbott Labs reports Q4 EPS $0.93 ex-items vs Reuters $0.92","ABT-US","SA"," 4:43am","23-Jan-08"
